call_transcript,mood,agent_number,intention,resolution
"[Phone ringing]

Agent 1: Thank you for calling HealthHarbor, my name is Agent 1. How can I assist you today?

Customer: Hi, Agent 1. My name is Emma Johnson. I'm calling because I've been experiencing some concerning symptoms lately and I was hoping to get some medical advice or assessment.

Agent 1: Hi, Emma. I'm sorry to hear that you're not feeling well. I'll do my best to assist you. Can you please describe your symptoms in detail?

Customer: Sure. I've been having a persistent headache for the past week. It's a dull ache that doesn't seem to go away with over-the-counter painkillers. I've also been feeling unusually fatigued and have been having trouble sleeping.

Agent 1: I understand, Emma. Headaches can be quite bothersome. Have you noticed any other symptoms, such as nausea, dizziness, or sensitivity to light?

Customer: No, I haven't experienced any of those symptoms. It's mainly just the headache and fatigue that are concerning me.

Agent 1: Alright, Emma. Based on what you've described, it's possible that your headache and fatigue could be related. However, I'm not a medical professional, so it's important that you consult with a healthcare provider for an accurate diagnosis. They may want to run some tests or ask you more specific questions to determine the cause of your symptoms.

Customer: I understand. I was just hoping to get some initial advice before deciding whether to see a doctor.

Agent 1: I completely understand, Emma. It's always a good idea to seek professional medical advice, especially when symptoms persist. In the meantime, I can provide you with some general tips to manage your symptoms. Would that be helpful?

Customer: Yes, please. I would appreciate any advice you can give me.

Agent 1: Firstly, make sure you're getting enough rest and practicing good sleep hygiene. Establish a consistent sleep schedule and create a relaxing bedtime routine. Additionally, try to reduce stress as much as possible, as it can contribute to headaches and fatigue. Engaging in relaxation techniques like deep breathing exercises or yoga may help.

Customer: Thank you for the suggestions, Agent 1. I'll definitely try to implement those.

Agent 1: You're welcome, Emma. Additionally, it's important to stay hydrated and maintain a balanced diet. Sometimes dehydration or nutritional deficiencies can contribute to headaches and fatigue. Make sure you're drinking enough water throughout the day and consuming a variety of nutrient-rich foods.

Customer: I'll keep that in mind. Is there anything else I should be aware of?

Agent 1: Another thing to consider is your posture and eye strain. Poor posture or spending long hours in front of screens can contribute to headaches. Try to maintain good posture and take frequent breaks if you're working on a computer or using electronic devices for extended periods.

Customer: That's helpful advice, thank you. I'll be more mindful of my posture and take breaks when needed.

Agent 1: You're welcome, Emma. Is there anything else I can assist you with?

Customer: Not at the moment, Agent 1. I appreciate your help and advice. I'll make an appointment with a healthcare provider to further investigate my symptoms.

Agent 1: That sounds like a good plan, Emma. It's always better to be safe and consult with a professional. If you have any more questions or concerns in the future, don't hesitate to reach out to us again. Take care and I hope you feel better soon.

Customer: Thank you, Agent 1. I will. Goodbye.

Agent 1: Goodbye, Emma. Have a great day.",neutral,1,Medical Advice or Symptom Assessment,unresolved
"Agent 3: Thank you for calling HealthHarbor, my name is Agent 3. How can I assist you today?

Customer: Hi, Agent 3. I'm really worried about my health and I need to schedule an appointment with a doctor as soon as possible.

Agent 3: I understand your concern. Don't worry, we're here to help. May I have your name please?

Customer: Yes, my name is Sarah Thompson.

Agent 3: Thank you, Sarah. Before we proceed, could you please provide me with your date of birth and contact number?

Customer: Sure, my date of birth is January 15, 1985, and my contact number is 555-123-4567.

Agent 3: Thank you, Sarah. Now, can you please describe your symptoms or the reason for scheduling this appointment?

Customer: Well, I've been experiencing severe headaches and dizziness for the past couple of weeks. It's really affecting my daily life, and I'm concerned it might be something serious.

Agent 3: I understand how concerning that can be. Let me check the availability of our doctors for you. Could you please hold on for a moment?

Customer: Of course, take your time. I appreciate your help.

Agent 3: Thank you for your patience, Sarah. I have found a few available slots for you. We have an opening tomorrow at 2:00 PM with Dr. Johnson, or we can schedule you for the day after tomorrow at 10:00 AM with Dr. Anderson. Which one would you prefer?

Customer: I would prefer the earliest appointment possible. So, tomorrow at 2:00 PM with Dr. Johnson sounds good.

Agent 3: Alright, I've scheduled you for tomorrow at 2:00 PM with Dr. Johnson. Is there anything else I can assist you with?

Customer: Actually, I have a few more questions. Will I need to bring any medical records or previous test results for the appointment?

Agent 3: Yes, it would be helpful if you could bring any relevant medical records or test results, especially if you've had any previous tests related to your symptoms. It will assist the doctor in understanding your medical history better.

Customer: Okay, I will make sure to gather all the necessary documents before the appointment. Thank you for letting me know.

Agent 3: You're welcome, Sarah. Is there anything else I can help you with?

Customer: No, that will be all for now. Thank you for your assistance, Agent 3.

Agent 3: It was my pleasure, Sarah. I hope your appointment goes well, and if you have any further questions or concerns, don't hesitate to reach out to us. Take care!

Customer: Thank you, Agent 3. Goodbye.

Agent 3: Goodbye, Sarah. Have a great day!",worried,3,Appointment Scheduling,resolved
"Agent 4: Thank you for calling HealthHarbor, my name is Agent 4. How may I assist you today?

Customer: Finally! I've been trying to get my medical records for weeks now, and I'm really angry at this point. I need them urgently for my new doctor.

Agent 4: I apologize for the inconvenience, sir. I understand your frustration. We are here to help you. May I have your name and date of birth, please?

Customer: My name is John Smith and my date of birth is January 15th, 1980.

Agent 4: Thank you, Mr. Smith. Let me check our system for your medical records. Can you please provide me with the reason you need these records?

Customer: I'm switching doctors and my new doctor requires all my previous medical records to properly continue my treatment.

Agent 4: I see. That's an important request. I'm sorry for the delay you've experienced. It seems that we need to update our system to better serve our patients. I'll make sure to address this issue with our management. In the meantime, let me check the status of your records.

Customer: Thank you. I hope you understand how frustrating this has been for me.

Agent 4: I completely understand, Mr. Smith. Your satisfaction is important to us. It seems that your records are ready, but we need your consent to release them to your new doctor. Could you please provide us with the contact information for your new doctor?

Customer: Sure, the name of my new doctor is Dr. Emily Johnson, and her clinic is located at 123 Main Street.

Agent 4: Thank you for providing the information, Mr. Smith. I will now initiate the process of sending your medical records to Dr. Johnson's clinic. This should be completed within 48 hours. Is there anything else I can assist you with today?

Customer: No, that will be all. I appreciate your help in resolving this matter. I hope I won't encounter such delays in the future.

Agent 4: I completely understand your concern, Mr. Smith. We will take your feedback into consideration to improve our processes. Thank you for bringing this to our attention. If you have any further questions or need assistance in the future, please don't hesitate to contact us. Have a great day!

Customer: Thank you. Goodbye.",angry,4,Medical Records Requests,resolved
"Agent 2: Thank you for calling HealthHarbor, my name is Agent 2. How can I assist you today?

Customer: Hi Agent 2, my name is Emma Johnson. I'm calling because I'm looking for some information about your healthcare facility, HealthHarbor.

Agent 2: Hello Emma, it's nice to speak with you. I'll be happy to provide you with the information you need. How can I assist you specifically?

Customer: Well, I wanted to know what kind of medical services are offered at HealthHarbor. Can you give me an overview?

Agent 2: Absolutely, Emma. HealthHarbor is a comprehensive healthcare facility that offers a wide range of medical services. We have departments for general medicine, pediatrics, gynecology, orthopedics, cardiology, and more. We provide both outpatient and inpatient services, as well as emergency care.

Customer: That's great to know. What about specialized services? Do you offer any?

Agent 2: Yes, Emma. HealthHarbor has several specialized services as well. We have a dedicated cancer center, a state-of-the-art imaging department, a rehabilitation center, and a specialized unit for surgeries. We also offer mental health services and have a team of psychiatrists and psychologists.

Customer: That sounds very comprehensive. How about the availability of doctors and specialists?

Agent 2: We have a team of highly qualified and experienced doctors and specialists at HealthHarbor, Emma. They are available round the clock to provide the necessary medical care. We ensure that all our patients receive personalized attention and care from our healthcare professionals.

Customer: That's reassuring to hear. What about the facilities and amenities at HealthHarbor?

Agent 2: HealthHarbor is a modern healthcare facility equipped with state-of-the-art medical technology. We have advanced diagnostic equipment, well-equipped operation theaters, and comfortable patient rooms. We also have a cafeteria, a pharmacy, and parking facilities for the convenience of our patients and their families.

Customer: That's impressive. I also wanted to know if HealthHarbor accepts insurance plans?

Agent 2: Yes, Emma. HealthHarbor works with most major insurance providers. We accept a wide range of insurance plans to ensure that our patients can access the medical care they need without any financial burden. However, I would recommend contacting your insurance provider to confirm coverage before seeking treatment.

Customer: Thank you for that information. One last question, do you have any patient testimonials or reviews that I could refer to?

Agent 2: Absolutely, Emma. We have a dedicated section on our website where you can find patient testimonials and reviews. It's always good to hear from our patients about their experiences at HealthHarbor. Additionally, we have a high patient satisfaction rate, which reflects the quality of care we provide.

Customer: That's great to hear. Thank you so much for all the information, Agent 2. You've been very helpful.

Agent 2: You're welcome, Emma. I'm glad I could assist you. If you have any more questions or if there's anything else I can help you with, please feel free to reach out. Have a great day!

Customer: Thank you, Agent 2. I appreciate your assistance. Have a great day too! Goodbye.

Agent 2: Goodbye, Emma. Take care!",neutral,2,Healthcare Facility Information,resolved
"Agent 3: Thank you for calling HealthHarbor. This is Agent 3. How can I assist you today?

Customer: Hi, Agent 3. My name is Emma Walters. I'm calling to inquire about medication refills and prescription inquiries.

Agent 3: Hi, Emma. I'm here to help you with that. Can you please provide me with your date of birth and address for verification purposes?

Customer: Sure. My date of birth is January 15, 1985, and my address is 123 Oak Street, Anytown.

Agent 3: Thank you for providing that information, Emma. Now, could you please let me know which medications you need refills for?

Customer: I need refills for my blood pressure medication and my cholesterol-lowering medication.

Agent 3: Alright, let me check your records. Can you please confirm the names and dosages of the medications?

Customer: Sure. The blood pressure medication is called Lisinopril, and I take a 10mg dosage daily. The cholesterol-lowering medication is Atorvastatin, and I take a 20mg dosage daily.

Agent 3: Thank you for confirming that, Emma. I see that your prescriptions are due for a refill. I will send a request to your primary care physician to authorize the refill. Please note that it may take up to 48 hours for the request to be processed.

Customer: That's fine, Agent 3. I understand. Is there anything else I need to do?

Agent 3: No, Emma. Once your physician approves the refill, the prescription will be sent to your preferred pharmacy. You can then pick it up from there.

Customer: Great, thank you. While I have you on the line, I have a question about a different prescription.

Agent 3: Of course, Emma. What is your question?

Customer: I recently started taking a new medication for my allergies, and I've been experiencing some side effects. I'm not sure if it's normal or if I should be concerned.

Agent 3: I'm sorry to hear that, Emma. Can you please provide me with the name of the medication and describe the side effects you're experiencing?

Customer: The medication is called Zyrtec, and I've been having drowsiness and dry mouth since I started taking it.

Agent 3: Thank you for sharing that information, Emma. It's common to experience drowsiness and dry mouth as side effects of Zyrtec. However, if these side effects persist or become severe, it would be best to consult with your prescribing physician.

Customer: Alright, I will do that. Thank you for your help, Agent 3.

Agent 3: You're welcome, Emma. Is there anything else I can assist you with today?

Customer: No, that's all for now. Thank you for your assistance.

Agent 3: It was my pleasure assisting you, Emma. If you have any further questions or concerns, don't hesitate to give us a call. Have a great day!

Customer: Thank you, Agent 3. You too. Goodbye!

Agent 3: Goodbye, Emma. Take care!",neutral,3,Medication Refills and Prescription Inquiries,resolved
"Agent 4: Thank you for calling HealthHarbor, my name is Agent 4. How can I assist you today?

Customer: Finally, someone picks up! I've been on hold for ages. I'm so frustrated with your hospital's billing department!

Agent 4: I apologize for the wait and any inconvenience caused. I understand you're having trouble with our billing department. I'm here to help. Could you please provide me with your name and account number?

Customer: My name is John Smith and my account number is 123456789.

Agent 4: Thank you, Mr. Smith. How can I assist you with your billing concerns today?

Customer: I received a bill from your hospital, and it's outrageous! I had a simple procedure, and yet the charges are exorbitant. I need an explanation for this.

Agent 4: I'm sorry to hear that you're unhappy with the charges, Mr. Smith. Let me take a look at your account and see if I can provide some clarity. Could you please give me a moment to access your records?

Customer: Fine, but make it quick. I've wasted enough time already.

Agent 4: Thank you for your patience, Mr. Smith. I can see that the charges on your bill are related to the procedure you underwent. However, I understand your concerns about the costs. Allow me to explain the breakdown of the charges and address any discrepancies.

Customer: Go ahead, but I doubt you'll be able to justify such high prices.

Agent 4: I understand your frustration, Mr. Smith. Firstly, I want to assure you that our hospital follows standard billing practices and adheres to all insurance guidelines. The charges include the procedure itself, as well as any necessary medications, equipment, and medical supplies used during your treatment.

Customer: But even so, shouldn't the charges be more reasonable? I've never seen such high prices for a simple procedure.

Agent 4: I completely understand your concern, Mr. Smith. Hospital charges can vary depending on a variety of factors, such as the complexity of the procedure, the resources utilized, and the overhead costs associated with maintaining a high-quality healthcare facility. Additionally, insurance coverage and deductibles can also impact the final out-of-pocket expenses.

Customer: Well, I still think it's unfair. Is there any way to negotiate these charges or reduce the amount?

Agent 4: I appreciate your request, Mr. Smith. While I understand your desire for a reduction, our hospital's charges are based on established rates and contracts with insurance companies. However, I can assist you by providing information on available payment plans or discussing any possible financial assistance programs that may be available to you.

Customer: Fine, let's talk about payment plans then. I can't afford to pay this huge bill all at once.

Agent 4: I completely understand, Mr. Smith. We offer flexible payment plans that can help you manage the cost of your bill. We can set up a monthly payment plan that fits within your budget. Would that be something you're interested in?

Customer: Yes, that would be helpful. Please set up a payment plan for me.

Agent 4: Certainly, Mr. Smith. I will need to gather some additional information from you to proceed. Could you please provide your preferred method of payment and the amount you're able to pay monthly?

Customer: I would like to pay via automatic bank transfer, and I can manage $200 per month.

Agent 4: Perfect, Mr. Smith. I will set up the payment plan for you, starting with the first payment due next month. You will receive a confirmation email with all the details. Is there anything else I can assist you with today?

Customer: No, that will be all. Thank you for your help, Agent 4. I appreciate your understanding and assistance.

Agent 4: You're welcome, Mr. Smith. I'm glad I could help resolve your concerns. If you have any further questions or need assistance in the future, please don't hesitate to contact us. Have a great day!

Customer: Thank you, Agent 4. Goodbye.",angry,4,Insurance and Billing Inquiries,resolved
"Agent 1: Good morning, thank you for calling HealthHarbor. My name is Agent 1. How can I assist you today?

Customer: Hi Agent 1, my name is Sarah Johnson. I'm calling for a follow-up on my recent hospital visit.

Agent 1: Good morning, Sarah. I hope you're feeling better now. How can I assist you with your follow-up?

Customer: Yes, thank you. I wanted to check if my test results are ready and if I need to schedule any further appointments.

Agent 1: I understand. Let me check your records. Can you please provide me with your date of birth and the date of your hospital visit?

Customer: Sure, my date of birth is June 15, 1985, and I visited the hospital on November 20, 2021.

Agent 1: Thank you for providing that information, Sarah. Let me check your records. It seems that your test results are ready, and there are no further appointments scheduled at the moment. However, I can help you understand your test results if you have any questions.

Customer: That's good to know. I do have a few questions regarding my test results. Can you explain them to me?

Agent 1: Of course, Sarah. I'll do my best to explain. Please note that I'm not a doctor, but I can provide some general information. Can you please let me know which specific test results you would like to discuss?

Customer: I had some blood work done, and I'm unsure about the cholesterol levels mentioned in the report. Can you help me understand what the numbers mean?

Agent 1: Sure, Sarah. Cholesterol levels are typically reported in milligrams per deciliter (mg/dL). There are two types of cholesterol mentioned in the report - LDL (low-density lipoprotein) and HDL (high-density lipoprotein). LDL cholesterol is commonly referred to as ""bad"" cholesterol, as higher levels can increase the risk of heart disease. HDL cholesterol is considered ""good"" cholesterol, as higher levels are associated with a lower risk of heart disease. It's important to maintain a healthy balance between the two. Do you have the specific numbers mentioned in your report?

Customer: Yes, my LDL cholesterol level is 150 mg/dL, and my HDL cholesterol level is 50 mg/dL.

Agent 1: Thank you for sharing that information, Sarah. In general, LDL cholesterol levels should ideally be below 100 mg/dL for most individuals. However, the target may vary depending on individual risk factors and medical history. On the other hand, HDL cholesterol levels should ideally be above 40 mg/dL in men and above 50 mg/dL in women. It's important to discuss these results with your primary care physician or a specialist who can provide personalized guidance based on your specific health needs.

Customer: I see. Thank you for explaining that, Agent 1. I will schedule an appointment with my primary care physician to discuss these results further. Is there anything else I need to be aware of from my hospital visit?

Agent 1: You're welcome, Sarah. Besides your test results, there doesn't seem to be any further information or follow-up required from your hospital visit. However, please make sure to follow any instructions provided by your healthcare provider and continue any prescribed medications. If you have any additional questions or concerns, feel free to reach out to us anytime.

Customer: Thank you for your assistance, Agent 1. I appreciate your help in understanding my test results and providing guidance. Have a great day!

Agent 1: You're welcome, Sarah. I'm glad I could help. If you have any more questions in the future, don't hesitate to contact us. Have a wonderful day as well! Goodbye!",neutral,1,Follow-up Calls and Care Management,resolved
"[Phone ringing]

Agent 3: Thank you for calling HealthHarbor, this is Agent 3. How can I assist you today?

Customer: Hi, this is John Smith. I would like to schedule an appointment at your hospital.

Agent 3: Of course, Mr. Smith. I'd be happy to help you with that. May I know what kind of appointment you need?

Customer: I need to see a specialist for a follow-up on my recent surgery.

Agent 3: I'm sorry to hear that, Mr. Smith. Let me check the availability of our specialists. Can you please provide me with your preferred date and time for the appointment?

Customer: I'm quite flexible with the date, but I would prefer a morning appointment if possible.

Agent 3: Alright, let me check the available options for you. Just give me a moment, please.

[Agent 3 checks the system]

Agent 3: I have a few options for you, Mr. Smith. We have availability next Tuesday at 9:00 AM or Thursday at 10:30 AM. Which one would you prefer?

Customer: Tuesday at 9:00 AM works for me. Please book that appointment for me.

Agent 3: Alright, I have scheduled your appointment for Tuesday at 9:00 AM. Is there anything else I can assist you with?

Customer: Actually, I have a few more questions. Will this appointment be covered by my insurance?

Agent 3: I understand your concern, Mr. Smith. To verify your insurance coverage, I'll need some information from you. Can you please provide me with your insurance policy number?

Customer: Sure, let me find it. It's ABC123456789.

Agent 3: Thank you, Mr. Smith. Let me check your insurance coverage for this appointment.

[Agent 3 verifies the insurance coverage]

Agent 3: I have checked your insurance coverage, and I'm happy to inform you that this appointment is covered under your policy. You won't have to worry about any out-of-pocket expenses.

Customer: That's great to hear! Thank you for checking that for me. One more question, will I need to bring any documents or reports for this appointment?

Agent 3: It's always a good idea to bring any relevant medical records or test results that you have, Mr. Smith. This will help the specialist have a better understanding of your case. If you have any specific reports related to your recent surgery, it would be beneficial to bring them along.

Customer: Okay, I'll make sure to gather all the necessary documents. Thank you for your help, Agent 3.

Agent 3: You're welcome, Mr. Smith. Is there anything else I can assist you with?

Customer: No, that's all for now. Thank you for your assistance. Goodbye.

Agent 3: You're welcome, Mr. Smith. If you have any further questions, feel free to reach out. Have a great day. Goodbye.

[Call ends]",neutral,3,Appointment Scheduling,unresolved
