call_transcript,mood,agent_number,intention,resolution
"Call Center Agent: Thank you for calling HealthHarbor, my name is Agent 4. How may I assist you today?

Customer: Hi, Agent 4. My name is Sarah Johnson. I need to inquire about medication refills and have a few questions about my prescriptions.

Agent 4: Of course, Sarah. I'd be happy to help you with that. Can you please provide me with your HealthHarbor ID or your date of birth for verification?

Customer: Sure, my date of birth is June 15, 1985.

Agent 4: Thank you, Sarah. I have pulled up your records. How can I assist you with your medication refills?

Customer: I have been taking a medication for my allergies, and it's about to run out. I need to know if I can get a refill.

Agent 4: I can definitely assist you with that. Let me check your prescription history. May I know the name of the medication you are referring to?

Customer: It's called AllerX. I have been taking it for the past year.

Agent 4: Thank you for providing the details, Sarah. Let me check if you are due for a refill. Please bear with me for a moment.

(Customer and Agent 4 wait for a moment while the agent checks the system.)

Agent 4: I see that you have one refill left for AllerX. Would you like me to go ahead and process the refill for you?

Customer: Yes, please. That would be great.

Agent 4: Noted, Sarah. I have processed the refill for you. It will be available for pick-up at your preferred pharmacy within 24 hours. Is there anything else I can assist you with regarding your medication refills?

Customer: Actually, I have another question. I recently started taking a new medication, but I'm experiencing some side effects. I'm not sure if it's normal or if I should be concerned.

Agent 4: I understand your concern, Sarah. I can provide you with some general information, but please keep in mind that I'm not a doctor. It's always best to consult with your healthcare provider regarding any side effects you may be experiencing. That being said, I'll do my best to help you. Can you please provide me with the name of the medication?

Customer: It's called SleepEase. I've been having trouble falling asleep lately, so my doctor prescribed it to me.

Agent 4: Thank you for sharing that information, Sarah. SleepEase is commonly prescribed for sleep-related issues. Some common side effects include drowsiness, dizziness, and dry mouth. However, if you are experiencing severe side effects or any symptoms that concern you, it's important to reach out to your doctor for further guidance.

Customer: Alright, I appreciate your advice. I will contact my doctor if the side effects continue. Thank you for your help.

Agent 4: You're welcome, Sarah. I'm glad I could assist you. Is there anything else I can help you with today?

Customer: No, that's all for now. Thank you again for your assistance, Agent 4.

Agent 4: You're welcome, Sarah. If you have any further questions or need assistance in the future, don't hesitate to reach out. Have a great day!

(Customer and Agent 4 exchange pleasantries and end the call.)",neutral,4,Medication Refills and Prescription Inquiries,unresolved
"[Phone ringing]

Agent 4: Thank you for calling HealthHarbor, my name is Agent 4. How can I assist you today?

Customer (angry): Finally! I've been on hold for ages! I need to schedule an appointment with a doctor immediately!

Agent 4: I apologize for the long wait. I understand your frustration. My name is Agent 4, and I'll do my best to assist you. May I have your name, please?

Customer: My name is Sarah Thompson.

Agent 4: Thank you, Sarah. Before we proceed, can you please provide me with your date of birth and contact information?

Customer: Fine. My date of birth is January 15, 1985, and my phone number is 555-123-4567.

Agent 4: Thank you for providing your information, Sarah. Now, can you please let me know the reason for your appointment?

Customer: I've been experiencing severe abdominal pain for the past few days, and I'm really worried. I need to see a doctor as soon as possible!

Agent 4: I understand your concern, Sarah. I'll do my best to help you. Let me check the availability of our doctors. Can you please hold for a moment?

Customer: Fine, but make it quick!

[Agent 4 puts the customer on hold and checks the doctor's availability]

Agent 4: Thank you for holding, Sarah. I apologize for the wait. I have an available appointment tomorrow at 10:00 AM with Dr. Johnson. Would that work for you?

Customer: Tomorrow? That's not good enough! I need to see a doctor today!

Agent 4: I understand your urgency, Sarah. Let me see if there are any same-day appointments available. Please hold for a moment.

[Agent 4 puts the customer on hold again and checks for same-day appointments]

Agent 4: Sarah, I apologize for the inconvenience, but we don't have any available same-day appointments at the moment. However, I can put you on a priority list in case there are any cancellations. Would you like me to do that?

Customer: This is ridiculous! I can't wait any longer! I need to see a doctor now! Can't you do anything?

Agent 4: I apologize for the inconvenience, Sarah. I'll escalate your request to our scheduling team and see if there's anything they can do. Please hold for a moment while I transfer you.

[Agent 4 transfers the call to the scheduling team]

Customer: (muttering angrily)

Agent 4: Sarah, I have transferred your call to our scheduling team. They will assist you further and try to accommodate your request. Is there anything else I can help you with?

Customer: No, just get this sorted quickly!

Agent 4: I understand, Sarah. I apologize for the inconvenience caused. Our scheduling team will assist you shortly. Thank you for your patience.

[Call ends]",angry,4,Appointment Scheduling,unresolved
"Agent 3: Thank you for calling HealthHarbor, my name is Agent 3. How may I assist you today?

Customer: Hi, Agent 3. I'm calling because I need some referrals and assistance with scheduling specialist appointments.

Agent 3: Of course, I'll be happy to help you with that. May I have your name, please?

Customer: My name is Sarah Smith.

Agent 3: Thank you, Sarah. How can I assist you with referrals today?

Customer: I've been experiencing some back pain lately, and I think I might need to see a specialist. Can you help me find one?

Agent 3: Of course, Sarah. I'm sorry to hear about your back pain. Let me pull up our database to find a suitable specialist for you. Can you please provide me with your insurance information?

Customer: Sure, my insurance provider is BlueCross BlueShield, and my member ID is 12345678.

Agent 3: Thank you for providing that information, Sarah. Let me check for specialists in your area who accept your insurance. Could you please tell me your location?

Customer: I live in Boston, Massachusetts.

Agent 3: Great, let me search for specialists in your area. I found a few options for you. Dr. John Anderson specializes in orthopedics and has availability next week. Dr. Emily Roberts is a neurologist and has availability in two weeks. Which one would you prefer to see?

Customer: I think I'll go with Dr. John Anderson, the orthopedic specialist. Can you please schedule an appointment for me?

Agent 3: Absolutely, Sarah. I will contact Dr. Anderson's office and check for available dates. Can I call you back within the next hour to confirm the appointment?

Customer: Yes, that works for me. Thank you for your help.

Agent 3: You're welcome, Sarah. I will contact you shortly to finalize the appointment with Dr. Anderson. Is there anything else I can assist you with?

Customer: No, that's all for now. Thank you again for your assistance.

Agent 3: It was my pleasure, Sarah. If you have any further questions or need any additional help, please don't hesitate to call us. Have a great day!

Customer: You too. Goodbye!

Agent 3: Goodbye, Sarah. Take care!",neutral,3,Referrals and Specialist Appointments,resolved
"Agent 4: Thank you for calling HealthHarbor, my name is Agent 4. How can I assist you today?

Customer: Hi, Agent 4. My name is Emily Johnson. I have been experiencing some discomfort lately and I'm not sure if I should be concerned.

Agent 4: Hi Emily, it's nice to meet you. I'm here to help. Can you please explain the symptoms you've been experiencing?

Customer: Sure. I've been having a persistent headache for the past few days, and I've also noticed some dizziness and occasional nausea.

Agent 4: I'm sorry to hear that, Emily. Headaches can be quite bothersome. Have you experienced any other symptoms along with these?

Customer: No, not really. Just the headache, dizziness, and nausea. I haven't had any fever or other noticeable symptoms.

Agent 4: Alright, thank you for clarifying. Based on your symptoms, it's possible that you may be experiencing a migraine. However, I'm not a doctor, and it's important to consult with a healthcare professional for a proper diagnosis. Have you considered scheduling an appointment with your primary care physician?

Customer: I haven't made an appointment yet. I wanted to get some advice before deciding if it's necessary.

Agent 4: I understand. It's always a good idea to seek medical advice when experiencing persistent symptoms. Headaches can have various causes, such as tension, dehydration, or even underlying medical conditions. It would be best to consult with a healthcare professional who can evaluate your symptoms in detail.

Customer: That makes sense. I'll go ahead and schedule an appointment with my doctor to get a proper evaluation. Thank you for your help, Agent 4.

Agent 4: You're welcome, Emily. I'm glad I could assist you. Is there anything else I can help you with today?

Customer: No, that was all. Thank you again for your guidance.

Agent 4: It was my pleasure, Emily. If you have any more questions or concerns in the future, don't hesitate to reach out. Take care and have a great day!

Customer: Thank you, Agent 4. You too. Goodbye.

Agent 4: Goodbye, Emily.",neutral,4,Medical Advice or Symptom Assessment,resolved
"Agent: Thank you for calling HealthHarbor, my name is Agent 2. How can I assist you today?

Customer: Finally, someone answered! I have been on hold for ages. I am so angry right now!

Agent: I apologize for the wait and any frustration it may have caused you. I understand you're feeling angry, but rest assured I'm here to help. What seems to be the issue?

Customer: I received a bill from your hospital, and it is completely outrageous! I can't believe how much you're charging me for a simple procedure. This is ridiculous!

Agent: I'm sorry to hear that you're unhappy with the bill. I'll do my best to assist you. May I have your name and account number, please?

Customer: My name is John Smith, and my account number is 123456789.

Agent: Thank you, Mr. Smith. I see your account here. Let me review the charges for the procedure you mentioned. Could you please provide me with the date of service?

Customer: It was on July 15th of this year.

Agent: Thank you for the information. I see the charge here. It appears to be for a complex procedure that required specialized equipment and additional medical staff. However, I understand your concern. Let me check if there are any billing errors or discrepancies.

(Customer waits on hold for a few moments)

Agent: Thank you for your patience, Mr. Smith. I have reviewed the charges, and I believe there might be a mistake. I will escalate this issue to our billing department for further investigation. They will get back to you within three business days to provide an update on the situation.

Customer: Three days? That's unacceptable! I want this resolved immediately.

Agent: I understand your frustration, Mr. Smith, and I apologize for any inconvenience caused. Unfortunately, the billing department requires some time to thoroughly investigate the matter. However, I can assure you that they will prioritize your case and provide you with a prompt resolution.

Customer: Fine, but I expect a call back within those three days. This whole situation has been a nightmare, and I shouldn't have to wait any longer for it to be resolved.

Agent: I completely understand your urgency, Mr. Smith, and I will note that in your file. Rest assured, someone from our billing department will contact you within the given timeframe. Is there anything else I can assist you with today?

Customer: No, that's all for now. But you better make sure this gets sorted out, or I'll be contacting my lawyer.

Agent: I apologize for any inconvenience caused, Mr. Smith, and I assure you we take this matter seriously. We will do everything we can to provide you with a satisfactory resolution. Thank you for bringing this to our attention, and have a good day.

Customer: We'll see about that. Goodbye.",angry,2,Insurance and Billing Inquiries,unresolved
"[Transcript]

Agent 4: Thank you for calling HealthHarbor. My name is Agent 4. How may I assist you today?

Customer: Hi, Agent 4. My name is Emma Smith. I'm calling to inquire about medication refills and prescription inquiries.

Agent 4: Hello, Emma. I'd be happy to assist you with that. Can you please provide me with your HealthHarbor patient ID or your date of birth for verification?

Customer: Sure. My date of birth is February 12, 1985.

Agent 4: Thank you for providing that information, Emma. How can I assist you with your medication refills and prescription inquiries today?

Customer: I have a few prescriptions that need to be refilled. Can you check if they are ready for refill?

Agent 4: Of course, Emma. Can you please provide me with the prescription numbers or the names of the medications?

Customer: I have two prescriptions. One is for a blood pressure medication, and the other is for a cholesterol-lowering drug. The prescription numbers are 123456 and 789012.

Agent 4: Thank you for providing the details, Emma. Let me check the availability of your refills. Please hold on for a moment.

[Agent 4 puts the customer on a brief hold to check the prescription refills]

Agent 4: I apologize for the wait, Emma. I have checked the availability of your refills, and both medications are ready for refill. Would you like us to deliver them to your home address?

Customer: Yes, please. That would be convenient. Can you confirm the delivery address on file?

Agent 4: Sure, Emma. I have your address listed as 123 Main Street, Cityville. Is that correct?

Customer: Yes, that's correct.

Agent 4: Great! Your medications will be delivered to your address within the next two business days. Is there anything else I can assist you with?

Customer: Actually, I have a question about one of my prescriptions. I've been experiencing some side effects, and I'm not sure if they are normal.

Agent 4: I understand your concern, Emma. Could you please provide me with more details about the side effects you've been experiencing?

Customer: I've been feeling dizzy and lightheaded since I started taking the blood pressure medication. Is this normal?

Agent 4: I'm not a doctor, Emma, but dizziness and lightheadedness can be potential side effects of certain blood pressure medications. It's always best to consult with your prescribing physician about any concerns or side effects you may be experiencing. They will be able to provide you with the best guidance and may suggest an alternative medication if needed.

Customer: Okay, I will reach out to my doctor then. Thank you for your help, Agent 4.

Agent 4: You're welcome, Emma. I'm glad I could assist you. If you have any further questions or need any more assistance in the future, please don't hesitate to reach out. Have a great day!

Customer: Thank you, Agent 4. You too. Goodbye.

Agent 4: Goodbye, Emma. Take care.",neutral,4,Medication Refills and Prescription Inquiries,resolved
"Agent 2: Thank you for calling HealthHarbor, my name is Agent 2. How can I assist you today?

Customer: (Angry) Finally, someone answers! I've been trying to get through to your hospital for days. I need to request my medical records and no one seems to be able to help me.

Agent 2: I apologize for the wait and any inconvenience caused. I understand your frustration. I'll do my best to assist you with your medical records request. May I have your name and date of birth, please?

Customer: My name is Sarah Johnson and my date of birth is March 12, 1985. It shouldn't be this difficult to get my own medical records!

Agent 2: I apologize for the difficulties you've faced, Sarah. Rest assured, I'll help you through the process. Can you please provide me with some additional information? Which specific medical records are you looking to request?

Customer: I need my complete medical history from the past five years. I'm switching doctors and they require all of my previous records.

Agent 2: I understand the urgency, Sarah. To expedite the process, I'll need you to fill out a Medical Records Request Form. Is it possible for me to email you the form?

Customer: Fine, but make it quick. I don't have time to waste.

Agent 2: I completely understand, Sarah. I'll send the form to the email address we have on file. Please check your inbox and fill out the necessary information. Once you've completed the form, please send it back to us as soon as possible.

Customer: Alright, I've received the email. Let me fill out this form. How long will it take for my medical records to be sent to my new doctor?

Agent 2: Once we receive the completed form, it usually takes around 3-5 business days for us to process the request and send your medical records to your new doctor. However, please note that the exact timeframe may vary depending on the volume of requests we're currently handling.

Customer: That's too long! I need them sooner than that. Can you expedite the process?

Agent 2: I understand your urgency, Sarah. Let me check if there's any possibility to expedite your request. Please bear with me for a moment.

(Customer on hold for a few minutes)

Agent 2: Thank you for your patience, Sarah. I've spoken with our medical records department, and they have agreed to prioritize your request. Your medical records will be sent to your new doctor within the next 48 hours.

Customer: Finally, some progress! I appreciate your help in expediting this. Is there anything else I need to do?

Agent 2: No problem, Sarah. I'm glad I could assist you. Just ensure that the completed form is sent back to us as soon as possible. If you have any further questions or concerns, feel free to reach out to us. Is there anything else I can assist you with today?

Customer: No, that's all for now. Thank you for your help.",angry,2,Medical Records Requests,resolved
"Agent 3: Thank you for calling HealthHarbor, my name is Agent 3. How may I assist you today?

Customer: Hi Agent 3, my name is Emily Johnson. I'm calling to gather information about the services provided by HealthHarbor.

Agent 3: Hello Emily, I'm glad you reached out to us. We offer a wide range of medical services at HealthHarbor. Could you please let me know what specific information you are looking for?

Customer: I'm mainly interested in knowing about the specialized departments in your hospital. Can you give me an overview?

Agent 3: Absolutely, Emily. HealthHarbor has various specialized departments such as cardiology, neurology, orthopedics, oncology, gastroenterology, and many others. Each department has a team of highly skilled doctors and nurses who specialize in their respective fields.

Customer: That sounds impressive. Are there any specific services or treatments that HealthHarbor is known for?

Agent 3: Yes, indeed. HealthHarbor is renowned for its cardiac care, including treatments for heart diseases and surgeries. We also have a comprehensive cancer center that provides advanced oncology services. Additionally, our neurology department specializes in neurosurgery and treatment of neurological disorders.

Customer: That's great to know. How about emergency services? Does HealthHarbor have a dedicated emergency department?

Agent 3: Absolutely, Emily. HealthHarbor has a fully equipped emergency department that operates 24/7. We have a team of emergency physicians, nurses, and support staff who are trained to handle all kinds of medical emergencies.

Customer: That's reassuring. I also wanted to inquire about the availability of diagnostic services like imaging and laboratory tests.

Agent 3: We have state-of-the-art diagnostic facilities at HealthHarbor. Our imaging department offers services like X-rays, CT scans, MRIs, and ultrasound. We also have a fully functional laboratory for various tests and screenings.

Customer: That's good to hear. And what about the availability of specialists? Can I easily get an appointment with a specific doctor?

Agent 3: We strive to ensure timely access to our specialists, Emily. While availability may vary based on the doctor's schedule, we make every effort to accommodate patients' preferences. Our appointment scheduling team will work with you to find a suitable time for your visit.

Customer: That's reassuring. One more question, are there any support services available for patients and their families?

Agent 3: Absolutely, Emily. At HealthHarbor, we understand the importance of holistic care. We have a range of support services, including nutrition counseling, physical therapy, mental health counseling, and social work services. We believe in providing comprehensive care to our patients.

Customer: That's wonderful to know. I appreciate your help in providing all this information, Agent 3.

Agent 3: You're welcome, Emily. It was a pleasure assisting you. If you have any more questions in the future or need any further assistance, feel free to reach out to us. Have a great day!

Customer: Thank you, Agent 3. I will definitely keep HealthHarbor in mind. Have a great day too! Goodbye!

Agent 3: Goodbye, Emily. Take care!",neutral,3,Healthcare Facility Information,resolved
"Agent 3: Thank you for calling HealthHarbor. My name is Agent 3. How can I assist you today?

Customer: Finally, someone answered! I've been on hold forever! I need some referrals and specialist appointments, and I'm not happy with the service I've been receiving.

Agent 3: I apologize for the wait and any inconvenience caused. I understand that you're looking for referrals and specialist appointments. I'll do my best to assist you. Can you please provide me with your name and date of birth?

Customer: My name is Karen Thompson, and my date of birth is January 15, 1980.

Agent 3: Thank you, Karen. I'm sorry to hear that you're unhappy with our service. Could you please let me know what specific issues you've been facing?

Customer: Well, I've been trying to get a referral to a specialist for my back pain, but I keep getting passed around from one department to another. It's incredibly frustrating!

Agent 3: I apologize for the inconvenience, Karen. I understand your frustration, and I'll make sure to address this issue promptly. Let me check your records and see what I can do for you. Please bear with me for a moment.

(Customer waits for a few minutes)

Agent 3: Thank you for your patience, Karen. I see that you've been referred to a general practitioner for your back pain. However, I understand that you're seeking a specialist. Is that correct?

Customer: Yes, that's correct! I've already seen a general practitioner, and they recommended me to a specialist. But I haven't received any information or appointment details.

Agent 3: I apologize for the oversight, Karen. I'll prioritize this issue and make sure you receive the necessary information and appointment details as soon as possible. Can I have the name of the specialist you were referred to?

Customer: Yes, it's Dr. Smith at the Spine Center.

Agent 3: Thank you, Karen. I'll contact Dr. Smith's office immediately and request an appointment for you. Could you please provide me with your preferred contact number and email address?

(Customer provides the contact details)

Agent 3: Thank you for providing the information, Karen. I'll personally follow up with Dr. Smith's office and ensure that they schedule an appointment for you. You should receive a confirmation call or email within the next 24 hours.

Customer: Finally, some progress! I appreciate your help, Agent 3. I hope this gets resolved soon.

Agent 3: I understand your frustration, Karen, and I apologize for any inconvenience caused. Rest assured, I'll personally monitor this issue and keep you updated on the progress. Is there anything else I can assist you with today?

Customer: No, that's all for now. I just hope this gets sorted out soon.

Agent 3: I understand, Karen. We'll do everything we can to expedite the process. If you have any other concerns or questions in the future, don't hesitate to reach out to us. Thank you for choosing HealthHarbor, and have a great day!

Customer: Thank you, Agent 3. Goodbye.

Agent 3: Goodbye, Karen. Take care.",angry,3,Referrals and Specialist Appointments,resolved
