call_transcript,mood,agent_number,intention,resolution
"Agent 4: Thank you for calling HealthHarbor, my name is Agent 4. How may I assist you today?

Customer: Hi, Agent 4. My name is Sarah Johnson. I have some questions regarding insurance and billing.

Agent 4: Hello, Sarah. I'll be happy to help you with your inquiries. What specific questions do you have?

Customer: Well, I recently received a bill from the hospital, and I'm not sure what it's for. Can you help me understand the charges?

Agent 4: Of course, Sarah. I'd be happy to look into that for you. Can you please provide me with your account number?

Customer: Sure, it's 12345678.

Agent 4: Thank you, Sarah. Let me pull up your account. I see here that the bill is for a recent visit you had to our hospital. It includes charges for the medical services you received during your visit.

Customer: Okay, but I thought my insurance would cover most of the expenses. Why am I being billed for it?

Agent 4: I understand your concern, Sarah. It's important to note that insurance coverage varies based on the type of plan you have. Some services may not be fully covered, or you may have a deductible or co-pay that needs to be met.

Customer: I see. So, how can I find out what my insurance covers and what I'm responsible for?

Agent 4: That's a great question, Sarah. I recommend reaching out to your insurance provider directly to understand your coverage details. They can provide you with a breakdown of what services are covered and any out-of-pocket expenses you may be responsible for.

Customer: Alright, I'll contact my insurance provider then. But before I do, can you give me an estimate of how much I owe for this particular visit?

Agent 4: I can certainly help with that, Sarah. Let me check your account. Based on the insurance information we have on file, your estimated out-of-pocket expenses for this visit amount to $200. However, please note that this is just an estimate, and your actual responsibility may vary depending on your insurance coverage.

Customer: Okay, I will keep that in mind. Thank you for the information. I have one more question. Can I set up a payment plan for this bill?

Agent 4: Absolutely, Sarah. We understand that medical bills can sometimes be overwhelming. We offer flexible payment plans to assist our patients. To set up a payment plan, I recommend contacting our billing department directly. They will be able to discuss the available options and assist you in setting up a plan that suits your needs.

Customer: That's great to know. I will reach out to the billing department then. Thank you for your assistance, Agent 4.

Agent 4: You're welcome, Sarah. I'm glad I could help. If you have any further questions or need any additional assistance, please don't hesitate to reach out. We're here to support you.

Customer: I appreciate that, Agent 4. Have a great day!

Agent 4: You too, Sarah. Take care and have a wonderful day! Goodbye.",neutral,4,Insurance and Billing Inquiries,resolved
"Agent 4: Thank you for calling HealthHarbor, my name is Agent 4. How can I assist you today?

Customer (angry): Finally! I've been on hold for ages. I need to request my medical records immediately!

Agent 4: I apologize for the wait, and I understand your urgency. I'll do my best to assist you. May I have your full name please?

Customer: It's John Smith.

Agent 4: Thank you, Mr. Smith. Can you please provide me with your date of birth and the reason for your medical records request?

Customer: My date of birth is January 15, 1980. I need these records because I'm switching doctors, and they require my complete medical history.

Agent 4: I see. I'm sorry for any inconvenience caused. In order to process your request, I'll need you to complete a Medical Records Release Form. This form can be filled out online on our website or mailed to you. Which option would you prefer?

Customer: I don't have time for that! Just send me the form right now through email.

Agent 4: I apologize again, Mr. Smith, but for security reasons, we cannot send sensitive medical information via email. However, I can expedite the process for you. If you have access to a fax machine, I can send the form directly to your doctor's office.

Customer (frustrated): This is ridiculous! I don't have a fax machine. Can't you just email it to me?

Agent 4: I understand your frustration, but our priority is to protect your personal information. Alternatively, you can visit our hospital's Medical Records Department in person and complete the form there.

Customer: Are you kidding me? I'm already switching doctors, and now I have to waste my time visiting your hospital as well? This is unacceptable!

Agent 4: I apologize for any inconvenience caused, Mr. Smith. I understand your frustration, and I assure you that we are doing our best to ensure the security and confidentiality of your medical records. If you'd like, I can connect you with a supervisor who may be able to provide alternative solutions.

Customer (angry): Fine, connect me to your supervisor! This is a complete waste of my time.

Agent 4: I apologize for the inconvenience, Mr. Smith. Please hold the line while I transfer you to a supervisor who will be able to assist you further.

[The call is placed on hold, and the customer waits to be connected to a supervisor.]",angry,4,Medical Records Requests,unresolved
"Agent 1: Thank you for calling HealthHarbor. My name is Agent 1. How can I assist you today?

Customer: Hi, Agent 1. My name is John Smith. I need to schedule an appointment with a specialist at your hospital.

Agent 1: Of course, Mr. Smith. Can you please provide me with your date of birth and contact information?

Customer: Sure. My date of birth is January 15, 1980. My phone number is 555-123-4567.

Agent 1: Thank you, Mr. Smith. Now, which specialist are you looking to see?

Customer: I need to see a cardiologist. I've been experiencing some chest pain lately, and I want to get it checked out.

Agent 1: I'm sorry to hear that. We definitely want to make sure you receive the necessary care. Are you currently a patient at HealthHarbor?

Customer: No, this would be my first visit to your hospital.

Agent 1: Not a problem. Let me check our availability for appointments with cardiologists. Can you please hold for a moment?

Customer: Sure, take your time.

Agent 1: Thank you for holding, Mr. Smith. I have a few options available for you. We have an appointment available with Dr. Johnson on Monday, October 5th, at 2:00 PM. Would that work for you?

Customer: Yes, that sounds fine. Please go ahead and schedule it for me.

Agent 1: Great! I have scheduled your appointment with Dr. Johnson on Monday, October 5th, at 2:00 PM. Is there anything else I can assist you with?

Customer: Actually, yes. I have some medical records from a previous doctor that I'd like to share with Dr. Johnson. How can I do that?

Agent 1: That's not a problem, Mr. Smith. You can either bring them with you on the day of your appointment, or you can email them to us prior to your visit. Would you like me to provide you with the email address?

Customer: Yes, please. I think emailing them would be more convenient. 

Agent 1: Absolutely. Please send your medical records to records@healthharbor.com. Make sure to include your full name and date of birth in the email for identification purposes.

Customer: Got it. I'll send them right away. Thank you for your help.

Agent 1: You're welcome, Mr. Smith. Is there anything else I can assist you with today?

Customer: No, that's all. Thank you again for your assistance.

Agent 1: It was my pleasure, Mr. Smith. We look forward to seeing you on Monday, October 5th. Have a great day!

Customer: Thank you. Goodbye.

Agent 1: Goodbye, Mr. Smith. Take care.",neutral,1,Appointment Scheduling,resolved
"[Phone ringing]

Agent 2: Thank you for calling HealthHarbor, my name is Agent 2. How can I assist you today?

Customer: Hi, Agent 2. My name is Sarah Johnson. I recently visited HealthHarbor and I have some concerns about my follow-up care. I'm feeling really scared and anxious about my condition.

Agent 2: Hi, Sarah. I'm sorry to hear that you're feeling scared. Let me assure you that we're here to help you. Can you please provide me with your date of visit and any specific concerns you have?

Customer: Thank you, Agent 2. I visited HealthHarbor on October 15th, and I recently received some test results that were concerning. I'm worried about what they mean and what steps I should take next.

Agent 2: I understand your concerns, Sarah. Let me pull up your medical records and review the test results. Please bear with me for a moment.

[Short pause]

Agent 2: Thank you for your patience, Sarah. I see here that the test results indicate a potential abnormality. However, I want to emphasize that further evaluation is needed to determine the exact diagnosis. I recommend scheduling a follow-up appointment with your primary care physician or the specialist you were referred to.

Customer: Oh gosh, the waiting and uncertainty are really getting to me. Is there anything else I should be doing in the meantime? I feel so lost.

Agent 2: I completely understand, Sarah. While waiting for your appointment, it's important to take care of yourself both physically and mentally. Make sure to follow any instructions given to you by the doctor during your initial visit. If you experience any worsening symptoms or have any urgent concerns, please don't hesitate to contact us or seek immediate medical attention.

Customer: Thank you for the reassurance, Agent 2. I'll definitely try to take care of myself. But what if I have questions or need guidance along the way? Will someone be available to assist me?

Agent 2: Absolutely, Sarah. We have a care management team here at HealthHarbor who will be available to assist you throughout your healthcare journey. They can help answer any questions you may have, provide guidance, and offer emotional support. Would you like me to connect you with a care manager?

Customer: Yes, please. That would be really helpful. I appreciate your assistance, Agent 2.

Agent 2: Not a problem, Sarah. I'm glad I could help. Let me transfer you to a care manager who will be better equipped to address your concerns. Please stay on the line while I connect you.

[Short pause]

Care Manager: Hello, Sarah. My name is Emily and I'll be your care manager. I understand you have some concerns about your follow-up care. How can I assist you today?

Customer: Hi, Emily. Thank you for taking the time to speak with me. I'm feeling scared and uncertain about my condition and would appreciate any guidance or support you can offer.

Care Manager: I understand, Sarah. I'm here to support you every step of the way. Let's start by discussing your specific concerns and any questions you may have. We'll work together to create a plan to address your needs and ensure you receive the best possible care.

[The conversation continues between Sarah and the care manager, addressing her concerns, providing guidance, and offering emotional support.]

Agent 2: [Interrupting the call] Thank you for contacting HealthHarbor, Sarah. I'm glad we were able to connect you with a care manager who can assist you further. If you have any other questions or concerns in the future, please don't hesitate to reach out to us. Take care and best of luck with your follow-up care.

Customer: Thank you, Agent 2. I appreciate your help and support. Goodbye.

Agent 2: You're welcome, Sarah. Take care and goodbye.",scared,2,Follow-up Calls and Care Management,resolved
"[Phone ringing]

Agent 4: Thank you for calling HealthHarbor, my name is Agent 4. How may I assist you today?

Customer: Finally, someone answered! I've been on hold for ages. I am furious right now. 

Agent 4: I apologize for the wait and any inconvenience caused. I understand you're angry, and I'm here to help. What seems to be the issue?

Customer: Well, I've been experiencing severe abdominal pain for the past two days, and it's not getting any better. I need some medical advice or at least an assessment of my symptoms.

Agent 4: I'm sorry to hear that you're going through this. I'm not a doctor, but I can try to help you assess your symptoms. Can you please describe the pain you're feeling?

Customer: It's a sharp and stabbing pain in my lower abdomen. It's constant and worsens when I move or touch the area. I also feel nauseous and have a fever.

Agent 4: I'm not a medical professional, but based on your description, it's important for you to seek immediate medical attention. Severe abdominal pain accompanied by fever and nausea could be a sign of a serious condition. It's best to visit an emergency room or call your primary care doctor right away.

Customer: Are you kidding me? I've been waiting on hold all this time just to be told to go to the ER? I could have figured that out on my own!

Agent 4: I understand your frustration, but I want to ensure your well-being. It's crucial to have a healthcare professional evaluate your symptoms in person to provide the best possible care. They can conduct appropriate tests and examinations to determine the cause of your pain accurately.

Customer: Alright, fine. I'll go to the ER. But I'm not happy about this at all. This could have been resolved over the phone if you were more helpful.

Agent 4: I apologize if I wasn't able to provide the resolution you were hoping for. Our primary goal is to ensure your safety and well-being, and sometimes that requires in-person evaluation. If you have any more questions or concerns, please let me know, and I'll do my best to assist you.

Customer: Whatever. Just give me the number for the nearest hospital or ER. And make sure it's a good one!

Agent 4: I understand your frustration, and I'll provide you with the information you need. May I have your zip code, please?

Customer: It's 12345.

Agent 4: Thank you. Based on your location, the nearest hospital to you is HealthHarbor Medical Center located at 123 Main Street. Their contact number is (555) 123-4567.

Customer: Fine, I'll go there. But if this turns out to be a waste of my time, I'll be even angrier!

Agent 4: I apologize for any inconvenience you've experienced. If you have any further questions or need assistance in the future, don't hesitate to reach out to us. I hope you receive the care you need at HealthHarbor Medical Center. Take care.

Customer: Yeah, whatever. Goodbye.

[Call ends]",angry,4,Medical Advice or Symptom Assessment,unresolved
"Agent 4: Thank you for calling HealthHarbor, my name is Agent 4. How may I assist you today?

Customer: Hi, Agent 4. I'm calling for a follow-up on my recent visit to HealthHarbor. I had some concerns I wanted to discuss.

Agent 4: I'm sorry to hear that you had concerns, but I'm here to help. Could you please provide me with your name and date of visit?

Customer: Sure, my name is Emily Johnson, and I visited HealthHarbor last week on June 15th.

Agent 4: Thank you, Emily. Before we proceed, could you please briefly explain the concerns you have?

Customer: Of course. During my visit, I had some lab tests done, and I haven't received the results yet. I was wondering when I can expect them.

Agent 4: I apologize for the delay in receiving your lab results, Emily. Let me check that for you. May I put you on a brief hold while I access your file?

Customer: Sure, go ahead.

[Agent 4 puts the customer on hold.]

Agent 4: Thank you for waiting, Emily. I have checked your file, and it seems that there was a delay in processing your lab results. I apologize for the inconvenience caused. I will escalate this matter to our lab department and ensure they provide you with the results as soon as possible. Is there anything else I can assist you with?

Customer: No, that's all, thank you. Can you please make sure I receive the results as soon as possible?

Agent 4: Absolutely, Emily. I will personally follow up with the lab department and ensure they prioritize your case. You should receive the results within the next 48 hours. Is there anything else I can assist you with today?

Customer: No, that's all for now. Thank you for your help, Agent 4.

Agent 4: You're welcome, Emily. I apologize again for the inconvenience caused, and I appreciate your patience. If you have any further questions or concerns, don't hesitate to reach out to us. Have a great day!

Customer: Thank you, you too. Goodbye.

Agent 4: Goodbye, Emily. Take care.",neutral,4,Follow-up Calls and Care Management,unresolved
"Agent 1: Thank you for calling HealthHarbor. My name is Agent 1. How can I assist you today?

Customer: Hi, Agent 1. I'm really scared right now. I need to schedule an appointment at your hospital.

Agent 1: I'm sorry to hear that you're feeling scared. Don't worry, we're here to help you. Can you please provide me with your name?

Customer: My name is Sarah Thompson.

Agent 1: Thank you, Sarah. Could you please tell me a little bit about what you're experiencing? This will help us determine the urgency of your appointment.

Customer: I've been having severe abdominal pain for the past few days, and it's getting worse. I'm really worried that something might be seriously wrong.

Agent 1: I understand your concern, Sarah. We'll do our best to get you the help you need. Have you been to our hospital before?

Customer: No, this is my first time reaching out to HealthHarbor.

Agent 1: Alright, Sarah. I'll need to gather some more information from you. Can you please provide me with your contact number?

Customer: Sure, it's 555-123-4567.

Agent 1: Thank you, Sarah. Now, in order to schedule your appointment, I need to ask you a few more questions. Are you experiencing any other symptoms besides the abdominal pain?

Customer: I've also been feeling nauseous and have had a slight fever.

Agent 1: Okay, thank you for letting me know. Based on your symptoms, I believe it's best for you to see a doctor as soon as possible. We have availability tomorrow at 2 PM. Would that work for you?

Customer: Yes, that works for me. Thank you for getting me an appointment quickly. I really appreciate it.

Agent 1: You're welcome, Sarah. I understand that you're scared, but please try to stay calm. Our doctors will take good care of you. Is there anything else I can assist you with?

Customer: No, that's all for now. Thank you for your help, Agent 1.

Agent 1: It's my pleasure, Sarah. Take care and we'll see you tomorrow at 2 PM. If you have any more questions or concerns, don't hesitate to reach out to us. Have a good day!

Customer: Thank you. Goodbye.

Agent 1: Goodbye, Sarah.",scared,1,Appointment Scheduling,unresolved
"Agent 3: Thank you for calling HealthHarbor, my name is Agent 3. How may I assist you today?

Customer: Hi Agent 3, my name is Emily Johnson. I have been experiencing some symptoms lately and I'm not sure if I should be concerned.

Agent 3: Hi Emily, I'm here to help. Can you please tell me more about the symptoms you've been experiencing?

Customer: Well, for the past week, I've had a persistent headache and occasional dizziness. I've also been feeling fatigued and a bit nauseous at times. I'm not sure if it's just stress or something more serious.

Agent 3: I understand your concern, Emily. Headaches and dizziness can have various causes. Have you noticed any triggers for these symptoms, such as certain foods or activities?

Customer: I haven't noticed any specific triggers. The symptoms seem to occur randomly throughout the day. I've tried getting more sleep and drinking plenty of water, but it hasn't made much of a difference.

Agent 3: Okay, thank you for sharing that information, Emily. Based on your symptoms, it could be helpful to schedule an appointment with a primary care physician. They can evaluate your symptoms in more detail and provide a proper diagnosis.

Customer: Alright, I'll make sure to do that. Is there anything else I should be aware of or any home remedies I can try in the meantime?

Agent 3: While it's important to consult with a healthcare professional, there are a few things you can try at home that might help alleviate your symptoms. You can apply a cold or warm compress to your forehead to relieve the headache temporarily. It may also be helpful to practice relaxation techniques, such as deep breathing or meditation, to reduce stress levels.

Customer: Thank you for the advice, Agent 3. I'll definitely give those remedies a try. Is there anything else I should be concerned about with these symptoms?

Agent 3: It's always important to monitor your symptoms closely, Emily. If you experience any sudden or severe changes, or if your symptoms worsen, it would be best to seek immediate medical attention. Additionally, if you develop any new symptoms, please inform your healthcare provider during your appointment.

Customer: Understood, Agent 3. I'll keep a close eye on my symptoms and seek medical attention if necessary. Thank you for your help and guidance.

Agent 3: You're welcome, Emily. I'm glad I could assist you. If you have any further questions or concerns, don't hesitate to reach out to us. Take care and I hope you feel better soon!

Customer: Thank you, Agent 3. I appreciate your assistance. Have a great day!

Agent 3: You too, Emily. Take care and have a wonderful day ahead! Goodbye.

(Customer hangs up)",neutral,3,Medical Advice or Symptom Assessment,resolved
"Agent 3: Thank you for calling HealthHarbor, my name is Agent 3. How can I assist you today?

Customer: Hi, Agent 3. My name is Emily Johnson. I'm feeling really worried and I need some help. 

Agent 3: I'm here to help you, Emily. What seems to be the problem? 

Customer: Well, I've been experiencing some health issues lately and my primary care doctor recommended that I see a specialist. I'm not sure where to start or how to go about getting a referral. 

Agent 3: I understand your concerns, Emily. We can definitely assist you with that. Could you please let me know what type of specialist you need to see? 

Customer: I think I need to see a cardiologist. I've been having some chest pain and my doctor wants me to get it checked out. 

Agent 3: I'm sorry to hear that, Emily. I can help you with finding a cardiologist in your area. Can you please provide me with your zip code? 

Customer: Sure, it's 12345. 

Agent 3: Thank you, Emily. Let me check our database for cardiologists in your area. 

(Customer waits for a few minutes while Agent 3 searches for information.)

Agent 3: I have found a few highly recommended cardiologists near your location. Would you like me to provide you with their contact information? 

Customer: Yes, please. That would be great. 

Agent 3: Alright, I have three cardiologists for you to consider. Dr. Sarah Adams, her contact number is 555-1234. Dr. Mark Thompson, his contact number is 555-5678. And Dr. Lisa Roberts, her contact number is 555-9012. 

Customer: Thank you so much, Agent 3. I really appreciate your help. 

Agent 3: You're welcome, Emily. Is there anything else I can assist you with? 

Customer: Actually, yes. I'm also looking for a referral to a gastroenterologist. I've been having some digestive issues and my doctor wants me to see a specialist for further evaluation. 

Agent 3: I understand, Emily. Let me find some gastroenterologists in your area. Can you please provide me with your zip code again? 

Customer: Of course, it's still 12345. 

Agent 3: Thank you, Emily. Give me a moment to search for gastroenterologists in your area. 

(Customer waits for a few minutes while Agent 3 searches for information.)

Agent 3: I have found three gastroenterologists near your location. Dr. Michael Anderson, his contact number is 555-2468. Dr. Jennifer Lee, her contact number is 555-3691. And Dr. Robert Davis, his contact number is 555-8024. 

Customer: Thank you so much, Agent 3. I really appreciate your help once again. 

Agent 3: You're welcome, Emily. I'm glad I could assist you. Is there anything else I can help you with today? 

Customer: No, that's all for now. You've been very helpful. 

Agent 3: I'm glad I could be of assistance, Emily. If you have any more questions or need further assistance, please don't hesitate to call us back. Take care of yourself and I hope you feel better soon. 

Customer: Thank you, Agent 3. Have a great day. 

Agent 3: You too, Emily. Take care. Goodbye. 

(Customer hangs up the phone.)",worried,3,Referrals and Specialist Appointments,resolved
