call_transcript,mood,agent_number,intention,resolution
"Agent 1: Good morning, thank you for calling ElectricVolt. My name is Agent 1, how can I assist you today?

Customer: Finally, someone answered! I've been trying to reach your company for days now. I am extremely angry with the service I received!

Agent 1: I apologize for the inconvenience, sir. Could you please provide me with your name and account details so that I can better assist you?

Customer: My name is John Smith and my account number is 123456789.

Agent 1: Thank you, Mr. Smith. I'm sorry to hear about your frustration. Could you please share the details of the service issue you experienced?

Customer: Well, I had an electrician from your company come to my house last week to fix some faulty wiring. Not only did they arrive late, but they also left without completing the job properly. I'm still having issues with my electrical system!

Agent 1: I understand your frustration, Mr. Smith. I apologize for the inconvenience caused. I will ensure that your concern is addressed promptly. Can you please provide me with the specific details of the incomplete job?

Customer: The electrician didn't fix the wiring properly, and now I'm experiencing frequent power outages. This is unacceptable, especially considering the amount I paid for the service!

Agent 1: I apologize for the inconvenience caused by our technician, Mr. Smith. We value your feedback and take this matter seriously. Rest assured, I will escalate your complaint to our technical team immediately. They will reach out to you within the next 24 hours to schedule a follow-up appointment and resolve the issue.

Customer: It better be resolved soon! I've had to deal with this inconvenience for far too long. I expect a prompt response and a proper solution!

Agent 1: I completely understand your frustration, Mr. Smith, and I assure you that we will do everything in our power to rectify this situation as quickly as possible. We appreciate your patience and cooperation.

Customer: Well, I hope your team does a better job this time. This whole experience has been a nightmare. I expected better from ElectricVolt!

Agent 1: I apologize once again for the inconvenience caused, Mr. Smith. Your feedback is valuable to us, and we will use it to improve our services. If you have any other concerns or suggestions, please feel free to share them with us.

Customer: I don't have any other concerns at the moment, but I do hope that ElectricVolt takes my feedback seriously and ensures that such incidents don't happen in the future.

Agent 1: Absolutely, Mr. Smith. Your feedback is important to us, and we will make sure to address the issues raised. I would like to thank you for bringing this to our attention, and I apologize for any inconvenience caused. Is there anything else I can assist you with today?

Customer: No, that's all for now. I hope to see a resolution soon.

Agent 1: I understand, Mr. Smith. Thank you for your patience and cooperation. We will reach out to you shortly with an update on the resolution. Have a great day!

Customer: Thank you, goodbye.

Agent 1: Goodbye, Mr. Smith. Take care.",angry,1,Feedback and Suggestions,resolved
"Agent 2: Thank you for calling ElectricVolt, my name is Agent 2. How can I assist you today?

Customer: Hi Agent 2, my name is Emily Johnson. I'm having a bit of trouble with my electrical system at home. I thought I'd give you guys a call for some technical support.

Agent 2: Hi Emily, it's great to have you on the line. I'm here to help you with any electrical issues you're facing. Could you please provide me with more details about the problem you're experiencing?

Customer: Of course! So, I've noticed that some of the outlets in my living room are not working. I've tried plugging different devices, but nothing seems to work. It's a bit frustrating because I need to charge my laptop and use some other electronic devices.

Agent 2: I understand how inconvenient that can be, Emily. Let's troubleshoot the issue together. Firstly, have you checked the circuit breaker? It's possible that a circuit might have tripped, causing the outlets to stop working.

Customer: Oh, I didn't think of that. Let me go and check. Hold on a moment, please.

(Customer puts the call on hold for a few minutes)

Customer: Alright, I'm back. You were right, Agent 2. One of the circuits had indeed tripped. I reset it, and now the outlets are working perfectly fine!

Agent 2: That's great news, Emily! I'm glad I could help you resolve the issue quickly. Is there anything else I can assist you with today?

Customer: Actually, yes. I've been thinking about installing some additional outlets in my home office. I often find myself struggling with limited outlets for all my devices. How can ElectricVolt help me with that?

Agent 2: We would be more than happy to assist you with that, Emily. Our team of electricians can visit your home and assess the best locations for the additional outlets. They will ensure that the installation is done safely and efficiently. Would you like me to schedule a visit for you?

Customer: Yes, please. That would be fantastic! I work from home, so having more outlets in my office will definitely make my life easier. Thank you so much for your help, Agent 2!

Agent 2: You're very welcome, Emily. We strive to provide the best electrical services to our customers. I have scheduled a visit for next Tuesday at 10 am. Our electrician will be there to assess and discuss the installation options with you. Is there anything else I can assist you with?

Customer: No, that's all for now. I appreciate your assistance, Agent 2. You've been very helpful and efficient. I'm glad I called ElectricVolt for my electrical issues.

Agent 2: Thank you for your kind words, Emily. It was my pleasure to assist you. If you have any further questions or need any more support in the future, don't hesitate to reach out to us. Have a wonderful day!

Customer: You too, Agent 2. Goodbye!

Agent 2: Goodbye, Emily! Take care.",happy,2,Technical Support and Troubleshooting,resolved
"Agent 3: Thank you for calling ElectricVolt, my name is Agent 3. How may I assist you today?

Customer: Hi Agent 3, I'm John Smith, and I'm a happy customer of ElectricVolt. I just wanted to discuss some account management matters.

Agent 3: Hello, Mr. Smith! I'm glad to hear that you're happy with our services. I'll be more than happy to help you with your account management. How can I assist you today?

Customer: Well, I recently moved to a new house, and I would like to update my billing address and contact information. Can you assist me with that?

Agent 3: Of course, Mr. Smith! I can definitely update your information for you. May I have your new address, please?

Customer: Sure, it's 123 Main Street, Anytown, USA. And my new phone number is 555-123-4567.

Agent 3: Thank you for providing the details, Mr. Smith. I've updated your address and phone number in our system. Is there anything else you would like to update or discuss regarding your account?

Customer: Actually, yes. I've been considering installing solar panels on my roof. Does ElectricVolt offer any services related to solar energy?

Agent 3: Absolutely, Mr. Smith! ElectricVolt provides a range of services related to solar energy, including the installation and maintenance of solar panels. We can definitely help you with that. Would you like me to schedule a consultation for you with one of our solar energy experts?

Customer: That would be great, Agent 3. Please go ahead and schedule a consultation. I'm excited to explore the possibility of switching to solar energy.

Agent 3: Wonderful! I have scheduled a consultation for you on [date] at [time]. Our representative will visit your home to assess your energy needs and provide you with the best solution. Is there anything else I can assist you with today, Mr. Smith?

Customer: No, that's all for now, Agent 3. Thank you for your help. I appreciate your excellent customer service.

Agent 3: You're very welcome, Mr. Smith! It's been a pleasure assisting you. If you have any further questions or need assistance in the future, please don't hesitate to reach out. Have a great day!

Customer: Thank you, Agent 3. Have a great day too! Goodbye.

Agent 3: Goodbye, Mr. Smith. Take care!",happy,3,Account Management,resolved
"Agent 2: Thank you for calling ElectricVolt, my name is Agent 2. How may I assist you today?

Customer: Hi Agent 2, my name is Sarah Johnson. I'm experiencing an electrical outage in my residential area. Can you please help me?

Agent 2: Of course, Sarah! I'm sorry to hear about the outage. Let me check if there are any reported outages in your area. Can you please provide me with your address?

Customer: Sure! I live at 123 Main Street, Anytown.

Agent 2: Thank you, Sarah. Let me just pull up the information for you. It seems like there's currently an outage in your area due to a fallen tree on the power lines. Our team is already working on it, and we expect the power to be restored within the next hour. I apologize for the inconvenience caused.

Customer: Oh, that's great to hear! Thank you for the quick response. Is there anything else I should do while waiting for the power to be restored?

Agent 2: While you wait, please ensure that all your electrical appliances and devices are turned off to prevent any damage once the power comes back on. It's also a good idea to unplug sensitive electronics like computers and TVs. Once the power is restored, you can gradually reconnect them.

Customer: Okay, I'll make sure to do that. Thank you for the advice. Is there any estimated time for the power restoration?

Agent 2: As I mentioned earlier, we expect the power to be restored within the next hour. However, please keep in mind that these estimates are subject to change depending on the extent of the damage and the progress made by our technicians. Rest assured, we're doing everything we can to resolve the issue as quickly as possible.

Customer: I appreciate your efforts, Agent 2. I'm just glad to know that the situation is being taken care of promptly. Is there anything else I should be aware of?

Agent 2: Once the power is restored, please check your circuit breaker panel to ensure that all breakers are in the ""on"" position. If you notice any tripped breakers, please reset them. If the power doesn't come back on after doing so, please give us a call again, and we'll send a technician to assist you further.

Customer: Alright, I'll keep that in mind. Thank you for your help, Agent 2. I'm really impressed with the service ElectricVolt provides. You've been very helpful and informative.

Agent 2: It's my pleasure, Sarah. We strive to deliver excellent customer service, and I'm glad I could assist you today. If you have any other questions or concerns in the future, please don't hesitate to reach out to us. Is there anything else I can assist you with?

Customer: No, that's all for now. Thank you once again, Agent 2. Have a great day!

Agent 2: You're welcome, Sarah! I'm glad I could help. You have a wonderful day too, and take care. Goodbye!",happy,2,Outages and Emergencies,resolved
"Agent 1: Thank you for calling ElectricVolt, my name is Agent 1. How can I assist you today?

Customer: Finally, someone answered! I've been trying to reach your company for days. I am absolutely furious with the service I have received!

Agent 1: I apologize for the inconvenience, sir. I can understand your frustration. May I have your name, please?

Customer: It's John Smith.

Agent 1: Thank you, Mr. Smith. Could you please provide me with your account number so that I can access your information?

Customer: Account number? Why would I have an account number? I've never needed one before!

Agent 1: I apologize for any confusion, Mr. Smith. Typically, our customers are assigned an account number for billing and payment purposes. However, if you don't have one, we can still assist you. Could you provide me with your address?

Customer: Fine, it's 123 Main Street.

Agent 1: Thank you, Mr. Smith. Now, how can I assist you with your billing and payment concerns?

Customer: I received a bill that is way higher than usual! I demand an explanation! This is unacceptable!

Agent 1: I'm sorry to hear that, Mr. Smith. Let me check your account and see what might have caused the increase in your bill.

(Customer and Agent 1 remain on hold for a few minutes.)

Agent 1: Thank you for your patience, Mr. Smith. I've reviewed your account, and it appears that there was an error in the meter reading for the billing period. This resulted in an overestimated usage, leading to the higher bill.

Customer: So, you're telling me that I have to pay for your mistake? This is outrageous!

Agent 1: I understand your frustration, Mr. Smith. I assure you that we will rectify this error. We will adjust your bill to reflect the correct usage, and you will not be responsible for the overestimated amount.

Customer: Well, it's about time! But what about the inconvenience this has caused me? I demand compensation for the time wasted on this issue!

Agent 1: I apologize for any inconvenience caused, Mr. Smith. As a gesture of goodwill, we will credit your account with $50 for the inconvenience you have experienced.

Customer: That's more like it. But I want to make sure this never happens again. What steps are you taking to prevent such errors in the future?

Agent 1: We take customer satisfaction seriously, Mr. Smith. We will be conducting a thorough investigation into the cause of this error and implementing measures to prevent its recurrence. Additionally, we will be providing additional training to our meter readers to ensure accurate readings.

Customer: Good! I hope this won't happen again. Now, let's talk about the payment. I want to make sure that the adjusted amount is reflected in my next bill.

Agent 1: Absolutely, Mr. Smith. The adjusted amount will be reflected in your next bill, which you will receive within the next billing cycle. Is there anything else I can assist you with today?

Customer: No, that will be all. Just make sure this is resolved. I don't want any more surprises from ElectricVolt.

Agent 1: I completely understand, Mr. Smith. Rest assured, we will take the necessary steps to rectify this issue and ensure your future satisfaction. Thank you for bringing this to our attention, and we apologize again for any inconvenience caused. Is there anything else I can assist you with?

Customer: No, that's all for now. Goodbye.

Agent 1: Thank you for reaching out to ElectricVolt, Mr. Smith. If you have any further questions or concerns, please don't hesitate to contact us. Have a great day!

(Customer hangs up)",angry,1,Billing and Payments,resolved
"Agent 3: Thank you for calling ElectricVolt. This is Agent 3 speaking. How may I assist you today?

Customer: Hi Agent 3. My name is Emily Johnson. I recently had some electrical work done at my home and I have a few questions regarding regulatory compliance and legal inquiries.

Agent 3: Hello, Emily. I'm here to help. Please go ahead and ask your questions.

Customer: Great, thank you. I wanted to know if ElectricVolt complies with all the necessary regulations and safety standards for electrical services?

Agent 3: Absolutely, Emily. ElectricVolt takes regulatory compliance and safety very seriously. We ensure that all our electricians are licensed and trained to meet industry standards. Additionally, our company is fully insured and follows all local and national electrical codes.

Customer: That's reassuring to hear. I also wanted to inquire about any legal liabilities in case of any accidents or damages during the electrical work.

Agent 3: I understand your concern, Emily. ElectricVolt has a comprehensive liability insurance policy that covers any damages or accidents that may occur during our services. Our team is trained to prioritize safety to minimize any risks, but in the rare event that something does happen, you can rest assured that we have you covered.

Customer: That's good to know. I appreciate your transparency. Now, I have one more question. What happens if I'm not satisfied with the electrical work performed at my home? Are there any guarantees or warranties?

Agent 3: We strive for customer satisfaction, Emily. If you are not satisfied with the work done, please let us know within 30 days, and we will send a technician to address any concerns or issues you may have. We offer a warranty on our services, and we want to make sure you're happy with the outcome.

Customer: That's great to hear. It's reassuring to know that ElectricVolt stands behind their work. I must say, Agent 3, you've been very helpful and informative throughout this call. I appreciate your professionalism.

Agent 3: Thank you, Emily. It's our pleasure to assist you. Is there anything else I can help you with today?

Customer: No, that will be all for now. Thank you again for your assistance. Have a great day!

Agent 3: You're welcome, Emily. Thank you for choosing ElectricVolt. Have a wonderful day too!",happy,3,Regulatory Compliance and Legal Inquiries,resolved
"Agent 1: Thank you for calling ElectricVolt, my name is Agent 1. How can I assist you today?

Customer: Hi, Agent 1. I'm calling to schedule a service appointment. I've been experiencing some electrical issues at my home.

Agent 1: I'm sorry to hear that. I'll be happy to help you with that. Can you please provide me with your name and address?

Customer: Sure, my name is John Smith and I live at 123 Main Street.

Agent 1: Thank you, Mr. Smith. Could you please describe the electrical issues you've been facing?

Customer: Well, my lights have been flickering quite frequently, and some outlets in my living room are not working.

Agent 1: I understand. It sounds like you may be having some electrical wiring problems. Let me check our technician's availability for you. Can you please hold for a moment?

Customer: Sure, take your time.

[Agent 1 puts the customer on hold to check the technician's availability]

Agent 1: Thank you for holding, Mr. Smith. I have an available technician who can come to your home tomorrow between 10 AM and 2 PM. Does that work for you?

Customer: Yes, that works for me. Can you please provide me with the technician's name and contact information?

Agent 1: Certainly, Mr. Smith. Our technician's name is David Johnson, and his contact number is 555-1234. He will be calling you before arriving at your home.

Customer: Great, thank you for the information. Is there anything else I need to know or prepare before the technician comes?

Agent 1: Yes, Mr. Smith. Please make sure that the area where the electrical issues are occurring is accessible and clear of any obstacles. It would also be helpful if you can provide any additional details or observations about the issues to our technician when he arrives.

Customer: I'll make sure to do that. Thank you for your assistance.

Agent 1: You're welcome, Mr. Smith. Is there anything else I can help you with today?

Customer: No, that's all for now. Thank you again.

Agent 1: It was my pleasure assisting you, Mr. Smith. If you have any further questions or concerns, please don't hesitate to reach out to us. Have a great day!

Customer: You too. Goodbye.

Agent 1: Goodbye, Mr. Smith. Take care.",neutral,1,Service Requests and Appointments,unresolved
"Agent 1: Thank you for calling ElectricVolt, my name is Agent 1. How can I assist you today?

Customer: Finally, someone answered! I've been trying to reach you for days. I'm absolutely furious with your company!

Agent 1: I apologize for the wait and any inconvenience caused, sir. I understand you're angry, and I'm here to help. What seems to be the problem?

Customer: Well, I scheduled an appointment for a service request last week, and your technician never showed up! I wasted my entire day waiting for someone who never arrived!

Agent 1: I'm truly sorry for the missed appointment, sir. Let me check the details and see what went wrong. Can I have your name and address, please?

Customer: It's John Smith, and I live at 123 Main Street.

Agent 1: Thank you, Mr. Smith. I'm pulling up your account now. I see here that the appointment was scheduled for last Tuesday. Our records show that the technician had a sudden emergency and couldn't make it. I apologize for the lack of communication.

Customer: Lack of communication?! No one bothered to inform me about this! I took time off work to be here, and now I'm just left hanging!

Agent 1: I completely understand your frustration, Mr. Smith. We should have definitely notified you about the cancellation, and I apologize for that oversight. Let me make it right for you. I can schedule a new appointment for you at your earliest convenience. How does that sound?

Customer: It better be soon! I need this issue resolved as soon as possible.

Agent 1: I completely understand, Mr. Smith. Let me check our availability for this week. How about Thursday morning at 9:00 AM? 

Customer: Fine, but I better receive a confirmation call this time. I won't tolerate any more surprises.

Agent 1: Absolutely, Mr. Smith. I'll make a note in your account to ensure you receive a confirmation call before the appointment. Is there anything else I can assist you with?

Customer: No, that's all for now. Just make sure your technician actually shows up this time!

Agent 1: I assure you, Mr. Smith, we will do everything in our power to make this appointment successful. Thank you for bringing this to our attention, and once again, I apologize for the inconvenience caused. Is there anything else I can assist you with today?

Customer: No, that's all. Goodbye.

Agent 1: Thank you for contacting ElectricVolt, Mr. Smith. Have a great day. Goodbye.",angry,1,Service Requests and Appointments,unresolved
"Customer: (angry) Hello? Is this ElectricVolt?

Agent 3: Yes, this is ElectricVolt. How can I assist you today?

Customer: Finally! I've been trying to get a hold of someone for hours. I need to schedule a service appointment as soon as possible.

Agent 3: I apologize for the wait and any inconvenience caused. I understand your urgency. May I have your name, please?

Customer: My name is Sarah Parker.

Agent 3: Thank you, Ms. Parker. Could you please provide me with your address?

Customer: It's 123 Main Street, Cityville.

Agent 3: Thank you. What type of service do you require, Ms. Parker?

Customer: I have an electrical issue in my home. Some of the outlets are not working, and I need an electrician to come and fix them.

Agent 3: I'm sorry to hear that you're experiencing issues. We'll do our best to address this promptly. Is there a specific day or time that works best for you?

Customer: I work during weekdays, so I would prefer a weekend appointment. Can you send someone this Saturday morning?

Agent 3: Unfortunately, we are fully booked for this Saturday morning. Would Sunday morning be a suitable alternative for you?

Customer: (frustrated) No, it wouldn't. I need this resolved as soon as possible. Can't you make an exception or find a way to fit me in?

Agent 3: I understand your urgency, Ms. Parker. Let me check if there are any cancellations or alternative options available. Please hold for a moment.

(Customer is put on hold for a few minutes)

Agent 3: Thank you for your patience, Ms. Parker. I managed to find a technician who can come to your house tomorrow afternoon. Would that work for you?

Customer: (relieved) Yes, that would be acceptable. What time can I expect them?

Agent 3: The technician will arrive between 2 PM and 4 PM. Is there anything else I can assist you with?

Customer: No, that's all for now. I just hope the technician can resolve the issue quickly.

Agent 3: We will do our best to fix the problem efficiently, Ms. Parker. If you have any further concerns, please don't hesitate to contact us. Thank you for choosing ElectricVolt.

Customer: (still frustrated) I hope so. Goodbye.

Agent 3: Goodbye, Ms. Parker. Have a great day.",angry,3,Service Requests and Appointments,resolved
