call_transcript,mood,agent_number,intention,resolution
"Agent 3: Good morning, thank you for calling ElectricVolt. My name is Agent 3. How may I assist you today?

Customer: Hi Agent 3, my name is John Doe. I'm a happy customer of ElectricVolt. I recently heard about your company's commitment to accessibility and special needs, and I wanted to learn more about the services you offer in that regard.

Agent 3: Good morning, John! I'm glad to hear that you're happy with our services. We take pride in providing accessible electrical services to all our customers. Could you please let me know what specific information you're looking for?

Customer: Absolutely. I recently had a family member with special needs move in with me, and I want to ensure that our home is safe and accessible for them. Are there any specific services or modifications that ElectricVolt offers for such situations?

Agent 3: That's great to hear, John. We understand the importance of creating a safe and accessible environment for individuals with special needs. Our team of skilled electricians can assist you with a variety of services, including installing ramps, handrails, and grab bars to improve mobility. We can also help with installing specialized lighting or electrical systems to accommodate specific needs.

Customer: That's fantastic! It's such a relief to know that ElectricVolt can help us make our home more accessible. Are these services available for commercial properties as well?

Agent 3: Absolutely, John. We provide accessibility services for both residential and commercial properties. Whether it's a retail store, office building, or any other commercial space, our team can assess your specific needs and recommend the best solutions to ensure accessibility for everyone.

Customer: That's great to know. I appreciate the flexibility and expertise your company offers. Can you also tell me about any special programs or discounts ElectricVolt provides for customers with special needs?

Agent 3: Certainly, John. At ElectricVolt, we understand the importance of affordability. We offer special discounts and flexible payment options for customers with special needs. Additionally, we work closely with various organizations and charities to provide additional assistance whenever possible.

Customer: That's really commendable. It's reassuring to know that ElectricVolt not only provides quality services but also cares about its customers. I'm really impressed with your commitment to accessibility. Is there anything else I should know?

Agent 3: Thank you for your kind words, John. We strive to go above and beyond for our customers. I would also like to inform you that our electricians undergo regular training to stay updated on the latest accessibility standards and regulations. This ensures that we can provide the best possible solutions for our customers' unique needs.

Customer: That's great to hear. I feel confident in choosing ElectricVolt for my accessibility needs. Thank you so much for all the information, Agent 3. Is there anything else I should do or any specific steps I need to take to get started?

Agent 3: You're most welcome, John. To get started, I recommend scheduling a consultation with one of our expert electricians. They will visit your property, assess your specific needs, and provide you with a detailed plan and cost estimate. You can either call our customer service team or visit our website to schedule an appointment at your convenience.

Customer: Perfect, I'll make sure to schedule a consultation soon. Thank you once again, Agent 3, for your exceptional assistance. I'm really looking forward to working with ElectricVolt.

Agent 3: You're very welcome, John. It's been a pleasure assisting you. We look forward to helping you create a safe and accessible environment for your family member. If you have any further questions or need any assistance, don't hesitate to reach out. Have a wonderful day!

Customer: Thank you, Agent 3. Have a great day too! Goodbye!",happy,3,Accessibility and Special Needs,resolved
"Agent 2: Thank you for calling ElectricVolt, this is Agent 2 speaking. How may I assist you today?

Customer: Hi, Agent 2. I'm calling to inquire about any special programs or promotions your company is currently offering.

Agent 2: Of course, I'd be happy to help you with that. May I have your name, please?

Customer: Yes, my name is Emily Thompson.

Agent 2: Thank you, Emily. Before we get started, may I ask if you are a residential or commercial customer?

Customer: I'm a residential customer.

Agent 2: Great. We do have a few special programs and promotions available for our residential customers. One of our current promotions is a discounted rate for first-time customers. Are you a first-time customer with ElectricVolt?

Customer: No, I've used your services before. Do you have any other promotions?

Agent 2: Certainly, Emily. Another program we offer is our referral program. If you refer a friend or family member to ElectricVolt and they become a customer, both you and the person you referred will receive a discount on your next service.

Customer: That sounds interesting. Are there any other special programs I should know about?

Agent 2: Absolutely. We also have a loyalty program for our long-term customers. The more services you use with ElectricVolt, the more points you accumulate, which can be redeemed for discounts on future services.

Customer: That's great to know. Can you provide me with some more details on how the loyalty program works?

Agent 2: Of course, Emily. With our loyalty program, every time you use our services, you earn points based on the total cost of the service. These points can then be redeemed for discounts on future services. The more points you accumulate, the higher the discount you can receive. It's just our way of showing appreciation for your continued business.

Customer: That sounds like a great program. Is there anything else I should be aware of?

Agent 2: Yes, Emily. We also have seasonal promotions that we run throughout the year. These promotions may include discounted rates on specific services or special offers for a limited time. I recommend checking our website or signing up for our newsletter to stay updated on any current promotions.

Customer: Thank you for the information. I will definitely keep an eye out for those seasonal promotions. Is there anything else I should know?

Agent 2: Just a reminder, Emily, that our special programs and promotions are subject to change, so it's always a good idea to inquire about any current offers when you schedule your service. Is there anything else I can assist you with today?

Customer: No, that's all I needed to know. Thank you for your help, Agent 2.

Agent 2: You're welcome, Emily. It was my pleasure assisting you. If you have any further questions, don't hesitate to give us a call. Have a great day!

Customer: You too. Goodbye!

Agent 2: Goodbye, Emily. Take care!",neutral,2,Special Programs and Promotions,resolved
"Agent 3: Good morning, thank you for calling ElectricVolt. This is Agent 3. How can I assist you today?

Customer: Hi Agent 3. I have a few questions regarding regulatory compliance and legal inquiries for ElectricVolt.

Agent 3: I'll be happy to help you with that. Could you please provide me with your name and account number for reference?

Customer: My name is Emma Roberts, and my account number is EV12345.

Agent 3: Thank you, Ms. Roberts. How can I assist you with regulatory compliance and legal inquiries?

Customer: I recently received a notice from my local municipality about an electrical code violation in my home. I would like to know if ElectricVolt can help me rectify this issue.

Agent 3: Absolutely, Ms. Roberts. We have a team of licensed electricians who can assist you with resolving electrical code violations. Can you please provide me with more details about the violation?

Customer: The notice mentioned that there is improper grounding in my home, and it needs to be fixed within a certain timeframe to avoid penalties. I'm not sure what that means exactly.

Agent 3: Improper grounding refers to a safety measure that ensures electrical currents are safely directed and dissipated in case of a fault. Our electricians can assess your electrical system and make the necessary corrections to ensure it meets the required standards. Would you like me to schedule an appointment for you?

Customer: Yes, please. I would appreciate it if you could schedule a visit from one of your electricians as soon as possible.

Agent 3: Noted. I'll arrange for an electrician to visit your property tomorrow between 9 AM and 12 PM. Is that convenient for you?

Customer: That works for me. Thank you for your prompt assistance.

Agent 3: You're welcome, Ms. Roberts. Is there anything else I can assist you with today regarding regulatory compliance or legal inquiries?

Customer: Actually, I have one more question. Are there any specific permits or licenses required for ElectricVolt to perform electrical work in my area?

Agent 3: Yes, ElectricVolt holds all the necessary permits and licenses to provide electrical services in your area. Our electricians are also fully licensed and insured. You can have peace of mind knowing that we adhere to all regulatory requirements.

Customer: That's great to hear. Thank you for the clarification.

Agent 3: You're welcome, Ms. Roberts. Is there anything else I can assist you with today?

Customer: No, that covers all my concerns. Thank you for your help, Agent 3.

Agent 3: It was my pleasure assisting you, Ms. Roberts. If you have any further questions in the future, don't hesitate to reach out. Have a great day!

Customer: You too. Goodbye.

Agent 3: Goodbye, Ms. Roberts. Have a wonderful day!",neutral,3,Regulatory Compliance and Legal Inquiries,resolved
"Agent 2: Thank you for calling ElectricVolt, this is Agent 2 speaking. How may I assist you today?

Customer: Hi, Agent 2. I'm calling to inquire about any special programs or promotions your company is currently offering.

Agent 2: Of course, I'd be happy to help you with that. Can I have your name, please?

Customer: Yes, my name is Emma Johnson.

Agent 2: Thank you, Emma. Before we proceed, may I confirm if you are a residential or commercial customer?

Customer: I'm a residential customer.

Agent 2: Great! We currently have a few special programs and promotions for our residential customers. One of our ongoing programs is our energy-saving bundle, where we offer discounted rates on LED lighting installation and energy-efficient appliance upgrades. This helps you save on your electricity bills in the long run.

Customer: That sounds interesting. Can you tell me more about the LED lighting installation?

Agent 2: Absolutely. Our LED lighting installation program is designed to replace your old, inefficient incandescent bulbs with energy-saving LED bulbs. LED bulbs are more durable, last longer, and consume less energy, resulting in significant savings on your electricity bills. We have a team of certified electricians who can assess your current lighting setup and provide you with a customized solution.

Customer: That sounds like a great way to save money. How do I sign up for this program?

Agent 2: Signing up is easy, Emma. I can schedule a visit from one of our electricians to assess your current lighting setup and provide you with a quote. If you're satisfied with the quote, we can proceed with the installation. Would you like me to schedule a visit for you?

Customer: Yes, please. That would be great.

Agent 2: Wonderful! I will need your address to schedule the visit. Can you please provide it?

Customer: Sure, my address is 123 Main Street.

Agent 2: Thank you, Emma. I have scheduled a visit for next Tuesday between 9 am and 12 pm. Our electrician will assess your lighting setup and provide you with a quote during the visit. Is there anything else I can assist you with?

Customer: Actually, I have one more question. Are there any promotions for energy-efficient appliance upgrades as well?

Agent 2: Absolutely, Emma. As part of our energy-saving bundle, we offer discounted rates on energy-efficient appliance upgrades. This includes appliances like refrigerators, washing machines, and air conditioning units that are designed to consume less energy while providing optimal performance. Upgrading to energy-efficient appliances can significantly reduce your electricity consumption.

Customer: That sounds like a great deal. How can I learn more about the available options and pricing?

Agent 2: I can provide you with a brochure that details the available options and pricing. Alternatively, I can also schedule a visit from one of our electricians who can assess your current appliances and provide you with personalized recommendations. Which option would you prefer?

Customer: I think I would prefer a visit from one of your electricians to get personalized recommendations.

Agent 2: Noted, Emma. I have scheduled a visit for appliance assessment along with the LED lighting installation visit. Our electrician will assess your current appliances and provide you with a quote for the upgrades. Is there anything else I can assist you with?

Customer: No, that's all for now. Thank you for your help, Agent 2.

Agent 2: You're welcome, Emma. It was my pleasure assisting you. If you have any further questions, feel free to reach out to us. Have a great day!

Customer: You too. Goodbye!

Agent 2: Goodbye, Emma. Take care!",neutral,2,Special Programs and Promotions,resolved
"Agent 2: Thank you for calling ElectricVolt! My name is Agent 2. How can I assist you today?

Customer: Hi Agent 2, my name is Sarah Johnson. I'm calling because I recently moved into a new house and I need some electrical work done. I heard great things about ElectricVolt, so I thought I'd give you a call.

Agent 2: Thank you for choosing ElectricVolt, Sarah! We're happy to help. Congratulations on your new house! What kind of electrical work do you need?

Customer: Thank you! I need to have a few outlets installed in a couple of rooms, as well as some light fixtures replaced. Would ElectricVolt be able to handle that?

Agent 2: Absolutely, Sarah! We specialize in both residential and commercial electrical services, so installing outlets and replacing light fixtures is right up our alley. We have skilled technicians who can handle any electrical job you need. Can you please provide me with your address so I can schedule a visit?

Customer: Sure, my address is 123 Main Street. When can someone come by to assess the work and provide an estimate?

Agent 2: Thank you for sharing your address, Sarah. I can schedule a technician to visit your property tomorrow afternoon between 2 PM and 4 PM. Would that work for you?

Customer: That sounds perfect! I'll make sure to be available during that time. How long will the assessment take, and when can I expect to receive the estimate?

Agent 2: The assessment usually takes about an hour, depending on the complexity of the work. Once the assessment is complete, our technician will provide you with a detailed estimate within 24 hours. You can expect to receive it via email. Is there anything else you need assistance with?

Customer: No, that's all for now. Thank you so much for your help, Agent 2! I'm really impressed with ElectricVolt's prompt service. I'm looking forward to working with your company.

Agent 2: You're very welcome, Sarah! We pride ourselves on providing excellent service to our customers. We're excited to work with you too! If you have any questions or concerns in the future, don't hesitate to reach out. Have a wonderful day!

Customer: You too, Agent 2. Thanks again! Goodbye.

Agent 2: Goodbye, Sarah! Take care.",happy,2,Contractor and Partner Communications,resolved
"Agent: Good morning, thank you for calling ElectricVolt. My name is Agent 2. How can I assist you today?

Customer: Hi Agent 2, my name is Emma Smith. I'm calling to inquire about any special programs or promotions you may have for electrical services.

Agent: Good morning, Emma. Thank you for reaching out to us. We do have some special programs and promotions available. Could you please provide me with some details about the type of electrical service you are looking for?

Customer: Sure, I recently moved into a new house and I'm interested in getting some additional electrical outlets installed in a few rooms. Also, I would like to upgrade the lighting fixtures in my kitchen.

Agent: That's great, Emma. We have a special promotion running currently for residential customers. If you choose to install five or more electrical outlets, we will provide a 15% discount on the total cost. Additionally, for upgrading your kitchen lighting fixtures, we have a 10% discount on the installation charges.

Customer: That sounds like a good deal. Can you give me an estimate of the total cost for installing the outlets and upgrading the lighting fixtures?

Agent: Of course, Emma. To provide you with an accurate estimate, I would need to schedule a visit from one of our electricians to assess your requirements. The estimate will depend on factors such as the number of outlets needed and the type of lighting fixtures you have in mind. Would you like me to schedule a visit for you?

Customer: Yes, please go ahead and schedule a visit. I'm available on weekdays after 5:00 PM. 

Agent: Noted, Emma. I will schedule a visit for this coming Thursday at 5:30 PM. Our electrician will assess your needs and provide you with an estimate during the visit. Is there anything else I can assist you with?

Customer: Actually, I have one more question. Do you offer any financing options for your services?

Agent: Yes, we do have financing options available for our customers. We understand that electrical work can sometimes be a significant expense, and we want to ensure that our customers have flexible payment options. Our financing team can provide you with more details and help you choose the best plan for your needs. Would you like me to connect you with them?

Customer: That would be great, thank you. Please connect me with the financing team.

Agent: Certainly, Emma. I will transfer your call to our financing department. They will be able to assist you further with the financing options. Is there anything else I can help you with today?

Customer: No, that's all for now. Thank you for your assistance, Agent 2.

Agent: You're welcome, Emma. It was my pleasure assisting you today. Have a great day!

Customer: You too, Agent 2. Goodbye.

Agent: Goodbye, Emma. Take care.",neutral,2,Special Programs and Promotions,resolved
"[Phone ringing]

Agent 1: Good afternoon, thank you for calling ElectricVolt. This is Agent 1 speaking, how can I assist you today?

Customer: Finally, someone answered! I've been trying to reach your company for days. Your customer service is terrible!

Agent 1: I apologize for the inconvenience and any frustration caused, sir. I understand you've been having trouble reaching us. How can I assist you with your account today?

Customer: Well, first of all, I never received my last invoice. I need to know the amount and when it's due!

Agent 1: I'm sorry to hear that, sir. Let me quickly pull up your account information here. May I have your full name and address, please?

Customer: It's John Smith, and my address is 123 Main Street.

Agent 1: Thank you, Mr. Smith. I've located your account. I see that the invoice was indeed issued and mailed out on the 5th of this month. The total amount due is $150, and the payment is due by the 20th. I apologize for any delay in receiving it. Is there anything else I can assist you with regarding this matter?

Customer: No, that's all for now. But this isn't the first time I've had issues with your company. Your technicians never arrive on time, and the work they do is subpar!

Agent 1: I apologize for the inconvenience and any dissatisfaction you've experienced, Mr. Smith. Customer satisfaction is important to us, and I understand your frustration. Please be assured that I will address this issue promptly. Could you please provide me with more details regarding the technician visits?

Customer: Well, last month they were scheduled to arrive at 9 am, but they didn't show up until noon! And the quality of their work was just not up to par. I had to hire another electrician to fix their mistakes!

Agent 1: I'm truly sorry to hear about your negative experience, Mr. Smith. We strive to provide timely and high-quality service to all our customers. I will personally investigate this matter and ensure appropriate action is taken. Could you please provide me with the date and time of the technician visit you're referring to?

Customer: It was on June 15th, and they were supposed to arrive at 9 am sharp!

Agent 1: Thank you for providing that information, Mr. Smith. I will make a note of it and escalate this issue to our service department for immediate attention. We value your feedback and appreciate you bringing this to our attention. Is there anything else I can assist you with today?

Customer: No, that's all for now. But I expect these issues to be resolved promptly. Otherwise, I'll have no choice but to switch to a different electrical company!

Agent 1: I completely understand your frustration, Mr. Smith, and I assure you that we will do everything in our power to rectify the situation. We value your business and would hate to see you go. Thank you for bringing these concerns to our attention, and please be assured that we will work towards a resolution. Is there anything else I can assist you with?

Customer: That's all for now. Just make sure these issues are resolved, or else you'll lose a loyal customer.

Agent 1: I understand your concern, Mr. Smith, and I'll personally ensure that your concerns are addressed promptly. Thank you for your patience and understanding. If you have any further questions or concerns, please don't hesitate to reach out to us. We appreciate your business and look forward to resolving these matters. Have a great day!

Customer: Thank you. Goodbye.

Agent 1: Goodbye, Mr. Smith. Have a great day!",angry,1,Account Management,resolved
"Agent 1: Good afternoon, thank you for calling ElectricVolt. My name is Agent 1. How can I assist you today?

Customer: Finally, someone answered! I've been experiencing a power outage in my home for the past hour. This is unacceptable!

Agent 1: I apologize for the inconvenience, sir. I understand your frustration. Let me assure you that we will do our best to resolve this issue as quickly as possible. May I have your name and address, please?

Customer: My name is John Smith, and I live at 123 Main Street.

Agent 1: Thank you, Mr. Smith. I have your address here. I see that there is indeed an outage reported in your area. Our technicians are already working on it. We estimate that power will be restored within the next hour.

Customer: An hour? Are you kidding me? I can't wait that long! I have important work to do!

Agent 1: I completely understand your urgency, Mr. Smith. Our team is working diligently to resolve the issue as fast as possible. In the meantime, is there anything else I can assist you with or any questions you may have?

Customer: No, I just want my power back on immediately. This is highly inconvenient!

Agent 1: I apologize again for the inconvenience, Mr. Smith. I assure you that we are doing everything we can to get your power restored promptly. If there are any further updates or changes, we will let you know immediately.

Customer: Fine, but this better not happen again! I rely on electricity for my work, and this outage is costing me money.

Agent 1: I completely understand your frustration, Mr. Smith. We strive to provide reliable service, and I apologize for falling short this time. Please know that we are constantly working to improve our infrastructure to prevent such outages in the future.

Customer: Well, I certainly hope so. This is unacceptable.

Agent 1: I understand, sir. We take your feedback seriously, and we appreciate you bringing this to our attention. Is there anything else I can assist you with at this time?

Customer: No, I just want my power back on. I'll be eagerly waiting.

Agent 1: I understand, Mr. Smith. Rest assured, our team is working diligently to resolve the issue. If there's anything else you need assistance with in the future, please don't hesitate to reach out. Thank you for your patience, and have a great day.

Customer: I hope this gets resolved soon. Goodbye.",angry,1,Outages and Emergencies,resolved
