call_transcript,mood,agent_number,intention,resolution
"Agent 3: Thank you for calling ElectricVolt, my name is Agent 3. How may I assist you today?

Customer: Hi Agent 3, my name is Emily Johnson. I recently moved into a new house and I have a few inquiries regarding your electrical services.

Agent 3: Hello Emily, I'm here to help. What specific questions do you have about our services?

Customer: Well, first of all, I would like to know if you provide electrical services for both residential and commercial properties.

Agent 3: Absolutely, Emily. ElectricVolt offers services for both residential and commercial customers. Whether you need assistance with your home electrical system or require electrical work for your business, we've got you covered.

Customer: That's great to hear. I also wanted to inquire about the types of services you offer. Can you give me an overview?

Agent 3: Of course, Emily. Our services include electrical installations, repairs, maintenance, and upgrades. We can handle anything from wiring and lighting installations to panel upgrades and circuit repairs. We also offer electrical safety inspections to ensure your property meets the required standards.

Customer: That's exactly what I need. How do I schedule an appointment for a service?

Agent 3: Scheduling an appointment is easy, Emily. You can either call our customer service line or visit our website to fill out a service request form. Once we receive your request, we'll contact you to confirm the details and arrange a convenient time for our technicians to visit your property.

Customer: That sounds convenient. Are your technicians licensed and insured?

Agent 3: Absolutely, Emily. All our technicians are highly skilled, licensed, and insured. They undergo regular training to stay up-to-date with the latest industry standards and safety protocols. You can trust that our team will provide you with top-quality service.

Customer: That's reassuring to know. How long does it usually take for a technician to arrive once an appointment is scheduled?

Agent 3: We understand the importance of timely service, Emily. Once an appointment is confirmed, our technicians strive to arrive at your property within the agreed-upon time slot. However, please note that unforeseen circumstances or emergency calls may sometimes cause slight delays. Rest assured, we will always keep you informed of any changes.

Customer: I appreciate the transparency. One more question, do you offer any warranties on your services or products?

Agent 3: Yes, Emily. We stand behind the quality of our work and offer warranties on both our services and products. The specific warranty details may vary depending on the nature of the job and the products used. Our customer service team can provide you with more information on the warranties associated with your specific service.

Customer: That's great to hear. Thank you for answering all my questions, Agent 3. I will definitely consider ElectricVolt for my electrical needs.

Agent 3: You're welcome, Emily. It was my pleasure assisting you. If you have any further questions or need any more information, don't hesitate to reach out. We look forward to serving you in the future. Have a great day!

Customer: Thank you, Agent 3. You too! Goodbye.

Agent 3: Goodbye, Emily. Take care!",neutral,3,Inquiries and General Information,unresolved
"Agent 2: Thank you for calling ElectricVolt, my name is Agent 2. How may I assist you today?

Customer: Hi Agent 2, my name is Sarah Johnson. I'm calling regarding a billing issue I have with my recent electrical service.

Agent 2: Hello Sarah, I understand you have a billing concern. I'll do my best to assist you. Could you please provide me with your account number so I can pull up your information?

Customer: Sure, my account number is EV123456.

Agent 2: Thank you, Sarah. I have your account details in front of me. How can I help you with your billing issue?

Customer: Well, I received my electric bill for this month, and it seems to be significantly higher than usual. I'm not sure why that is.

Agent 2: I apologize for any confusion, Sarah. Let me take a look at the details of your bill. I see that your usage this month is indeed higher than the previous months. Have you noticed any changes in your electricity consumption recently?

Customer: No, I haven't made any changes to my usage habits. It's been pretty consistent, so I'm not sure why there's such a sudden increase.

Agent 2: I understand your concern, Sarah. Let me investigate this further for you. I'll need to check the meter reading for this billing cycle. Please bear with me for a moment while I access that information.

(Customer waits for a moment)

Agent 2: Thank you for your patience, Sarah. I have reviewed the meter readings for your billing cycle, and they appear to be accurate. However, it seems that there was a rate increase for electricity in your area during this period, which may be the reason for the higher bill.

Customer: Oh, I wasn't aware of any rate increase. Is there any way to verify this information?

Agent 2: Absolutely, Sarah. I can provide you with the details of the rate increase and the dates it went into effect. Additionally, I can send you a copy of the official notice we received from the utility provider. Would that be helpful?

Customer: Yes, that would be great. I would like to see the official notice to better understand the situation. Thank you for offering that.

Agent 2: Not a problem, Sarah. I will send the notice to your registered email address within the next few minutes. Is there anything else I can assist you with today?

Customer: No, that will be all for now. Thank you for your help, Agent 2. I appreciate your assistance in resolving this issue.

Agent 2: You're welcome, Sarah. I'm glad I could help. If you have any further questions or concerns, please don't hesitate to reach out to us. Have a great day!

Customer: Thank you, Agent 2. You too. Goodbye.

Agent 2: Goodbye, Sarah. Take care.",neutral,2,Billing and Payments,unresolved
"Agent 3: Thank you for calling ElectricVolt. My name is Agent 3. How may I assist you today?

Customer: Finally, someone picked up! I've been on hold for ages. I'm really angry about the service I received from your company.

Agent 3: I apologize for the long wait; we've been experiencing a high volume of calls today. I understand you're upset, and I'm here to help. Could you please provide me with your name and the issue you're facing?

Customer: My name is John Smith, and I recently had an electrical service done at my house. The electrician made a mess, damaged some of my property, and left without cleaning up. I want someone to address this immediately!

Agent 3: I'm sorry to hear about your experience, Mr. Smith. I completely understand your frustration. Let me assure you that we take such matters seriously. I'll make a note of your complaint and escalate it to our management team. They'll investigate the issue and take appropriate action. Could you please provide me with the date of the service and any relevant details?

Customer: The service was done last Thursday, and the electrician's name was Mark. He arrived late and seemed very careless throughout the whole process. He even broke a vase in my living room and didn't apologize or offer to pay for it.

Agent 3: I apologize for the inconvenience caused by our electrician, Mr. Smith. We'll make sure to address this issue with Mark and provide appropriate training to avoid such incidents in the future. Regarding the damage to your property, we'll have our insurance department contact you to discuss the necessary compensation.

Customer: It's about time someone took responsibility! I expect a prompt response from your insurance department. This whole situation has caused me a lot of stress and inconvenience.

Agent 3: I completely understand, Mr. Smith. Our insurance department will reach out to you within the next 24 hours to discuss the compensation for the damage caused. Is there anything else I can assist you with today?

Customer: Well, actually, I have some concerns regarding the electrical work done at my neighbor's house. I suspect it wasn't done up to code and could potentially be a fire hazard. I want to report this immediately!

Agent 3: Thank you for bringing this to our attention, Mr. Smith. Ensuring the safety of our customers is our top priority. I'll need some information about your neighbor's house, such as the address and the name of the homeowner, in order to initiate an investigation. Rest assured, we'll take appropriate action if any violations are found.

Customer: The address is 123 Main Street, and the homeowner's name is Sarah Johnson. I've noticed some flickering lights and strange smells coming from her house. I don't want to wait until something terrible happens before it's addressed!

Agent 3: Thank you for providing the details, Mr. Smith. I'll create a report about the potential safety concerns at 123 Main Street and forward it to our compliance team. They'll conduct a thorough inspection and ensure that all necessary measures are taken to rectify any issues. Your vigilance is greatly appreciated.

Customer: I'm glad to hear that you're taking this seriously. I hope this matter is resolved quickly and without any further incidents.

Agent 3: We understand your urgency, Mr. Smith, and we'll prioritize this matter accordingly. Is there anything else I can assist you with today?

Customer: No, that would be all for now. I just hope these issues get resolved soon. Thank you for your help, Agent 3.

Agent 3: You're welcome, Mr. Smith. Rest assured, we'll do our best to address these concerns promptly. If you have any further questions or issues, don't hesitate to reach out to us. Thank you for choosing ElectricVolt, and have a great day!",angry,3,Regulatory Compliance and Legal Inquiries,resolved
"Agent 3: Thank you for calling ElectricVolt, my name is Agent 3. How may I assist you today?

Customer: Hi Agent 3, I'm John Smith. I recently moved into a new house and I'm looking to get some electrical work done. Can you provide me with some general information about your services?

Agent 3: Of course, Mr. Smith! We offer a wide range of electrical services for both residential and commercial customers. Our services include electrical installations, repairs, maintenance, and upgrades. We can also assist with lighting solutions, wiring, panel upgrades, and much more. Is there something specific you need help with?

Customer: Well, I need to install some additional outlets in my living room and upgrade the lighting fixtures. Can you give me an idea of the process and cost for these services?

Agent 3: Certainly, Mr. Smith. For adding outlets, our electricians would need to assess your current electrical system and determine the best locations for the new outlets. The cost will depend on the number of outlets and the complexity of the installation. As for lighting fixture upgrades, we can discuss your preferences and provide you with options that fit your budget. I can arrange for an electrician to visit your home and provide you with a detailed estimate. Would you like me to schedule a visit?

Customer: That would be great, Agent 3. I'm available next Tuesday afternoon, if that works for you.

Agent 3: Perfect, Mr. Smith. I've scheduled a visit for Tuesday afternoon. Our electrician will come prepared with all the necessary tools to assess your requirements and provide you with an estimate. Is there anything else I can assist you with?

Customer: Actually, yes. I'm also considering installing outdoor lighting around my house. Do you provide such services?

Agent 3: Absolutely, Mr. Smith. We offer outdoor lighting installation as well. Our expert electricians can help you design and install lighting fixtures that enhance the security and aesthetics of your property. If you'd like, I can include this in the visit on Tuesday and have the electrician discuss your options and provide an estimate.

Customer: That would be fantastic, Agent 3. Thank you for your assistance. Is there anything else I should know before the visit?

Agent 3: Just make sure that all areas where you want the electrical work to be done are easily accessible. It would also be helpful if you could provide any specific requirements or preferences you have regarding the work. Our electrician will take care of the rest. If you have any further questions or concerns, feel free to contact us. Is there anything else I can help you with today, Mr. Smith?

Customer: No, that covers everything for now. Thank you for your help, Agent 3. I'm really impressed with ElectricVolt's services so far.

Agent 3: It's our pleasure, Mr. Smith. We strive to provide the best electrical services to our customers. We look forward to assisting you with your electrical needs. Have a great day!

Customer: You too, Agent 3. Goodbye!

Agent 3: Goodbye, Mr. Smith, take care!",happy,3,Inquiries and General Information,unresolved
"[Phone rings]

Agent 3: Thank you for calling ElectricVolt, my name is Agent 3. How can I assist you today?

Customer: Hi Agent 3, my name is Emily Smith. I'm a happy customer of ElectricVolt, and I have a few questions regarding regulatory compliance and legal inquiries.

Agent 3: Hello Emily! I'm glad to hear that you're a satisfied customer. I'll be happy to help you with any questions you have. What specifically would you like to know about regulatory compliance and legal inquiries?

Customer: Well, I recently heard about some changes in electrical safety regulations for residential properties. I wanted to make sure that my home is compliant with these new regulations. Can you provide me with some information on this?

Agent 3: Of course, Emily. I can certainly help you with that. Can you please provide me with your address so that I can check the regulations specific to your area?

Customer: Sure, my address is 123 Main Street, Anytown.

Agent 3: Thank you, Emily. Let me check that for you. [Agent 3 searches for information] According to our records, your home is in an area where the electrical safety regulations were updated last year. These changes mainly focus on improving fire safety and the proper installation of electrical systems. Would you like me to provide you with a summary of these updates?

Customer: Yes, please. I want to ensure that my home is as safe as possible.

Agent 3: Absolutely. The new regulations require inspections of electrical systems in older homes to ensure that they meet the current safety standards. Additionally, there are stricter guidelines for the installation of smoke detectors and ground fault circuit interrupters. These measures aim to prevent electrical fires and improve overall safety. It's always a good idea to have a licensed electrician perform an inspection to ensure compliance.

Customer: Thank you for the information, Agent 3. I'll definitely schedule an inspection with a licensed electrician soon. Is there anything else I should be aware of regarding regulatory compliance?

Agent 3: You're welcome, Emily. It's great to see that you take electrical safety seriously. Apart from the changes I mentioned, it's important to note that local regulations may vary, so it's best to consult with your local building department or electrical inspector for any specific requirements in your area. They will be able to provide you with the most accurate and up-to-date information.

Customer: That's good to know. I'll make sure to reach out to the local authorities for any additional information. Now, I also have a legal inquiry. I recently had some electrical work done by a different contractor, and I'm not satisfied with the quality of their work. What should I do in this situation?

Agent 3: I'm sorry to hear that you're facing issues with the work done by another contractor, Emily. In such cases, it's generally recommended to first try to resolve the matter directly with the contractor. If that doesn't result in a satisfactory resolution, you may consider filing a complaint with your local consumer protection agency or the Better Business Bureau. They can guide you through the process of resolving disputes and help protect your rights as a consumer.

Customer: Thank you, Agent 3. I will reach out to the contractor and try to resolve the issue. If that doesn't work, I'll definitely contact the appropriate agencies for assistance. Is there anything else I should know or do in this situation?

Agent 3: You're welcome, Emily. It sounds like you're handling the situation responsibly. I would also recommend documenting any issues or concerns you have with the contractor's work, including photographs if possible. This documentation will help support your case if you need to escalate the matter further. Additionally, it's always a good idea to consult with a legal professional for advice specific to your situation.

Customer: That makes sense, Agent 3. I'll make sure to document everything and seek legal advice if needed. Thank you so much for your help and guidance. You've been very informative and patient with all my questions.

Agent 3: It's my pleasure, Emily. I'm here to assist you and ensure your satisfaction. I'm glad I could provide you with the information you needed. If you have any further questions or concerns, please don't hesitate to reach out to us. We're always here to help.

Customer: I appreciate that, Agent 3. I'll definitely keep that in mind. Thank you again for your excellent customer service. Have a great day!

Agent 3: Thank you, Emily. I'm glad I could assist you. You have a wonderful day as well. Goodbye!

Customer: Goodbye!",happy,3,Regulatory Compliance and Legal Inquiries,resolved
"Agent 2: Thank you for calling ElectricVolt. My name is Agent 2. How can I assist you today?

Customer: Hi Agent 2, my name is John Smith. I'm calling because I need some electrical services at my home.

Agent 2: Hello John, I'm glad you reached out to us. What specific electrical services do you require?

Customer: Well, I have a few things that need to be addressed. Firstly, I have a faulty electrical outlet in my living room that needs to be replaced. Secondly, I've been experiencing some flickering lights in my bedroom, so I would like an electrician to check that as well. Lastly, I'm interested in installing some additional outdoor lighting in my backyard.

Agent 2: Thank you for providing the details, John. We can definitely assist you with all of those requests. Let's start with the faulty outlet in your living room. I'll schedule an appointment for an electrician to come and replace it. Does tomorrow morning work for you?

Customer: Yes, tomorrow morning works perfectly for me. What time can I expect the electrician?

Agent 2: The electrician will be at your place between 9 AM and 11 AM. Is there anything specific you'd like the electrician to know before they arrive?

Customer: No, nothing specific. Just that the outlet is not working and needs to be replaced.

Agent 2: Noted. Now, let's move on to the flickering lights in your bedroom. Since this might be a potential electrical issue, we highly recommend sending an electrician to inspect it. Can we schedule an appointment for that as well?

Customer: Yes, please. I would appreciate it if someone could come and check it out. Anytime this week would work for me.

Agent 2: Alright, how about Thursday afternoon? Would that be convenient for you?

Customer: Yes, Thursday afternoon works fine. What time should I expect the electrician?

Agent 2: The electrician will be at your place between 2 PM and 4 PM on Thursday. If there are any changes, we'll inform you in advance.

Customer: Great, thank you. Now, for the outdoor lighting installation, can you provide me with an estimate of the cost?

Agent 2: Of course, John. To give you an accurate estimate, we would need some more details about the specific lighting fixtures you have in mind and the size of your backyard. Would it be possible for us to schedule a visit to your property so that our electrician can assess the requirements and provide you with a detailed quote?

Customer: Yes, that sounds reasonable. Please schedule a visit at your earliest convenience.

Agent 2: Perfect, I'll schedule a visit for next week. Our electrician will reach out to you to confirm the date and time. Is there anything else I can assist you with today, John?

Customer: No, that's all for now. Thank you for your help, Agent 2.

Agent 2: You're welcome, John. It was my pleasure assisting you. If you have any further questions or concerns, don't hesitate to reach out. Have a great day!

Customer: You too, Agent 2. Goodbye.

Agent 2: Goodbye, John. Take care.",neutral,2,Service Requests and Appointments,resolved
"Agent 1: Thank you for calling ElectricVolt. My name is Agent 1. How can I assist you today?

Customer: Hi, Agent 1. My name is Emily Johnson. I'm interested in learning more about your company's renewable energy and sustainability programs.

Agent 1: Hello, Emily. I'm glad to hear that you're interested in our programs. We have a variety of options available for both residential and commercial customers. Could you please let me know which one you are interested in?

Customer: I'm actually interested in the residential program. I've been looking for ways to reduce my carbon footprint and make my home more energy-efficient.

Agent 1: That's great to hear, Emily. Our residential program offers several services aimed at promoting energy efficiency and reducing environmental impact. We can help you with solar panel installation, energy-efficient lighting solutions, and even home energy audits to identify areas for improvement. Is there anything specific you would like more information about?

Customer: Solar panel installation sounds interesting. Can you tell me more about the process and the benefits?

Agent 1: Certainly, Emily. Solar panel installation involves placing photovoltaic panels on your roof or any other suitable location to capture sunlight and convert it into electricity. The benefits of going solar include reduced electricity bills, a positive environmental impact by reducing reliance on fossil fuels, and potentially even earning credits for excess energy generated. We offer a free consultation to assess your home's solar potential and provide you with a customized quote.

Customer: That sounds promising. How long does the installation process usually take?

Agent 1: The installation timeline depends on various factors such as the size of the system and your home's specific requirements. On average, it takes around 1-2 weeks from the initial consultation to the completion of the installation. However, please note that this can vary depending on any additional work that might be required, such as electrical panel upgrades or roof repairs.

Customer: Alright, good to know. And what about maintenance? Are there any ongoing costs or efforts involved?

Agent 1: Solar panels generally require minimal maintenance. You'll need to keep them clean from dirt and debris to ensure optimal performance. Additionally, we recommend scheduling periodic inspections to ensure everything is functioning as it should. Most solar panels come with warranties that cover any potential issues for a certain period of time, so you wouldn't have to worry about unexpected expenses. However, it's always a good idea to read the warranty terms and conditions for specific details.

Customer: That's reassuring. I assume there might be some upfront costs involved. Can you give me an idea of the overall investment required for a residential solar panel installation?

Agent 1: The cost of a solar panel installation can vary depending on factors such as the size of the system, your location, and any additional customization you may require. However, as a general estimate, a residential solar panel installation can range from $10,000 to $30,000. It's important to keep in mind that this investment can provide significant long-term savings on your electricity bills and contribute to a greener future.

Customer: I understand. That seems reasonable considering the benefits. One last question, do you offer any financing options for customers who may not be able to pay the entire amount upfront?

Agent 1: Absolutely, Emily. We understand that the upfront cost can be a concern for some customers. That's why we offer various financing options, including solar loans and lease agreements. These options allow you to spread out the cost over time and make it more affordable. Our team can provide you with detailed information on the financing plans available so you can choose the one that best suits your needs.

Customer: That's great to hear. Thank you for all the information, Agent 1. I will definitely consider going solar with ElectricVolt. You've been very helpful.

Agent 1: You're welcome, Emily. I'm glad I could assist you. If you have any further questions or need any additional information, please don't hesitate to reach out. We're here to help you make an informed decision. Thank you for considering ElectricVolt, and have a wonderful day!

Customer: Thank you, Agent 1. I appreciate your assistance. Have a great day too! Goodbye.

Agent 1: Goodbye, Emily. Take care!",neutral,1,Renewable Energy and Sustainability Programs,resolved
