call_transcript,mood,agent_number,intention,resolution
"Agent 3: Thank you for calling ElectricVolt! My name is Agent 3. How can I assist you today?

Customer: Hi, Agent 3. I'm calling to schedule an electrical service appointment for my residence.

Agent 3: Of course, I'd be happy to help you with that. May I have your name, please?

Customer: My name is John Smith.

Agent 3: Thank you, Mr. Smith. Could you please provide me with your address?

Customer: Sure, it's 123 Main Street.

Agent 3: Thank you. Could you also provide me with a contact number?

Customer: Yes, my phone number is 555-1234.

Agent 3: Great, thank you. Now, could you let me know what type of electrical service you require?

Customer: I need some troubleshooting for flickering lights in my living room and also want to install a new ceiling fan.

Agent 3: I see. We can definitely help you with that. Let me check our availability for an appointment. Can you please hold for a moment?

Customer: Sure, no problem.

Agent 3: Thank you for waiting, Mr. Smith. I have a technician available next Tuesday between 10 AM and 12 PM. Does that work for you?

Customer: Yes, that works for me. I'll be home during that time.

Agent 3: Perfect. Now, let's discuss the cost of the service. For troubleshooting the flickering lights and installing the ceiling fan, the total cost will be $200. Is that acceptable to you?

Customer: Yes, that sounds reasonable. Can I pay with a credit card?

Agent 3: Absolutely. We accept all major credit cards. May I have your card details, please?

Customer: Sure, it's 1234-5678-9012-3456, and the expiration date is 12/23.

Agent 3: Thank you, Mr. Smith. I have processed your payment. Is there anything else you would like to add or ask?

Customer: No, that's all for now. Thank you for your assistance.

Agent 3: You're welcome, Mr. Smith. We appreciate your business. Our technician will be at your residence on Tuesday between 10 AM and 12 PM. If you have any further questions or concerns, please don't hesitate to call us. Have a great day!

Customer: Thank you, Agent 3. You too. Goodbye.

Agent 3: Goodbye, Mr. Smith.",neutral,3,Service Requests and Appointments,resolved
"Agent 3: Thank you for calling ElectricVolt! My name is Agent 3. How can I assist you today?

Customer: Hi, Agent 3. I'm having some issues with my electricity at home. I thought I'd give your company a call for technical support and troubleshooting.

Agent 3: Of course, I'll be happy to help you. Can you please provide me with your name and address so I can pull up your account?

Customer: Yes, my name is John Smith and I live at 123 Main Street.

Agent 3: Thank you, John. Let me check your account. I see that you're experiencing issues with your electricity. Could you please describe the problem in more detail?

Customer: Sure. It seems that some of the outlets in my living room are not working. I've tried plugging different devices into them, but nothing seems to be getting power.

Agent 3: I'm sorry to hear about the inconvenience, John. Let's try some troubleshooting steps to identify the issue. Have you checked your circuit breaker to see if any breakers have tripped?

Customer: Yes, I did that earlier, but everything seemed fine. None of the breakers were tripped.

Agent 3: Alright. Let's move on to the next step then. Could you try resetting the GFCI outlets in your living room? They have a reset button that you can press to see if that resolves the problem.

Customer: I didn't even know I had GFCI outlets. Let me check. Ah, I found one with a reset button! I pressed it, and now the outlets are working again! Thank you so much!

Agent 3: You're welcome, John! I'm glad that resolved the issue. GFCI outlets are designed to protect against electrical shocks, so they can sometimes trip and cut off power to the connected outlets. Is there anything else I can assist you with today?

Customer: No, that was my only concern. Thank you for your help, Agent 3.

Agent 3: It was my pleasure assisting you, John. If you have any more questions or issues in the future, don't hesitate to reach out. Have a great day!

Customer: You too, Agent 3. Goodbye!

Agent 3: Goodbye, John! Take care!",neutral,3,Technical Support and Troubleshooting,resolved
"Agent 3: Thank you for calling ElectricVolt, my name is Agent 3. How may I assist you today?

Customer: Hi, Agent 3. My name is Lisa Anderson. I have been experiencing some issues with the electrical services provided by ElectricVolt.

Agent 3: I'm sorry to hear that, Lisa. Could you please provide me with some more details about the issues you are facing?

Customer: Sure. Over the past month, I have noticed frequent power fluctuations in my house. The lights flicker quite often, and sometimes, certain electrical appliances do not work properly.

Agent 3: I apologize for the inconvenience you have faced, Lisa. Power fluctuations can be quite frustrating. Let me check our records and see if there are any known issues in your area.

Customer: Thank you, Agent 3. I appreciate your help.

Agent 3: I couldn't find any reported issues in your area, Lisa. However, I can schedule a technician to visit your place and inspect the electrical connections. Would that be okay with you?

Customer: Yes, that would be great. Please schedule a technician visit at my earliest convenience.

Agent 3: Noted, Lisa. I have scheduled a technician to visit your place tomorrow between 10 AM and 12 PM. Is there anything else I can assist you with?

Customer: Actually, yes. I have also noticed that my electricity bill has been unusually high for the past few months. Is there any way you can help me understand why that might be happening?

Agent 3: I understand your concern, Lisa. High electricity bills can be a result of various factors. I can check your billing history and provide you with a detailed analysis. Could you please provide me with your account number?

Customer: Sure, my account number is 123456789.

Agent 3: Thank you for providing the account number, Lisa. Let me pull up your billing history and analyze it for you.

(Customer and Agent 3 wait for a few moments while the billing history is being analyzed)

Agent 3: Upon reviewing your billing history, Lisa, it seems that there has been a significant increase in your electricity consumption over the past few months. This could be due to increased usage or a potential issue with one of your appliances.

Customer: That's strange because I haven't changed my usage patterns. Is there any way to identify which specific appliance might be causing the issue?

Agent 3: We can try to isolate the issue by conducting a load analysis. This process involves temporarily disconnecting certain appliances and monitoring the electricity consumption. Would you be willing to cooperate with this process?

Customer: Yes, I'm willing to cooperate. Please let me know what steps I need to take.

Agent 3: Thank you for your cooperation, Lisa. I will schedule a technician to visit your place again for the load analysis. They will guide you through the process and help identify any potential issues. Is there anything else I can assist you with today?

Customer: No, that should be all for now, Agent 3. Thank you for your assistance in addressing my concerns.

Agent 3: You're welcome, Lisa. I apologize for the inconvenience caused and I assure you that we will do our best to resolve these issues. If you have any further questions or require any additional support, feel free to reach out to us. Have a great day!

Customer: Thank you, Agent 3. Goodbye.

Agent 3: Goodbye, Lisa. Take care.",neutral,3,Complaints and Grievances,unresolved
"Agent 3: Thank you for calling ElectricVolt, my name is Agent 3. How can I assist you today?

Customer: Hi Agent 3, I'm John Smith. I recently used ElectricVolt's services and I just wanted to share my feedback and suggestions.

Agent 3: Hello John, I'm glad to hear that you're happy with our services. We always appreciate feedback and suggestions. Please go ahead and share your thoughts.

Customer: First of all, I want to commend your team for their professionalism and punctuality. The electrician who came to my house was very knowledgeable and completed the job efficiently. I was impressed with the quality of work.

Agent 3: That's great to hear, John! Our team takes pride in providing excellent service to our customers. Is there anything specific you would like to suggest or any improvements you think we can make?

Customer: Actually, yes. While the electrician did a fantastic job, I think it would be helpful if the company provided more detailed cost estimates upfront. I understand that electrical work can sometimes have unforeseen complications, but having a clearer estimate would help customers plan their budget better.

Agent 3: Thank you for that suggestion, John. We understand the importance of transparency when it comes to pricing. I will definitely pass on this feedback to our management team. Is there anything else you would like to share?

Customer: Yes, one more thing. I think it would be beneficial if ElectricVolt offered a maintenance package for regular electrical inspections and repairs. It would give customers like me peace of mind knowing that our electrical systems are regularly checked and maintained by professionals.

Agent 3: That's a great suggestion, John. We actually have been considering introducing a maintenance package, and your feedback further validates the need for it. I will make sure to communicate this to our team. Thank you for bringing this up.

Customer: You're welcome, Agent 3. I'm glad my feedback could be of help. Overall, I'm extremely satisfied with ElectricVolt's services, and I will definitely recommend your company to others.

Agent 3: Thank you so much, John. We really appreciate your kind words and recommendations. Is there anything else I can assist you with today?

Customer: No, that's all for now. Thank you for your time, Agent 3. Keep up the great work!

Agent 3: Thank you, John. We value your feedback and appreciate your call. Have a wonderful day!

Customer: You too, Agent 3. Goodbye!

Agent 3: Goodbye, John. Take care!",happy,3,Feedback and Suggestions,resolved
"Agent 3: Thank you for calling ElectricVolt. My name is Agent 3. How may I assist you today?

Customer: Hi Agent 3! I'm Mrs. Johnson and I'm interested in knowing more about any special programs or promotions ElectricVolt is currently offering.

Agent 3: Hi Mrs. Johnson! I'm glad you called. We do have some exciting programs and promotions available. Let me provide you with all the details. First, we have a special discount for new residential customers. If you schedule a service with us within the next month, you'll receive a 15% discount on your first service.

Customer: That sounds great! I've been wanting to get some electrical work done in my house. Can you tell me more about the discount?

Agent 3: Absolutely! The discount applies to any electrical service you require, whether it's repairing faulty wiring, installing new lighting fixtures, or upgrading your electrical panel. We have highly skilled electricians who can handle any task efficiently and safely.

Customer: That's exactly what I need. It's good to know that ElectricVolt has professionals who can take care of everything. Are there any other promotions available?

Agent 3: Yes, indeed! We also have a referral program. If you refer ElectricVolt to a friend or family member, and they schedule a service with us, both you and your referral will receive a $50 credit towards your next service.

Customer: That's a fantastic program! I'll be sure to spread the word about ElectricVolt. It's always great to support a company that values its customers.

Agent 3: We appreciate your support, Mrs. Johnson. We truly believe in providing exceptional service to our customers. In addition to these promotions, we also have seasonal offers throughout the year. For example, during the summer months, we often have special discounts on air conditioning system installations or repairs.

Customer: That's really helpful to know. I'll keep an eye out for those summer offers. Is there anything else I should be aware of?

Agent 3: Actually, yes! We have a loyalty program for our regular customers. Once you've used ElectricVolt's services three times, you'll automatically become a member of our loyalty program. As a member, you'll receive exclusive discounts and priority service scheduling.

Customer: Wow, that's impressive! It's great to see that ElectricVolt values its loyal customers. I'll definitely be taking advantage of these promotions and programs.

Agent 3: We're thrilled to hear that, Mrs. Johnson! If you have any further questions or if there's anything else I can assist you with, please don't hesitate to ask.

Customer: Thank you, Agent 3. You've provided me with all the information I needed. I'm excited to schedule a service with ElectricVolt and take advantage of these promotions.

Agent 3: You're very welcome, Mrs. Johnson. We look forward to serving you and ensuring all your electrical needs are met. Have a wonderful day!

Customer: You too, Agent 3. Goodbye!

Agent 3: Goodbye, Mrs. Johnson!",happy,3,Special Programs and Promotions,resolved
"[Phone ringing]

Agent 2: Good morning, thank you for calling ElectricVolt. My name is Agent 2. How can I assist you today?

Customer: Hi Agent 2, my name is John Doe. I'm looking to get some electrical services for my new office building.

Agent 2: Good morning, Mr. Doe. I'd be happy to help you with that. Could you please provide me with some details about the services you require?

Customer: Sure. I need electrical wiring and installation for the entire building, including the office spaces and conference rooms. I also need lighting fixtures and outlets installed throughout the premises.

Agent 2: Thank you for providing those details, Mr. Doe. To better assist you, could you please let me know the approximate square footage of your office building?

Customer: It's about 5,000 square feet.

Agent 2: Great. And do you have any specific preferences or requirements for the electrical setup?

Customer: I would like energy-efficient lighting options and I need to ensure that the electrical system is up to code and meets all safety standards.

Agent 2: Noted, Mr. Doe. We prioritize safety and compliance with all our installations. We have a team of experienced electricians who can handle your requirements. May I ask when you would like the work to be completed?

Customer: Ideally, I would like it done within the next two weeks. Is that possible?

Agent 2: Absolutely, Mr. Doe. Our team will do their best to accommodate your timeline. In order to provide you with an accurate quote, I will need to schedule a site visit. Is there a convenient time for our electrician to come and assess the premises?

Customer: How about next Monday afternoon around 3 pm? Will that work for you?

Agent 2: That works perfectly, Mr. Doe. I will schedule the site visit for that time. Our electrician will assess your office building and provide you with a detailed quote for the services you require. Is there anything else I can assist you with today?

Customer: No, that's all for now. Thank you, Agent 2, for your help. I look forward to meeting your electrician next Monday.

Agent 2: You're welcome, Mr. Doe. We appreciate your business and we'll make sure to provide you with top-notch service. If you have any further questions or concerns, please don't hesitate to reach out to us. Have a great day!

Customer: Thank you, Agent 2. Have a great day too. Goodbye!

Agent 2: Goodbye, Mr. Doe. Take care!",neutral,2,Contractor and Partner Communications,resolved
"Agent 1: Thank you for calling ElectricVolt. My name is Agent 1. How may I assist you today?

Customer: Hi, Agent 1. I'm John Smith, and I have a few inquiries about your electrical services.

Agent 1: Hello, John. I'm here to help. What specific information are you looking for?

Customer: Well, I recently purchased a new house, and I wanted to know if ElectricVolt offers electrical wiring installation services for residential properties.

Agent 1: Absolutely, John. We provide a wide range of electrical services, including wiring installation for residential properties. Our team of skilled electricians can handle all your wiring needs.

Customer: That's great to hear. Can you give me an estimate of the cost for a typical residential wiring installation?

Agent 1: The cost can vary depending on the size and complexity of your property. However, on average, residential wiring installations can range from $2,000 to $10,000. Would you like us to schedule a visit to your property for a more accurate estimate?

Customer: Yes, that would be helpful. How soon can someone come to assess my property?

Agent 1: Our technicians are usually available within 24-48 hours. I can schedule a visit for you if you provide me with your address and preferred date and time.

Customer: Sure, let me grab that information. (provides address and preferred date and time)

Agent 1: Thank you, John. I have scheduled a technician to visit your property on [date] at [time]. They will assess your wiring requirements and provide you with a detailed estimate.

Customer: Perfect. While we're on the topic, I have another question. Does ElectricVolt offer any maintenance services for electrical systems?

Agent 1: Absolutely, John. We offer comprehensive maintenance services to ensure your electrical systems are running smoothly and efficiently. Our technicians can perform regular inspections, troubleshoot any issues, and provide necessary repairs or replacements.

Customer: That's good to know. How often should I schedule maintenance for my electrical system?

Agent 1: It is recommended to schedule maintenance at least once a year. This allows our technicians to identify any potential issues before they become major problems and ensures your electrical system remains safe and reliable.

Customer: Alright, I'll keep that in mind. One last question. Does ElectricVolt also provide electrical services for commercial properties?

Agent 1: Yes, we do. ElectricVolt offers a wide range of electrical services for commercial properties, including wiring installations, maintenance, repairs, and upgrades. Our team has experience working with various types of commercial buildings, such as offices, retail spaces, and industrial facilities.

Customer: That's great to hear. I might need your services for my office building in the future. I'll keep ElectricVolt in mind.

Agent 1: We would be happy to assist you with any future electrical needs, John. Is there anything else I can help you with today?

Customer: No, that's all for now. Thank you for answering my questions, Agent 1.

Agent 1: You're welcome, John. It was my pleasure assisting you. If you have any further inquiries or require any electrical services in the future, don't hesitate to reach out to ElectricVolt. Have a great day!

Customer: Thank you, Agent 1. You too. Goodbye.

Agent 1: Goodbye, John. Take care.",neutral,1,Inquiries and General Information,resolved
"Agent 3: Thank you for calling ElectricVolt, my name is Agent 3. How may I assist you today?

Customer: Hi Agent 3, I'm James Smith. I recently moved into a new house and I need to have some electrical work done. Can you help me with that?

Agent 3: Absolutely, James! Congratulations on your new house. We specialize in providing electrical services for both residential and commercial customers. What specific electrical work do you need assistance with?

Customer: Thank you! I need to have some additional outlets installed in a few rooms, as well as some light fixtures replaced. Is this something your company can handle?

Agent 3: Definitely, James! Our skilled electricians can handle all types of electrical work, including outlet installations and light fixture replacements. Could you please provide me with your address so that we can schedule a service appointment?

Customer: Sure, my address is 123 Main Street. How soon can you send someone over?

Agent 3: Thank you, James. Let me check our schedule for availability. It looks like we have an opening tomorrow morning. Would that work for you?

Customer: That works perfectly! Thank you for accommodating me so quickly.

Agent 3: You're welcome, James! We understand the importance of timely service. Is there anything else you need assistance with?

Customer: Actually, yes. I'm also considering installing some outdoor lighting in my backyard. Can your company handle that as well?

Agent 3: Absolutely! We offer a wide range of electrical services, including outdoor lighting installations. Our electricians can help you design and install the perfect lighting setup for your backyard. Would you like us to include that in the same service appointment?

Customer: That would be great, Agent 3. I appreciate your company's versatility and expertise. Is there anything else I need to know or prepare for the service appointment?

Agent 3: Thank you, James! Our electrician will arrive fully equipped with all the necessary tools and materials. It would be helpful if you could ensure clear access to the areas where the work will be done. Additionally, if you have any specific preferences or requirements, please let us know in advance.

Customer: Understood. I'll make sure everything is ready for the appointment. Thank you for your assistance, Agent 3. You've been very helpful.

Agent 3: You're most welcome, James! It's our pleasure to assist you. If you have any further questions or need any additional information, please don't hesitate to reach out to us. We look forward to serving you tomorrow and providing you with excellent electrical services.

Customer: I really appreciate your professionalism, Agent 3. I'm confident that ElectricVolt will do a great job. Thank you once again!

Agent 3: Thank you for your kind words, James. We strive to deliver the best service possible to our customers. Have a wonderful day and we'll see you tomorrow!",happy,3,Contractor and Partner Communications,resolved
"[Phone ringing]

Agent 2: Good morning, thank you for calling ElectricVolt. My name is Agent 2. How can I assist you today?

Customer: Hi Agent 2, my name is Emily Johnson. I'm calling regarding my account management.

Agent 2: Good morning, Emily. I'm here to help you with any account-related inquiries. How can I assist you specifically?

Customer: Well, I recently moved to a new apartment, and I need to update my billing address and contact information.

Agent 2: I can definitely assist you with that. May I have your current address and the new address you'd like to update it with?

Customer: Sure. My current address is 123 Main Street, and my new address is 456 Elm Avenue.

Agent 2: Thank you for providing that information, Emily. I have updated your billing address and contact details in our system. Is there anything else I can assist you with?

Customer: Actually, I have a few more questions. I noticed that my last bill seemed higher than usual. Can you help me understand why?

Agent 2: Of course, Emily. Let me take a look at your billing history to provide you with an explanation. Please bear with me for a moment.

[Agent 2 reviews the customer's billing history]

Agent 2: Thank you for your patience, Emily. It appears that the higher bill was due to an increase in your energy consumption during the summer months. This is quite common as cooling systems tend to use more electricity. Is there anything specific you'd like me to check regarding the bill?

Customer: That makes sense. I just wanted to ensure that there weren't any errors or additional charges. Can you confirm that the charges are accurate?

Agent 2: Absolutely, Emily. I have reviewed your bill thoroughly, and there are no errors or additional charges. The amount reflects your actual energy consumption for the billing period. If you have any further questions or concerns, please let me know.

Customer: Thank you for checking, Agent 2. I appreciate your assistance. One last thing, I've been experiencing some flickering lights in my apartment. Is this something ElectricVolt can help with?

Agent 2: Certainly, Emily. Flickering lights can be caused by various factors, such as faulty wiring or electrical fixtures. Our company specializes in electrical services, and we can definitely send a technician to assess the issue and provide a solution. Would you like me to schedule an appointment for you?

Customer: Yes, please. That would be great. I work from 9 to 5, Monday to Friday. So, if possible, I would prefer an appointment outside of those hours.

Agent 2: Noted, Emily. I will arrange for a technician to visit your apartment outside of your working hours. Is there a specific day or time that would be most convenient for you?

Customer: Any day after 5:30 PM works for me. I'm flexible with the exact date.

Agent 2: Alright, Emily. I will schedule the appointment for a technician to visit your apartment after 5:30 PM on a convenient day. You will receive a confirmation email with all the details shortly. Is there anything else I can assist you with?

Customer: No, that's all. Thank you so much for your help, Agent 2. I really appreciate it.

Agent 2: You're welcome, Emily. It was my pleasure assisting you. If you have any further questions or need assistance in the future, don't hesitate to reach out to us. Have a great day!

Customer: Thank you, Agent 2. You too. Goodbye!

Agent 2: Goodbye, Emily. Take care!",neutral,2,Account Management,resolved
