call_transcript,mood,agent_number,intention,resolution
"Agent 2: Thank you for calling ElectricVolt. My name is Agent 2. How can I assist you today?

Customer: Hi Agent 2, I'm John Smith. I recently had some electrical work done by ElectricVolt, and I wanted to provide some feedback and suggestions.

Agent 2: Thank you for reaching out, Mr. Smith. We appreciate your feedback. Could you please share your experience with us?

Customer: Overall, the work done by your electricians was satisfactory. However, I did face a few issues during the process. Firstly, the appointment for the initial assessment was delayed by a day, which caused some inconvenience.

Agent 2: I apologize for the inconvenience caused, Mr. Smith. We strive to maintain punctuality and I'm sorry that we fell short in this instance. I'll make sure to pass on this feedback to the scheduling team to ensure it doesn't happen again in the future.

Customer: Thank you for understanding. Another concern I had was with the cleanliness during the installation. There were some leftover debris and packaging materials that were not properly disposed of. It would be great if your team could be more mindful of cleanliness in the future.

Agent 2: I apologize for the oversight, Mr. Smith. We will definitely communicate this to our technicians to ensure they leave the premises clean after completing their work. Your feedback is valuable in helping us improve our services.

Customer: I appreciate that. Lastly, I noticed that the pricing for the services was a bit higher compared to other electrical companies in the area. While I understand the need for quality work, it would be helpful if you could review your pricing structure to make it more competitive.

Agent 2: Thank you for bringing this to our attention, Mr. Smith. We constantly evaluate our pricing to ensure it remains competitive in the market. I will pass on your feedback to our management team for their consideration.

Customer: That's good to hear. I understand that these issues may seem minor, but I believe addressing them will help improve the overall customer experience. I hope my feedback will be taken constructively.

Agent 2: Absolutely, Mr. Smith. We value all feedback, no matter how small it may seem. It is through feedback like yours that we can identify areas for improvement and provide a better service to our customers. Thank you for taking the time to share your thoughts with us.

Customer: You're welcome. I'm glad to hear that my feedback is valued. Is there anything else you need from me?

Agent 2: No, Mr. Smith. That will be all for now. If you have any further concerns or suggestions in the future, please don't hesitate to reach out to us. We are here to assist you.

Customer: Thank you, Agent 2. I appreciate your assistance. Have a great day!

Agent 2: You're welcome, Mr. Smith. Have a wonderful day as well. Goodbye!",neutral,2,Feedback and Suggestions,unresolved
"Agent 3: Good morning, thank you for calling ElectricVolt. My name is Agent 3. How may I assist you today?

Customer: Hi Agent 3, my name is Samantha Johnson. I need to schedule an appointment for some electrical work at my residence.

Agent 3: Good morning, Samantha. I'll be happy to help you with that. Could you please provide me with your address and contact information?

Customer: Sure, my address is 123 Main Street, and my phone number is 555-1234.

Agent 3: Thank you, Samantha. Now, please let me know what type of electrical work you need assistance with so I can provide you with the right service.

Customer: I need to have a new ceiling fan installed in my living room, as well as some outlets replaced in the kitchen.

Agent 3: I see. Let me check our available appointment slots for you. Would tomorrow afternoon work for you?

Customer: Unfortunately, I won't be available tomorrow afternoon. Do you have any availability next week?

Agent 3: Yes, we do. How about Wednesday morning? We have a technician available between 9 AM and 12 PM.

Customer: Wednesday morning sounds good. Please schedule the appointment for me.

Agent 3: Great! I have scheduled your appointment for Wednesday, September 15th, between 9 AM and 12 PM. Is there anything else I can assist you with?

Customer: Actually, I have a question regarding the cost of the service. Can you provide me with an estimate?

Agent 3: Certainly, Samantha. The cost will depend on the type of work required and any additional materials needed. Our technician will assess the situation during the appointment and provide you with a detailed estimate before proceeding with any work.

Customer: That sounds fair. Thank you for clarifying that. I appreciate your help, Agent 3.

Agent 3: You're welcome, Samantha. Is there anything else I can assist you with today?

Customer: No, that's all for now. Thank you again for your assistance.

Agent 3: It was my pleasure, Samantha. If you have any further questions or need any additional assistance, please don't hesitate to reach out. Have a great day!

Customer: You too, Agent 3. Goodbye.

Agent 3: Goodbye, Samantha. Take care.",neutral,3,Service Requests and Appointments,resolved
"Agent 1: Thank you for calling ElectricVolt. This is Agent 1. How may I assist you today?

Customer: Hi, Agent 1. My name is Emily Johnson. I'm experiencing a power outage in my house. Can you help me?

Agent 1: Of course, Emily. I'm sorry to hear about your power outage. I'll do my best to assist you. Can you please provide me with your address so I can check for any reported outages in your area?

Customer: Yes, I live at 123 Main Street, Anytown.

Agent 1: Thank you, Emily. Let me check that for you. (Pause) I see that there are currently no reported outages in your area. However, that doesn't mean there isn't an issue at your specific location. Have you checked your circuit breaker to ensure it hasn't tripped?

Customer: Yes, I've already checked the circuit breaker, and everything seems to be fine. None of the switches are tripped.

Agent 1: Okay, thank you for confirming that. In that case, it's possible that there might be an issue with the electrical connection to your house. I recommend contacting a licensed electrician to further investigate the problem.

Customer: I understand, but it's already late in the evening. Are there any emergency services that ElectricVolt provides for situations like this?

Agent 1: Yes, Emily. We do have emergency services available for situations like this. We can dispatch an electrician to your location as soon as possible. However, please be aware that there may be an additional fee for emergency services.

Customer: I understand the additional fee. I just really need to have power restored tonight. How long do you think it will take for an electrician to arrive?

Agent 1: I will need to check the availability of our technicians in your area, Emily. Can you please hold the line for a moment?

Customer: Sure, I'll hold.

Agent 1: Thank you for patiently waiting, Emily. I have scheduled an electrician to visit your location within the next hour. Is there anything else I can assist you with?

Customer: No, that will be all for now. Thank you for your help, Agent 1.

Agent 1: You're welcome, Emily. I apologize for the inconvenience caused by the power outage. Our electrician will be there shortly to assist you. If you have any further questions or concerns, please don't hesitate to call us back. Have a great day!

Customer: Thank you, Agent 1. Goodbye.

Agent 1: Goodbye, Emily. Take care.",neutral,1,Outages and Emergencies,resolved
"Agent 1: Thank you for calling ElectricVolt, my name is Agent 1. How can I assist you today?

Customer: Hi Agent 1, my name is Emily Johnson. I'm having some issues with a power outage in my neighborhood. I'm wondering if you could help me out?

Agent 1: Of course, Emily! I'll do my best to assist you. Can you please provide me with your address so I can check if there are any reported outages in your area?

Customer: Sure, I live at 123 Main Street, in the city center.

Agent 1: Thank you, Emily. Let me check that for you. *typing* I see that there is a reported power outage in your area. Our technicians are already aware of the situation and are working to restore power as quickly as possible. I apologize for the inconvenience caused.

Customer: Oh, I'm relieved to hear that you're already aware of it. Is there an estimated time for when the power will be restored?

Agent 1: I'm sorry, Emily, but we don't have an exact time frame at the moment. However, our technicians are working diligently to resolve the issue as soon as possible. Is there anything else I can assist you with?

Customer: Actually, yes. I have a medical condition that requires continuous use of electrical equipment. Is there any way I can get priority assistance?

Agent 1: I understand your concern, Emily. We do prioritize customers with medical conditions in these situations. Let me update your account with this information, and I'll make sure our technicians are aware of your situation. Is there a specific contact number we can reach you on?

Customer: Yes, you can reach me on my mobile number, which is 555-123-4567. Thank you for your help, Agent 1.

Agent 1: You're welcome, Emily. We'll do our best to accommodate your needs. In the meantime, I recommend having alternative arrangements in place, such as a backup power supply or contacting your healthcare provider for further guidance. Is there anything else I can assist you with?

Customer: No, that covers everything for now. Thank you for your assistance, Agent 1. I appreciate your help.

Agent 1: It's my pleasure, Emily. If you have any further questions or if there are any updates regarding the power outage, don't hesitate to reach out to us. Take care and stay safe. Have a great day!

Customer: Thank you, Agent 1. You've been very helpful. Have a great day too! Goodbye!

Agent 1: Goodbye, Emily. Take care!",happy,1,Outages and Emergencies,resolved
"Agent 3: Thank you for calling ElectricVolt. My name is Agent 3. How can I assist you today?

Customer: Hi, Agent 3. I'm having some issues with the electrical wiring in my house. I was hoping you could help me troubleshoot and provide some technical support.

Agent 3: Of course, I'll do my best to assist you. Can you please provide me with your name and address so I can locate your account?

Customer: My name is John Smith, and I live at 123 Main Street.

Agent 3: Thank you, John. Now, could you please describe the specific issue you're facing with your electrical wiring?

Customer: Well, Agent 3, I've noticed that some of the outlets in my living room are not working. I've tried plugging different devices into them, but there's no power. It's strange because the rest of the house seems to be fine.

Agent 3: I understand your concern, John. Let's try some troubleshooting steps together. Have you checked the circuit breaker to see if any switches are flipped?

Customer: Yes, I have. None of the switches in the circuit breaker appear to be flipped.

Agent 3: Alright. Let's try another troubleshooting step. Have you checked the GFCI outlets in your house? They are typically located in the kitchen, bathroom, and outdoor areas.

Customer: No, I haven't. I'll go and check them now.

[Customer puts the call on hold for a few minutes]

Customer: Agent 3, I checked all the GFCI outlets, and none of them seem to be tripped.

Agent 3: I see. In that case, it might be an issue with the wiring itself. It's best to have a professional electrician come and inspect your house. Would you like me to schedule an appointment for you?

Customer: Yes, please. I'd appreciate it if you could arrange for an electrician to come and take a look.

Agent 3: Certainly, John. I have scheduled an appointment for you with our certified electrician. They will be visiting your house tomorrow between 2 PM and 4 PM. Is there anything else I can assist you with?

Customer: No, that's all. Thank you for your help, Agent 3.

Agent 3: You're welcome, John. If you have any further questions or concerns, don't hesitate to reach out. Have a great day!

Customer: Thank you. Goodbye.

Agent 3: Goodbye, John. Take care.",neutral,3,Technical Support and Troubleshooting,resolved
"Agent 2: Thank you for calling ElectricVolt. My name is Agent 2. How can I assist you today?

Customer: Hi Agent 2. My name is Emily Johnson. I have some questions regarding my billing and payments.

Agent 2: Hello, Emily. I'll be happy to help you with that. What specific questions do you have?

Customer: I recently received my bill, and I noticed that the amount seems higher than usual. I'm wondering if there's been any changes in the pricing or if there's an error.

Agent 2: I apologize for any confusion, Emily. Let me check your account to understand the situation better. Can you please provide me with your account number?

Customer: Sure, let me find it. It's 123456789.

Agent 2: Thank you, Emily. I see your account here. It seems that there was a slight increase in the pricing due to a rate adjustment. This change was communicated via email to all our customers last month. Did you receive that notification?

Customer: I'm sorry, but I must have missed that email. Is there any way you can provide me with more details about this rate adjustment?

Agent 2: Of course, Emily. The rate adjustment was necessary to cover the increased costs of materials and labor. It was a standard industry change, and we made every effort to notify our customers in advance. I apologize for any inconvenience caused by the missed email.

Customer: I understand that costs can change, but I would appreciate it if the company could provide more notice for such adjustments in the future. Is there anything else I should be aware of regarding my bill?

Agent 2: I completely understand your concern, Emily. We value your feedback, and I will make sure to pass it along to the relevant department. As for your bill, it seems to be accurate based on your usage. If you have any specific questions about the charges, I'll be happy to explain them in detail.

Customer: Thank you for addressing my concerns, Agent 2. I do have a question about one particular charge. There's an additional fee listed as a ""service charge."" Can you explain what that entails?

Agent 2: Certainly, Emily. The service charge is a standard fee that covers the cost of dispatching our technicians to your location and any administrative work associated with your account. It helps us maintain the quality of our services and ensure timely response to any electrical issues you may encounter.

Customer: I see. That makes sense. I just wanted to make sure I understood all the charges on my bill. Is there anything else I need to know about my billing?

Agent 2: Your billing seems to be in order, Emily. However, I would like to remind you that we offer various payment options, including online payment, automatic bill payment, and payment over the phone. If you have any difficulties or would like to explore these options, feel free to let me know.

Customer: Thank you for the reminder, Agent 2. I usually pay my bills online, but I appreciate the options. I think that covers all my questions for now. Is there anything else I can assist you with?

Agent 2: Not at the moment, Emily. If you have any further questions or concerns in the future, don't hesitate to reach out to us. We're here to help. Thank you for choosing ElectricVolt, and have a great day!

Customer: Thank you for your help, Agent 2. I appreciate your assistance. Have a great day too! Goodbye.

Agent 2: Goodbye, Emily. Take care!",neutral,2,Billing and Payments,resolved
"Agent 3: Thank you for calling ElectricVolt. This is Agent 3 speaking. How can I assist you today?

Customer: Hi, Agent 3. My name is Emily Johnson, and I'm having a problem with a power outage in my house. I wanted to report it and see if there's any information on when it will be resolved.

Agent 3: Hello, Emily. I'm sorry to hear about the power outage. Let me check our system for any reported outages in your area. Can you please provide me with your address?

Customer: Sure, my address is 123 Main Street.

Agent 3: Thank you, Emily. I see that there is indeed an outage reported in your area. Our technicians are already working on it, but I don't have an estimated time for restoration at the moment. Is there anything else I can help you with?

Customer: No, that's fine. I just wanted to make sure it was reported and being taken care of. I'll wait for the power to come back on. Thank you for your assistance, Agent 3.

Agent 3: You're welcome, Emily. I understand how inconvenient power outages can be, especially if you're in the middle of something important. If you have any further questions or if the situation doesn't improve within a reasonable time, please don't hesitate to call us back. We're here to help.

Customer: I appreciate that, Agent 3. Hopefully, it won't take too long to fix. Is there anything I can do on my end to help with the restoration process?

Agent 3: Generally, during a power outage, it's best to turn off and unplug any sensitive electronic devices to protect them from power surges when the power is restored. Additionally, if you have any backup power sources like generators, you can use them to power essential appliances while waiting for the power to come back on. Other than that, we'll take care of the restoration process. Rest assured that our technicians are working diligently to resolve the issue as quickly as possible.

Customer: Okay, I'll make sure to follow those guidelines. I hope it gets resolved soon. Is there anything else I should know?

Agent 3: Just a reminder, Emily, if you experience any other electrical issues or emergencies, don't hesitate to reach out to us. We offer 24/7 emergency services, and our technicians are always ready to assist you. It's always better to be safe than sorry when it comes to electricity.

Customer: Absolutely, Agent 3. I'll keep that in mind. Thank you for your help and for providing such prompt service. I'll be sure to recommend ElectricVolt to my friends and family.

Agent 3: Thank you for your kind words, Emily. We truly appreciate your support and referrals. If there's anything else we can assist you with in the future, please feel free to give us a call. Stay safe, and I hope your power is restored soon. Have a great day!

Customer: Thank you, Agent 3. You too. Goodbye.

Agent 3: Goodbye, Emily. Take care.",neutral,3,Outages and Emergencies,resolved
"Agent 1: Thank you for calling ElectricVolt. My name is Agent 1. How may I assist you today?

Customer: Hi Agent 1! I'm John Smith, and I am a happy customer of ElectricVolt. I recently installed a new light fixture in my living room, but it doesn't seem to be working properly. Can you help me troubleshoot the issue?

Agent 1: Of course, John! I'd be happy to assist you with your light fixture. Let's start by checking a few things. Is the light switch turned on?

Customer: Yes, I've made sure the switch is on, but the light still doesn't turn on.

Agent 1: Alright, let's try something else. Can you check the bulb and make sure it's securely screwed in?

Customer: Yes, I just checked it, and it seems to be tightly screwed in.

Agent 1: Alright, John. Let's try replacing the bulb with a new one, just to rule out any issues with the bulb itself. Could you do that for me?

Customer: Sure, I'll give it a try. Give me a moment to find a new bulb.

[Customer replaces the bulb]

Customer: I've replaced the bulb, but unfortunately, the light still doesn't turn on.

Agent 1: I'm sorry to hear that, John. Let's move on to checking the wiring. Is there a chance that any of the wires are loose or disconnected?

Customer: I don't think so, but I can double-check. Give me a moment.

[Customer checks the wiring]

Customer: I've checked the wiring, and everything seems to be properly connected.

Agent 1: Alright, John. At this point, it sounds like there might be an issue with the fixture itself. Have you noticed any other electrical issues in your home?

Customer: No, everything else seems to be working fine. It's just this particular light fixture that's causing trouble.

Agent 1: I understand, John. In that case, it could be a faulty fixture. I recommend reaching out to a licensed electrician to inspect the fixture and determine if it needs to be replaced. They will have the expertise to handle this situation.

Customer: I appreciate your help, Agent 1. I'll contact an electrician to further investigate the issue. Thank you for your assistance.

Agent 1: You're welcome, John. I apologize for the inconvenience caused. If you have any other questions or need further assistance, feel free to reach out to us. Have a great day!

Customer: Thank you, Agent 1. I will definitely reach out if I need any more help. Have a great day too!

[Call ends]",happy,1,Technical Support and Troubleshooting,unresolved
"[Phone rings]

Agent 3: Thank you for calling ElectricVolt, my name is Agent 3. How can I assist you today?

Customer: Hi, Agent 3. My name is John Smith. I recently had some electrical work done at my house and I have a few questions regarding regulatory compliance and legal inquiries.

Agent 3: Hi, John. I'll be happy to help you with that. Could you please provide me with your address so that I can access your account and assist you better?

Customer: Sure, it's 123 Main Street.

Agent 3: Thank you, John. How can I assist you with your regulatory compliance and legal inquiries?

Customer: Well, I recently had some electrical upgrades done at my house, and I want to make sure that everything was done according to the necessary regulations and codes.

Agent 3: I completely understand your concern, John. Let me assure you that ElectricVolt always adheres to the highest industry standards and regulations. Our electricians are licensed and experienced, ensuring that all work is completed safely and in compliance with local codes.

Customer: That's good to hear. I just want to make sure that everything is done correctly and that I won't have any issues in the future.

Agent 3: I completely understand, John. If you have any specific questions or concerns about the work that was done, I'll be more than happy to address them for you.

Customer: Well, I noticed that there were some changes made to the electrical panel. Is there anything I need to be aware of in terms of regulations or permits?

Agent 3: Great question, John. Upgrading or making changes to the electrical panel often requires a permit from the local building department. Our electricians are responsible for obtaining the necessary permits and ensuring that all work is inspected and approved by the appropriate authorities. We take care of all the regulatory aspects so that you don't have to worry about it.

Customer: That's reassuring to hear. I just wanted to make sure that everything was done by the book. Are there any documents or certificates that I should expect to receive?

Agent 3: Absolutely, John. Once the work is completed, our electricians will provide you with all the necessary documentation and certificates. This includes permits, inspection reports, and any other relevant paperwork to ensure that you have a record of the work that was done.

Customer: That's great to know. I appreciate the thoroughness of your company. It certainly gives me peace of mind.

Agent 3: You're welcome, John. We strive to provide the best service possible to our customers. Is there anything else I can assist you with regarding your regulatory compliance and legal inquiries?

Customer: No, that covers all my concerns for now. I appreciate your help, Agent 3.

Agent 3: It was my pleasure assisting you today, John. If you have any further questions or need any assistance in the future, don't hesitate to reach out to us. Have a great day!

Customer: Thank you, Agent 3. Have a great day too. Goodbye!

Agent 3: Goodbye, John. Take care!",neutral,3,Regulatory Compliance and Legal Inquiries,resolved
