call_transcript,mood,agent_number,intention,resolution
"Agent 1: Thank you for calling ElectricVolt. My name is Agent 1. How can I assist you today?

Customer: Hi, Agent 1. My name is John Smith. I'm calling because I need some electrical services for my home.

Agent 1: Hello, Mr. Smith. I'd be happy to help you with that. What specific services are you looking for?

Customer: I need to have some new outlets installed in a few rooms and also want to get my outdoor lighting fixed.

Agent 1: I see. We can definitely assist you with that. Let me schedule an appointment for you. Can you please provide me with your address?

Customer: Sure, it's 123 Main Street.

Agent 1: Thank you, Mr. Smith. And which date and time would be convenient for you?

Customer: I'm quite flexible. How about next Tuesday afternoon?

Agent 1: Alright, let me check our availability for that time slot. (pause) Great news, we have an opening on Tuesday at 2:00 PM. Does that work for you?

Customer: Yes, that works perfectly for me.

Agent 1: Alright, I have scheduled an appointment for you on Tuesday at 2:00 PM. Our technician will be there to install the outlets and fix your outdoor lighting. Is there anything else you would like us to take care of?

Customer: That's all for now, thank you.

Agent 1: You're welcome, Mr. Smith. Just a reminder, our technician will give you a call before they arrive on Tuesday, so please make sure you're available. If you have any further questions or concerns, feel free to reach out to us. Thank you for choosing ElectricVolt.

Customer: Thank you, Agent 1. I appreciate your assistance. Goodbye.

Agent 1: You're welcome, Mr. Smith. Have a great day! Goodbye.",neutral,1,Service Requests and Appointments,resolved
"[Phone ringing]

Agent 3: Thank you for calling ElectricVolt, my name is Agent 3. How can I assist you today?

Customer: Finally, someone answered! I've been trying to reach your company for days now. I am so angry and frustrated with your lack of response!

Agent 3: I apologize for the inconvenience and the delay in getting back to you. I understand you're angry, and I'm here to help. Can you please provide me with your name and account information so I can assist you better?

Customer: My name is Samantha Johnson, and I've been a customer for the past five years. I've been having some accessibility issues at my residence, and I need an electrician to come and fix them immediately!

Agent 3: I'm sorry to hear about the accessibility issues you're facing, Samantha. We prioritize the needs of our customers, especially when it comes to accessibility. Could you please provide me with more details about the specific issues you're experiencing?

Customer: Well, I recently had a family member move in with me who has mobility challenges. We need some modifications done, like installing grab bars in the bathroom and widening the doorways for wheelchair accessibility. It's becoming increasingly difficult for them to move around the house safely.

Agent 3: I understand the urgency and importance of these modifications, Samantha. Let me assure you that ElectricVolt can provide the necessary services to address your needs. We have experienced electricians who specialize in accessibility modifications. I'll create a service request for you right away. Is there a preferred date and time for the electrician to visit your residence?

Customer: As soon as possible would be great. We're available any weekday afternoons, so please schedule it according to your earliest availability.

Agent 3: Thank you for your flexibility, Samantha. I've scheduled a service appointment for you on the upcoming Thursday at 2:00 PM. Our electrician will assess the modifications needed and provide you with an estimate for the work. Is there anything else I can assist you with?

Customer: That's all for now. I'm just relieved that something is finally being done. I hope your electrician can resolve these issues quickly.

Agent 3: Rest assured, Samantha. Our electrician will do their best to address your needs promptly. If you have any further concerns or questions, please don't hesitate to reach out to us. We value your satisfaction as our customer.

Customer: Thank you, Agent 3. I appreciate your understanding and assistance. I hope the electrician can make the necessary modifications soon.

Agent 3: You're welcome, Samantha. We're committed to providing excellent service to all our customers. Thank you for choosing ElectricVolt. Have a great day!

Customer: You too. Goodbye.

[Call ends]",angry,3,Accessibility and Special Needs,resolved
"Agent 3: Thank you for calling ElectricVolt, this is Agent 3 speaking. How can I assist you today?

Customer: Hi, Agent 3. I'm calling to inquire about any special programs or promotions that ElectricVolt is currently offering.

Agent 3: I'd be happy to help you with that. May I have your name, please?

Customer: Sure, my name is Emily Thompson.

Agent 3: Thank you, Emily. Before we get started, could you please provide me with your account number or address?

Customer: Yes, my account number is 1234567.

Agent 3: Thank you for providing that information. Let me check our system for any ongoing special programs or promotions specifically for you. Please bear with me for a moment.

(Customer waits for a few moments)

Agent 3: Emily, I have good news for you. We currently have a special promotion for our residential customers. If you schedule a service appointment within the next month, you'll receive a 15% discount on the total cost of the service.

Customer: That sounds great! What services does this promotion cover?

Agent 3: This promotion applies to all our residential electrical services, including installations, repairs, and maintenance. It's a great opportunity to take care of any electrical needs you may have while saving some money.

Customer: That's exactly what I was looking for. How do I schedule an appointment and avail of this promotion?

Agent 3: It's quite simple, Emily. I can assist you in scheduling an appointment right away. May I know your preferred date and time for the service?

Customer: I'm flexible with the date, but I would prefer a morning appointment if possible.

Agent 3: Noted. How about next Wednesday at 9:00 AM? Does that work for you?

Customer: That works perfectly for me. Please go ahead and schedule the appointment.

Agent 3: Great! I have scheduled a service appointment for you on Wednesday, September 15th, at 9:00 AM. Is there anything else I can help you with?

Customer: Actually, I have one more question. Are there any referral programs available? I have a friend who might be interested in your services.

Agent 3: Absolutely, Emily. We do have a referral program in place. If you refer a friend to ElectricVolt and they schedule a service appointment, both you and your friend will receive a 10% discount on your next service.

Customer: That's fantastic! I'll definitely let my friend know about this referral program. Thank you for your help, Agent 3.

Agent 3: You're welcome, Emily. It was my pleasure assisting you today. If you have any more questions in the future or need further assistance, don't hesitate to give us a call. Have a great day!

Customer: Thank you, Agent 3. You too. Goodbye.

Agent 3: Goodbye, Emily. Take care.",neutral,3,Special Programs and Promotions,resolved
"Agent: Thank you for calling ElectricVolt, my name is Agent 1. How can I assist you today?

Customer: Hi Agent 1, my name is John Smith. I'm interested in learning more about ElectricVolt's renewable energy and sustainability programs.

Agent: Hello John, thank you for your interest. We have a variety of programs available to help you incorporate renewable energy into your home or business. Could you please provide me with some more details about what you're specifically looking for?

Customer: Sure, I'm mostly interested in solar energy. I've heard a lot about its benefits and I want to explore the possibility of installing solar panels on my roof.

Agent: That's great to hear, John. Solar energy is indeed a fantastic option for reducing your carbon footprint and saving on energy costs. We can definitely help you with that. Firstly, we would need to schedule a visit to assess the suitability of your roof for solar panel installation. Are you available for a visit next week?

Customer: Yes, I can make time for that. Just to clarify, what are the costs associated with installing solar panels?

Agent: The cost of installing solar panels can vary depending on factors such as the size of the system and your energy requirements. However, our team will provide you with a detailed quote after the assessment visit. Additionally, there are various federal and state incentives available that can help offset the costs. We'll make sure to provide you with all the information and assistance you need to take advantage of those incentives.

Customer: That sounds promising. Are there any ongoing maintenance costs for solar panels?

Agent: Solar panels are quite durable and require minimal maintenance. However, regular cleaning and occasional inspections are recommended to ensure optimal performance. We offer maintenance packages that include periodic check-ups and cleaning services. The cost of these packages will be included in the quote we provide you.

Customer: I see. That sounds reasonable. Can you also tell me more about other renewable energy options you offer?

Agent: Certainly, John. In addition to solar energy, we also provide services for wind turbines and geothermal systems. Wind turbines are a great option for locations with consistent wind patterns, while geothermal systems use the earth's natural heat to provide heating and cooling for buildings. If you're interested in exploring these options, we can schedule a consultation to discuss further.

Customer: Thanks for the information. I'm primarily focused on solar energy for now, but it's good to know that you offer a range of options. How long does the installation process usually take?

Agent: The installation process typically takes between one to three days, depending on the size of the system and any additional electrical work required. We strive to complete the installation as efficiently as possible while ensuring quality workmanship. Our team will provide you with a more accurate timeline during the assessment visit.

Customer: That's great to hear. I'm really excited about transitioning to solar energy. Is there anything else I should know or any other information you can provide?

Agent: Absolutely, John. We understand that transitioning to renewable energy can be a big decision, and we're here to support you every step of the way. Once the installation is complete, we'll also help you with the necessary paperwork to ensure you're able to benefit from any available incentives and rebates. Additionally, our customer support team is available for any questions or concerns you may have after the installation.

Customer: That's reassuring to know. I appreciate your assistance, Agent 1. I think I have all the information I need for now. I'll go ahead and schedule a visit for the assessment.

Agent: You're most welcome, John. I'm glad I could help. Please feel free to reach out if you have any further questions or if there's anything else we can assist you with. Have a great day!

Customer: Thank you, Agent 1. I will definitely reach out if I need any more information. Have a great day too! Goodbye.

Agent: Goodbye, John. Take care and have a wonderful day!",neutral,1,Renewable Energy and Sustainability Programs,resolved
"Agent 2: Thank you for calling ElectricVolt, my name is Agent 2. How can I assist you today?

Customer: Finally, someone answers! I've been trying to reach your company for days. I'm furious with the service I received!

Agent 2: I apologize for the inconvenience. I understand you're angry, and I'll do my best to assist you. Can you please provide me with your name and account number?

Customer: My name is John Smith, and my account number is EV123456.

Agent 2: Thank you, Mr. Smith. How can I help you today?

Customer: I recently heard about renewable energy and sustainability programs, and I want to know if ElectricVolt offers any such services.

Agent 2: Yes, ElectricVolt is committed to promoting renewable energy and sustainability. We have several programs available for both residential and commercial customers. Are you interested in solar panels, energy-efficient appliances, or something else?

Customer: Solar panels sound interesting. I want to reduce my carbon footprint and save on energy costs. Can you give me more information?

Agent 2: Of course, Mr. Smith. Our solar panel program allows you to generate clean energy from the sun and reduce your reliance on traditional power sources. It can significantly lower your electricity bills and contribute to a greener environment. We offer different financing options and can provide a free consultation to assess your specific needs.

Customer: That sounds good, but I've heard that solar panels are expensive. How affordable are they with ElectricVolt?

Agent 2: We understand that cost is a concern for many customers. ElectricVolt offers competitive pricing and flexible payment plans to make solar panels more affordable. Additionally, you may qualify for federal and state incentives, such as tax credits or rebates, which can further reduce the cost.

Customer: Alright, that's good to know. I'm also concerned about the installation process. Is it complicated?

Agent 2: Our team of experienced technicians will handle the entire installation process for you, Mr. Smith. They will assess your property, determine the best location for the panels, and ensure everything is properly connected. We strive to make the installation as seamless as possible, minimizing any disruptions to your daily routine.

Customer: Okay, but what if something goes wrong with the panels or the system?

Agent 2: ElectricVolt provides a comprehensive warranty on our solar panels and systems. In the rare event of any issues, our dedicated customer support team is available 24/7 to assist you. We also offer routine maintenance services to ensure your system continues to operate efficiently.

Customer: That's reassuring. I appreciate your help in answering my questions. I was initially angry, but your assistance has resolved my concerns. I think I'm ready to move forward with the solar panel program.

Agent 2: I'm glad I could assist you, Mr. Smith. It's our goal to provide excellent customer service and address any concerns you may have. I will connect you with our solar panel specialist, who will guide you through the next steps. Thank you for choosing ElectricVolt!

Customer: Thank you for your help, Agent 2. I look forward to speaking with the specialist. Goodbye.

Agent 2: You're welcome, Mr. Smith. Have a great day! Goodbye.",angry,2,Renewable Energy and Sustainability Programs,resolved
"[Phone ringing]

Agent 3: Good morning, thank you for calling ElectricVolt. My name is Agent 3. How may I assist you today?

Customer: Hi Agent 3, I'm Mr. Johnson. I'm interested in learning about any special programs or promotions your company offers.

Agent 3: Good morning, Mr. Johnson! I'm delighted to help you with that. We do have some special programs and promotions currently available. Can you please provide me with your address so I can check if you're eligible for any specific offers?

Customer: Sure, I live at 123 Main Street, Anytown.

Agent 3: Thank you, Mr. Johnson. Let me check our database for any promotions in your area. While I look that up, may I ask if you have any specific electrical services in mind?

Customer: Well, I'm considering getting some electrical upgrades in my home, like installing energy-efficient lighting and maybe even a home automation system. I've heard they can help save on electricity bills.

Agent 3: That's a great idea, Mr. Johnson! We have a special promotion for energy-efficient upgrades at the moment. By opting for these upgrades, you can not only reduce your electricity consumption but also qualify for a rebate from your local utility company.

Customer: Oh, that sounds fantastic! Can you tell me more about the rebate program and how I can apply for it?

Agent 3: Certainly, Mr. Johnson. The rebate program is a partnership between ElectricVolt and your utility company. Once we complete the energy-efficient upgrades at your home, we will provide you with all the necessary documentation to apply for the rebate. Our technicians will guide you through the process, ensuring a hassle-free experience.

Customer: That's really helpful, Agent 3. I'm glad I called. How long does the whole process usually take?

Agent 3: The timeline can vary depending on the complexity of the upgrades, but on average, it takes around 2-3 weeks from the initial consultation to the completion of the installation. Our team is highly efficient and will work with you to find a convenient time for the upgrades.

Customer: That sounds reasonable. Do you offer any financing options for these upgrades?

Agent 3: Absolutely, Mr. Johnson. We understand that these upgrades can require a significant investment upfront. That's why we have partnered with local financial institutions to offer attractive financing options. Our team can discuss these options with you in detail and help you choose the one that best suits your needs.

Customer: That's great to know. I appreciate your assistance, Agent 3. Is there anything else I should be aware of regarding these special programs and promotions?

Agent 3: One more thing, Mr. Johnson. We also have a referral program where you can earn rewards for referring friends and family to ElectricVolt. If they sign up for any of our services, you'll receive a special bonus as a token of our appreciation.

Customer: That's a nice incentive! I'll definitely keep that in mind. Thank you for all the information, Agent 3. You've been very helpful.

Agent 3: You're most welcome, Mr. Johnson. It was my pleasure assisting you today. If you have any further questions or if there's anything else we can assist you with in the future, please don't hesitate to reach out.

Customer: I certainly will. Have a wonderful day!

Agent 3: You too, Mr. Johnson. Take care and have a great day ahead!

[End of call]",happy,3,Special Programs and Promotions,unresolved
"Agent 1: Thank you for calling ElectricVolt. My name is Agent 1. How may I assist you today?

Customer: Hi Agent 1, I'm Mr. Smith. I have a few questions regarding the regulatory compliance and legal inquiries for my electrical service.

Agent 1: Hello, Mr. Smith. I'm here to help you with any concerns you may have. Please go ahead and ask your questions.

Customer: Thank you. Firstly, I want to ensure that ElectricVolt is compliant with all the necessary regulations and licenses. Can you confirm that?

Agent 1: Absolutely, Mr. Smith. ElectricVolt complies with all federal, state, and local regulations. We hold all the required licenses and certifications to provide electrical services in your area.

Customer: That's great to hear. I also wanted to know if ElectricVolt has liability insurance in case of any damage during the service.

Agent 1: Yes, Mr. Smith. ElectricVolt carries comprehensive liability insurance to protect both our customers and our technicians. In the unlikely event of any damage, we are fully covered.

Customer: Excellent. That puts my mind at ease. Now, I have a question regarding warranties for the electrical work. Can you explain the warranty coverage provided by ElectricVolt?

Agent 1: Certainly, Mr. Smith. ElectricVolt offers a warranty on all our electrical services. The specific coverage and duration depend on the type of work performed. Our warranty ensures that any issues arising from our work will be promptly addressed without any additional cost to you.

Customer: That's reassuring. Thank you for clarifying that. Now, I have a more specific question. What happens if there is a power outage or a fault in the electrical system after ElectricVolt has completed the work?

Agent 1: In the event of any power outage or fault after our work is completed, Mr. Smith, we encourage you to contact our customer service immediately. We will dispatch a technician to investigate and resolve the issue promptly. If the problem is found to be related to our work, it will be resolved under the warranty without any additional charges.

Customer: That's great to know. You guys seem to have everything covered. One last question, if I may. How do I make a payment for the electrical services provided by ElectricVolt?

Agent 1: You can make a payment for our services through various methods, Mr. Smith. We accept cash, checks, and credit card payments. We also have an online payment portal where you can conveniently make your payment. Our technician will provide you with the necessary details and options after the completion of the service.

Customer: Perfect. That's all the information I needed. Thank you for your assistance, Agent 1. I'm really happy with the level of professionalism and service provided by ElectricVolt.

Agent 1: Thank you for your kind words, Mr. Smith. We strive to provide the best service to our customers. If you have any more questions or need further assistance in the future, please don't hesitate to reach out. Have a wonderful day!

Customer: You too, Agent 1. Goodbye!

Agent 1: Goodbye, Mr. Smith. Take care!",happy,1,Regulatory Compliance and Legal Inquiries,resolved
"Agent 3: Thank you for calling ElectricVolt! My name is Agent 3. How can I assist you today?

Customer: Hi Agent 3, this is John Smith. I'm calling regarding my recent billing statement. I have a few questions about it.

Agent 3: Hello, Mr. Smith! I'm here to help. What specific questions do you have about your billing statement?

Customer: Well, first of all, I noticed that there is an additional charge on my bill that I wasn't expecting. Could you please explain what it's for?

Agent 3: Of course, Mr. Smith. Let me take a look at your account. I apologize for any confusion caused by the unexpected charge. It seems that the additional charge is for a service call that was made to your property last month. Our technician had to fix a wiring issue, which required extra materials and labor. I hope that clarifies it for you.

Customer: I see, but I wasn't informed about this charge beforehand. Is there any way to waive it since I wasn't aware of the problem?

Agent 3: I understand your concern, Mr. Smith. Let me check if there are any notes regarding prior communication. I apologize for any oversight on our part. Unfortunately, I don't see any records indicating that you were informed about the potential charges. However, I can offer you a 10% discount on the service call charge as a goodwill gesture.

Customer: Thank you for your understanding, Agent 3. I appreciate the discount, but I still think it would be fair to waive the charge entirely. Is there someone else I can speak to about this?

Agent 3: I understand your perspective, Mr. Smith. Let me transfer you to my supervisor, who may be able to assist you further. Please hold for a moment.

(Customer is put on hold and transferred to Agent 3's supervisor)

Supervisor: Hello, Mr. Smith. This is Supervisor speaking. Agent 3 informed me about the situation. I understand your request to waive the additional charge completely. Considering the lack of prior communication, I can authorize a full waiver of the service call charge as an exception. I apologize for any inconvenience caused.

Customer: Thank you so much, Supervisor! I really appreciate your understanding and resolving this matter for me. Is there anything else I need to do to ensure the charge is removed from my bill?

Supervisor: You're welcome, Mr. Smith. I'm glad I could assist you. I will personally make sure that the charge is removed from your billing statement. You should see the updated statement within the next billing cycle. Is there anything else I can help you with?

Customer: No, that's all I needed help with today. Thank you again, Supervisor, for your prompt resolution of this issue. I am satisfied with the outcome.

Supervisor: You're welcome, Mr. Smith. It was my pleasure to assist you. If you have any further questions or concerns in the future, please don't hesitate to reach out to us. Have a great day!

Customer: Thank you, Supervisor. You too, have a wonderful day! Goodbye.

Supervisor: Goodbye, Mr. Smith. Take care!",happy,3,Billing and Payments,unresolved
