call_transcript,mood,agent_number,intention,resolution
"Agent 1: Thank you for calling ElectricVolt. My name is Agent 1. How can I assist you today?

Customer: Hi, Agent 1. My name is John Smith. I'm interested in learning more about ElectricVolt's renewable energy and sustainability programs.

Agent 1: Thank you for reaching out, Mr. Smith. I'd be happy to provide you with information about our programs. Our company is committed to promoting renewable energy and sustainable practices. We offer a range of services to help customers reduce their carbon footprint and save on energy costs. How can I assist you specifically?

Customer: I'm looking to install solar panels on my residential property. Can you tell me more about your solar panel installation service?

Agent 1: Absolutely, Mr. Smith. We have a dedicated team of experts who specialize in solar panel installations. They will assess your property to determine the best location for maximum solar exposure. Our technicians will handle the entire installation process, from obtaining permits to connecting the panels to your electrical system. We also offer maintenance services to ensure your solar panels continue to operate efficiently.

Customer: That sounds great. Are there any incentives or rebates available for installing solar panels?

Agent 1: Yes, there are several incentives and rebates available depending on your location. These incentives can significantly offset the cost of installation. We can provide you with information on federal, state, and local programs that you may qualify for. Additionally, we offer financing options to make the upfront investment more manageable.

Customer: That's good to know. I'm also interested in electric vehicle charging stations. Does ElectricVolt provide installation services for those as well?

Agent 1: Absolutely, Mr. Smith. We understand the growing popularity of electric vehicles and offer installation services for charging stations. Our technicians will assess your property and recommend the best charging station solution based on your needs. We can install both residential and commercial charging stations, ensuring a convenient and efficient charging experience.

Customer: Excellent. I believe in reducing my carbon footprint as much as possible, so I'm also curious about any other sustainable energy solutions you offer.

Agent 1: We're glad to hear that, Mr. Smith. In addition to solar panels and electric vehicle charging stations, we also provide energy-efficient lighting solutions, smart home automation systems, and energy audits. Our energy audits help identify areas of energy waste in your home or business, allowing us to recommend energy-saving measures. By implementing these solutions, you can further reduce your energy consumption and contribute to a greener future.

Customer: That all sounds very promising. How do I get started with ElectricVolt's renewable energy and sustainability programs?

Agent 1: Getting started is simple, Mr. Smith. I can schedule a consultation for you with one of our experts who will assess your specific needs and provide you with a personalized solution. They will walk you through the entire process, from design to installation, ensuring a smooth and hassle-free experience. Would you like me to schedule a consultation for you?

Customer: Yes, please. That would be great.

Agent 1: Wonderful, Mr. Smith. I have your contact information here, so I will have one of our experts reach out to you within the next 24 hours to schedule a convenient time for the consultation. Is there anything else I can assist you with today?

Customer: No, that's all for now. Thank you for your help, Agent 1.

Agent 1: You're welcome, Mr. Smith. It was my pleasure assisting you. We look forward to helping you achieve your renewable energy goals. Have a great day!

Customer: Thank you, Agent 1. You too. Goodbye.

Agent 1: Goodbye, Mr. Smith. Take care.",neutral,1,Renewable Energy and Sustainability Programs,resolved
"Agent 3: Thank you for calling ElectricVolt, my name is Agent 3. How may I assist you today?

Customer: Finally! I've been having issues with my electrical system for days now, and I'm beyond frustrated. I need someone to fix it ASAP!

Agent 3: I'm sorry to hear that you're experiencing difficulties. I'll do my best to help you. Can you please provide me with your name and address?

Customer: My name is John Smith, and I live at 123 Main Street.

Agent 3: Thank you, Mr. Smith. I understand you're angry and frustrated about the situation. Could you please explain the specific issues you're facing with your electrical system?

Customer: Well, my lights keep flickering, and some outlets in my house aren't working at all. I've tried resetting the breakers, but it hasn't helped. This is causing a lot of inconvenience for me and my family.

Agent 3: I apologize for the inconvenience, Mr. Smith. It sounds like you're dealing with some electrical faults. I recommend booking a technician to visit your property and assess the situation firsthand. Would you be available for a visit tomorrow between 2 PM and 4 PM?

Customer: Tomorrow?! That's too long to wait! I need someone to come today! This is unacceptable!

Agent 3: I understand your urgency, Mr. Smith, and I apologize for any inconvenience caused. Let me see if I can find a technician who can come today. Please bear with me for a moment.

(Customer waits for a few minutes)

Agent 3: I'm sorry, Mr. Smith, but all our technicians are currently booked for today. The earliest available appointment is tomorrow afternoon. However, I can escalate your case and see if we can get someone to you sooner. Would you like me to do that?

Customer: Yes, please escalate it! I can't wait until tomorrow. This is ridiculous!

Agent 3: I completely understand your frustration, Mr. Smith. I will escalate your case and prioritize it for an earlier appointment. Please note that I can't guarantee an immediate resolution, but I'll do my best to expedite the process. Is there anything else I can assist you with in the meantime?

Customer: No, just please make sure someone comes as soon as possible. This inconvenience has cost me enough already.

Agent 3: I assure you, Mr. Smith, that we will prioritize your case and have a technician visit your property as soon as we can. Thank you for your patience, and I apologize for any inconvenience caused. Is there anything else I can help you with today?

Customer: No, that's all for now. I hope your technician can resolve this issue quickly.

Agent 3: Thank you for reaching out to ElectricVolt, Mr. Smith. We appreciate your understanding, and we'll work hard to resolve your electrical issues. Have a great day.

(Customer hangs up, conversation unresolved)",angry,3,Technical Support and Troubleshooting,unresolved
"Agent 3: Thank you for calling ElectricVolt. My name is Agent 3. How may I assist you today?

Customer: Hi Agent 3! My name is Jane Smith. I'm calling because I need some electrical services for my home.

Agent 3: Hi Jane! I'm happy to help. What specific electrical services do you require?

Customer: Well, I need to install a few new outlets in my living room and also get some additional lighting fixtures installed in my backyard.

Agent 3: That's great! We can definitely assist you with those requests. Let me check the availability of our electricians in your area. Could you please provide me with your address?

Customer: Sure, it's 123 Main Street.

Agent 3: Thank you, Jane. Let me check our schedule. We have some available slots next week. How does Tuesday at 2 PM sound to you?

Customer: That works perfectly for me. Thank you for accommodating my schedule.

Agent 3: You're welcome, Jane. I'm glad I could find a suitable time for you. Is there anything else you need help with?

Customer: Actually, yes. I've been experiencing some issues with my circuit breaker. It keeps tripping randomly. Could you send someone to take a look at it?

Agent 3: Of course, Jane. We'll add that to your service request. Our electrician will inspect your circuit breaker during the same appointment on Tuesday. Is there anything else you'd like us to address?

Customer: No, that should be all for now. Thank you for your assistance, Agent 3.

Agent 3: It's my pleasure, Jane. We'll see you on Tuesday at 2 PM. If you have any other questions or concerns, don't hesitate to reach out. Have a great day!

Customer: Thank you, Agent 3. You've been very helpful. Have a great day too!

[End of call]",happy,3,Service Requests and Appointments,resolved
"Agent 3: Thank you for calling ElectricVolt. My name is Agent 3. How may I assist you today?

Customer (Angry): Finally! I've been trying to reach someone from ElectricVolt for ages! Your company's service is absolutely terrible!

Agent 3: I apologize for any inconvenience you may have experienced. I'm here to help. What seems to be the problem?

Customer (Angry): Problem? Oh, I'll tell you the problem! I had an electrician from ElectricVolt come to my house last week to fix a wiring issue, and now my entire electrical system is messed up! I want answers!

Agent 3: I'm really sorry to hear about the trouble you're facing. Let me check the records and see what I can find out. Can you please provide me with your name and address?

Customer (Angry): It's John Smith, and I live at 123 Main Street.

Agent 3: Thank you, Mr. Smith. I'm pulling up your account now. I see that you had requested a wiring repair. Can you please explain in more detail what's going wrong with your electrical system?

Customer (Angry): Ever since the electrician came, my lights have been flickering, and some outlets are not working at all. It's a complete mess!

Agent 3: I understand your frustration, Mr. Smith. We take these matters seriously, and I assure you we will do everything we can to resolve this issue. I will escalate your case to our technical team, and they will reach out to you within 24 hours to schedule a visit to fix the problem.

Customer (Angry): It better be within 24 hours! This is unacceptable! I demand compensation for the inconvenience and the potential damage to my appliances!

Agent 3: I completely understand your concerns, Mr. Smith. Our team will investigate the matter thoroughly and take appropriate action. As for compensation, I will make sure to forward your request to our management for consideration.

Customer (Angry): You better make sure they consider it! This whole situation has cost me time and money!

Agent 3: I apologize for the inconvenience caused, Mr. Smith. We value your business, and we will do everything we can to make it right. Is there anything else I can assist you with today?

Customer (Angry): No, that's all for now. I expect a prompt resolution to this issue!

Agent 3: Understood, Mr. Smith. We will do our best to address this as quickly as possible. Thank you for bringing this matter to our attention. Have a good day.

(Customer hangs up angrily)

Agent 3: (Sighs) Another angry customer. I hope we can resolve their issue soon.",angry,3,Regulatory Compliance and Legal Inquiries,unresolved
"Agent 1: Good morning, thank you for calling ElectricVolt. This is Agent 1 speaking. How can I assist you today?

Customer: Hi, Agent 1. My name is John Smith and I'm a contractor looking to partner with ElectricVolt for electrical services. I wanted to inquire about your company's offerings and discuss the possibility of collaboration.

Agent 1: Good morning, John. Thank you for reaching out to us. We're glad to hear that you're interested in partnering with ElectricVolt. We provide a wide range of electrical services for both residential and commercial customers. Could you please provide me with some more details about the type of collaboration you have in mind?

Customer: Absolutely. I mainly focus on residential projects, such as home renovations and new construction. I've heard great things about ElectricVolt's reputation for quality work, and I believe that partnering with your company could benefit both of us. I would like to know if you have any specific requirements or expectations for contractors who collaborate with you.

Agent 1: That's great to hear, John. We're always looking to expand our network of trusted contractors. While we don't have any strict requirements, we do expect our partners to have a valid contractor's license, proper insurance coverage, and a track record of delivering high-quality work to their clients. We also value open communication and prompt response times.

Customer: I meet all those requirements, so that's not an issue. How does the partnership process work? Do you have any specific criteria for selecting contractors for your projects?

Agent 1: Our partnership process involves a thorough evaluation of the contractor's qualifications and references. We also consider the contractor's past experience and expertise in handling various electrical projects. We believe in building long-term partnerships, so we strive to select contractors who align with our company values and can consistently meet our clients' expectations.

Customer: That sounds fair. Would it be possible for me to submit my credentials and references for review? And how long does the evaluation process typically take?

Agent 1: Absolutely, John. I can provide you with an email address where you can send your credentials and references. Once we receive your information, our team will review it and get back to you within two weeks with a decision. We understand the importance of timely responses and aim to be as efficient as possible in our evaluation process.

Customer: That works for me. I appreciate your promptness. I also wanted to know if there are any additional benefits or perks for contractors who partner with ElectricVolt.

Agent 1: Yes, John. We offer competitive rates and timely payments to our partners. Additionally, we provide ongoing training and support to ensure that our contractors are up to date with the latest industry standards and best practices. We believe in fostering long-term partnerships, so we strive to create a mutually beneficial relationship with our contractors.

Customer: That's great to hear. I believe this partnership could be very beneficial for both parties. Is there anything else I should be aware of before submitting my information?

Agent 1: Just make sure to provide us with accurate and complete information, John. This will help us better evaluate your qualifications and ensure a smooth process. Once you've sent in your credentials, we'll be in touch with any additional information or documentation we may need. If you have any further questions, feel free to reach out to us at any time.

Customer: I appreciate your assistance, Agent 1. I will gather all the necessary documents and submit them as soon as possible. Thank you for your time and I look forward to the possibility of partnering with ElectricVolt.

Agent 1: You're welcome, John. We appreciate your interest and look forward to reviewing your application. If you have any further questions or need any assistance during the process, don't hesitate to contact us. Have a great day!

Customer: Thank you, Agent 1. Have a great day as well. Goodbye.

Agent 1: Goodbye, John. Take care.",neutral,1,Contractor and Partner Communications,resolved
"Agent 3: Thank you for calling ElectricVolt. My name is Agent 3. How can I assist you today?

Customer: Hi, Agent 3. My name is Jane Smith. I've been experiencing some issues with the electrical services provided by ElectricVolt, and I wanted to discuss my complaints and grievances.

Agent 3: I'm sorry to hear that, Jane. I'll do my best to assist you. Can you please provide me with more details about the issues you're facing?

Customer: Sure. Over the past few weeks, I've noticed that some of the outlets in my house are not working properly. I've tried resetting the circuit breaker, but the problem persists. Additionally, the lights in my living room flicker quite frequently, which is really bothersome.

Agent 3: I apologize for the inconvenience, Jane. It sounds like there might be some electrical issues in your house. We can definitely send a technician to assess the situation. Could you please provide me with your address and contact information?

Customer: My address is 123 Main Street, and my phone number is 555-1234. I appreciate your help with this matter.

Agent 3: Thank you, Jane. I have noted down your details. Our technician will visit your house as soon as possible to identify and resolve the electrical issues you're facing. Is there anything else you'd like to discuss regarding your complaints and grievances?

Customer: Yes, actually. I also want to bring to your attention the poor customer service I received when I called last week to inquire about another electrical problem. The agent I spoke with was rude and dismissive, which left me quite frustrated.

Agent 3: I'm truly sorry for the negative experience you had with our previous agent, Jane. We strive to provide excellent customer service, and I apologize for falling short in this instance. Your feedback is valuable to us, and I assure you that we will take the necessary steps to address this issue internally.

Customer: Thank you for acknowledging my concerns, Agent 3. I hope ElectricVolt can improve its customer service moving forward. Is there anything else I should know or do regarding my complaints and grievances?

Agent 3: Once our technician visits your house and resolves the electrical issues, we will follow up with you to ensure everything is working properly. In the meantime, if you have any further questions or concerns, please don't hesitate to reach out to us.

Customer: I appreciate your assistance, Agent 3. I hope the technician can address the problems effectively. I look forward to the follow-up.

Agent 3: You're welcome, Jane. We will do our best to resolve the issues promptly. Thank you for bringing your complaints and grievances to our attention. Is there anything else I can assist you with today?

Customer: No, that's all for now. Thank you for your help, Agent 3.

Agent 3: You're welcome, Jane. Have a great day, and we'll be in touch soon. Goodbye!

Customer: Goodbye, Agent 3.",neutral,3,Complaints and Grievances,unresolved
"Agent 2: Thank you for calling ElectricVolt! My name is Agent 2. How may I assist you today?

Customer: Hi Agent 2! My name is Emily Johnson, and I'm a happy customer of ElectricVolt. I wanted to discuss my recent billing and payments with you.

Agent 2: Hello Emily! I'm glad to hear that you're happy with our services. I'll be more than happy to help you with your billing and payments. Could you please provide me with your account number or address so I can pull up your account?

Customer: Sure! My account number is EV1234567.

Agent 2: Thank you, Emily. I have your account pulled up now. How can I assist you with your billing and payments?

Customer: Well, I recently received my bill, and I noticed that the amount seems higher than usual. I've been monitoring my electricity usage, and it doesn't seem to match up with the charges on the bill.

Agent 2: I apologize for any confusion, Emily. Let me take a look at your billing statement to see if I can find any discrepancies. While I do that, could you please provide me with some details about your recent usage?

Customer: Of course! Over the past month, I haven't made any changes in my electricity usage. I've been using the same appliances and lights as usual. I even made an effort to conserve energy. However, my bill shows a significant increase compared to the previous month.

Agent 2: I understand your concern, Emily. Let me review your billing statement and compare it with your usage history. It seems that there was an error in calculating your usage for this billing cycle. I apologize for the inconvenience this has caused you.

Customer: Thank you for acknowledging the issue, Agent 2. I appreciate your help in resolving this matter.

Agent 2: You're welcome, Emily. I'm here to assist you. I have made a note of the discrepancy, and I will escalate this issue to our billing department immediately. They will review your account and make the necessary adjustments.

Customer: That's great to hear, Agent 2. I'm glad that the issue will be resolved soon. I have always been satisfied with ElectricVolt's services, and this experience won't change that.

Agent 2: I'm glad to hear that, Emily. We value your satisfaction as a customer, and we strive to provide the best service possible. Is there anything else I can assist you with today?

Customer: No, that's all for now, Agent 2. I appreciate your help and prompt action regarding my billing concern.

Agent 2: It was my pleasure assisting you, Emily. If you have any further questions or concerns in the future, please don't hesitate to reach out to us. Have a wonderful day!

Customer: Thank you, Agent 2. You too! Goodbye.

Agent 2: Goodbye, Emily. Take care!",happy,2,Billing and Payments,unresolved
"Agent 1: Good afternoon, thank you for calling ElectricVolt. My name is Agent 1. How can I assist you today?

Customer: Finally, someone answers! I've been trying to get through for ages. My power keeps flickering on and off, and it's driving me crazy! I need someone to fix it ASAP!

Agent 1: I apologize for the inconvenience, sir. I understand how frustrating it can be. Let me assist you with this issue. Could you please provide me with your name and address so that I can locate your account?

Customer: It's John Smith, and I live at 123 Main Street.

Agent 1: Thank you, Mr. Smith. I see your account here. I'm sorry you're experiencing power fluctuations. Let's troubleshoot the issue together. Have you noticed any specific patterns or appliances that seem to trigger the power flickering?

Customer: It happens randomly throughout the day. I haven't noticed any particular appliances causing it. It's just very erratic.

Agent 1: I see. It could be a sign of an electrical wiring or circuitry problem. First, I would recommend checking if any circuit breakers have tripped in your electrical panel. Could you please go and check that for me?

Customer: Ugh, fine. Give me a moment. (Sounds of footsteps and opening an electrical panel)

Agent 1: Thank you for your patience, Mr. Smith. Did you find any tripped circuit breakers?

Customer: No, everything seems to be fine in here. None of the breakers are tripped.

Agent 1: Alright, let's move on to the next step. Could you please check all your light fixtures and electrical outlets to ensure they are properly connected and there are no loose wires?

Customer: (Sighs) Fine, I'll check. (Sounds of inspecting light fixtures and outlets)

Agent 1: Any luck, Mr. Smith? Did you find any loose wires or faulty connections?

Customer: No, everything looks fine to me. I'm not an electrician, so I don't really know what to look for specifically.

Agent 1: I understand, sir. Don't worry, we'll figure this out together. Based on your description, it seems like a more complex issue that requires the expertise of one of our technicians. I will schedule a service appointment for you as soon as possible. Are there any specific days or times that work best for you?

Customer: Honestly, I want this fixed as soon as possible. I don't care about the time or day. Just get someone here soon!

Agent 1: I completely understand your urgency, Mr. Smith. I will prioritize your appointment and try to get someone out to you within 24 hours. Is there a phone number where our technician can reach you before arriving?

Customer: Yes, you can reach me at 555-1234.

Agent 1: Great, thank you for providing that. I will update your account with the details and our technician will be in touch with you shortly. In the meantime, is there anything else I can assist you with?

Customer: No, that's all for now. Just make sure someone comes out quickly.

Agent 1: Absolutely, Mr. Smith. We will do our best to resolve this issue promptly. Thank you for choosing ElectricVolt. Have a great day!

Customer: (Slightly less angry) Thank you. Goodbye.",angry,1,Technical Support and Troubleshooting,resolved
