call_transcript,mood,agent_number,intention,resolution
"Agent 2: Good morning! Thank you for calling ElectricVolt. My name is Agent 2. How may I assist you today?

Customer: Hi Agent 2! I'm John Smith, and I'm a happy customer of ElectricVolt. I'm calling because there seems to be a power outage in my neighborhood. I wanted to check if there's any information available about it.

Agent 2: Good morning, Mr. Smith! I'm sorry to hear about the power outage in your neighborhood. Let me check our system for any information on this. Can you please provide me with your address?

Customer: Sure, I live at 123 Main Street, Anytown.

Agent 2: Thank you, Mr. Smith. I see that there is indeed a power outage reported in your area. Our technicians are already working on resolving the issue. We apologize for the inconvenience caused.

Customer: That's good to know! I appreciate your prompt response. Is there any estimated time for when the power will be restored?

Agent 2: I'm glad you appreciate our efforts, Mr. Smith. Unfortunately, I don't have an exact restoration time at the moment. However, our technicians are working diligently to resolve the issue as quickly as possible. Rest assured, we will get your power back on as soon as we can.

Customer: Alright, I understand. I just wanted to make sure it was reported and being taken care of. Is there anything I should do in the meantime?

Agent 2: Yes, Mr. Smith. While our technicians are working on restoring the power, I recommend keeping your electronic devices unplugged to avoid any potential damage when the power is restored. Additionally, if you have any perishable items in your refrigerator, you may want to consider transferring them to a cooler with ice to prevent spoilage.

Customer: Thank you for the advice. I will follow those steps. Is there any way I can stay updated on the progress of the restoration?

Agent 2: Absolutely, Mr. Smith. We have a dedicated team monitoring the progress of the restoration. I can provide you with a reference number for this outage, and you can call our customer service line to get updates on the status. Would that be helpful for you?

Customer: Yes, please! That would be great. Can you provide me with the reference number?

Agent 2: Certainly, Mr. Smith. Your reference number for this outage is EV123456789. Please keep this number handy when you call our customer service line for updates.

Customer: Thank you, Agent 2. I appreciate your assistance. Is there anything else I need to know about the outage?

Agent 2: You're welcome, Mr. Smith. Regarding the outage, I would like to inform you that our company prioritizes medical facilities and essential services, so restoration for those locations may occur before residential areas. However, we are working diligently to restore power to all affected areas as quickly as possible.

Customer: I understand, Agent 2. It's good to know that essential services are being taken care of first. Thank you for providing me with all the necessary information. I feel reassured now.

Agent 2: You're most welcome, Mr. Smith. I'm glad I could assist you. If you have any further questions or concerns, please don't hesitate to call us back. We're here 24/7 to help you.

Customer: I will definitely do that if needed. Thanks again for your excellent service, Agent 2. Have a great day!

Agent 2: Thank you for your kind words, Mr. Smith. It was my pleasure assisting you. Have a wonderful day too, and I hope your power is restored soon. Goodbye!",happy,2,Outages and Emergencies,resolved
"[Phone ringing]

Agent 2: Thank you for calling ElectricVolt, my name is Agent 2. How can I assist you today?

Customer: Hi, Agent 2! My name is Sarah Thompson. I recently moved into a new house and I need some electrical work done. I heard great things about ElectricVolt and I'm excited to have your assistance.

Agent 2: Hi, Sarah! It's wonderful to have you as a new customer. How can we help you with your electrical needs?

Customer: Well, I have a family member with special needs, and I need some modifications to ensure their safety and accessibility in our new home. Can you provide guidance on what upgrades we might need?

Agent 2: Absolutely, Sarah. We understand the importance of ensuring a safe and accessible environment for everyone. I'll be more than happy to assist you with the necessary modifications. Let's start by discussing your specific requirements. What are some of the things you have in mind?

Customer: First, I would like to install grab bars in the bathroom to assist with stability. Additionally, I need to have electrical outlets placed at a lower height, as my family member uses a wheelchair. Are these modifications something you can help with?

Agent 2: Certainly, Sarah. Adding grab bars in the bathroom and lowering the height of electrical outlets are common modifications we make for our customers with special needs. Our team of skilled electricians is experienced in these types of installations. We can schedule a technician to come to your home and provide a free assessment to determine the scope of work needed.

Customer: That sounds great! How soon can we schedule the assessment?

Agent 2: We prioritize special needs projects, so we can arrange for a technician to visit your home within the next two business days. Does that timeframe work for you?

Customer: That works perfectly for me. I appreciate your quick response. Will there be any additional costs for the assessment?

Agent 2: No, Sarah. The assessment is completely free of charge. It allows our technician to evaluate the modifications needed and provide you with an accurate quote for the work. Once we have the assessment completed, we can discuss the pricing and timeline for the installation.

Customer: That's great to know. I'm glad it won't cost me anything upfront. ElectricVolt seems to really value their customers. I've heard your company has excellent customer service. Is that true?

Agent 2: Thank you for the kind words, Sarah. At ElectricVolt, we take pride in providing exceptional customer service. We understand that electrical work can be complex, so we strive to make the process as smooth and transparent as possible. Our goal is to ensure your complete satisfaction with our services.

Customer: Well, I'm already impressed with the service I've received so far. Is there anything else I should know about the process or any additional services you offer for special needs customers?

Agent 2: Thank you for your kind words, Sarah. In addition to the modifications you mentioned, we also offer specialized lighting solutions, such as motion-activated lights, to enhance safety and convenience. We can discuss these options further during the assessment. Furthermore, we provide ongoing support and maintenance services to ensure your electrical systems continue to meet your needs.

Customer: That's fantastic! I'm really grateful for your assistance. ElectricVolt seems to be the perfect fit for my electrical needs. Thank you for taking the time to explain everything to me, Agent 2.

Agent 2: You're very welcome, Sarah. It's been a pleasure assisting you. We look forward to helping you create a safe and accessible environment for your family member. If you have any further questions or if there's anything else we can assist you with, please don't hesitate to reach out to us.

Customer: I definitely will, Agent 2. Thank you again, and have a great day!

Agent 2: You too, Sarah. Have a wonderful day ahead. Goodbye!

[Call ends]",happy,2,Accessibility and Special Needs,resolved
"Agent 3: Thank you for calling ElectricVolt, my name is Agent 3. How can I assist you today?

Customer: Finally someone answered! I have been trying to get a hold of your company for days now. I am absolutely furious with the service I received from ElectricVolt!

Agent 3: I'm sorry to hear that you've been having trouble reaching us. I understand you're angry, and I apologize for any inconvenience caused. I'm here to help you with your concerns. Could you please let me know what happened?

Customer: Well, I recently had some electrical work done at my home by one of your technicians. Not only did they arrive late, but they also left my house in a mess. There were wires all over the place, and they didn't even clean up after themselves. This is completely unacceptable!

Agent 3: I'm sorry for the inconvenience caused by our technician's behavior. We strive to provide excellent service to all our customers, and it seems like we have fallen short in your case. I assure you that I will look into this matter and take appropriate action. We appreciate your feedback as it helps us improve our services. Is there anything else I can assist you with?

Customer: Yes, there is. I am also interested in learning more about your renewable energy and sustainability programs. I believe it's crucial for companies like yours to be environmentally responsible. Can you provide me with some information?

Agent 3: Absolutely! I'm glad to hear that you're interested in our renewable energy and sustainability programs. At ElectricVolt, we understand the importance of transitioning towards a greener future. We offer a range of solutions, including solar panel installations, energy-efficient lighting, and smart home automation systems. These solutions can help reduce your carbon footprint and lower your energy bills. Would you like me to provide more details on any specific program?

Customer: Solar panel installations sound interesting. Can you tell me more about how they work and the benefits they offer?

Agent 3: Certainly! Solar panel installations involve placing photovoltaic panels on your roof or in your yard to harness the sun's energy and convert it into electricity. This electricity can power your home, reducing your reliance on traditional energy sources. The benefits of solar panels include lower energy bills, a reduced environmental impact, and potential government incentives or tax credits. Additionally, excess energy can be sold back to the grid, potentially earning you additional income. Would you like us to schedule a consultation to assess your property's suitability for solar panels?

Customer: Yes, please schedule a consultation. I'm really interested in exploring this option further. Also, I hope you understand my frustration with the previous technician. I appreciate your willingness to address the issue.

Agent 3: I completely understand your frustration, and I apologize once again for the inconvenience caused. Rest assured, I will personally follow up on this matter to ensure it doesn't happen again. I'm glad to hear that you're interested in a solar panel consultation. I will arrange for one of our experts to visit your property and provide you with all the necessary information. Is there anything else I can assist you with?

Customer: No, that's all for now. Thank you for your help, Agent 3. I hope the consultation goes well and that we can move forward with the solar panel installation.

Agent 3: You're welcome! I appreciate your understanding and patience. I will make sure to prioritize your consultation appointment. If you have any further questions or concerns, don't hesitate to reach out to us. Thank you for choosing ElectricVolt, and have a great day!

Customer: Thank you, Agent 3. Goodbye.",angry,3,Renewable Energy and Sustainability Programs,resolved
"Agent 2: Thank you for calling ElectricVolt, this is Agent 2 speaking. How can I assist you today?

Customer: Hi Agent 2, my name is Alex Thompson. I'm a contractor and I've been using ElectricVolt's services for a while now. I just wanted to touch base and discuss some potential partnership opportunities.

Agent 2: Hi Alex, it's great to hear from you! We're always open to exploring partnership opportunities. How can we collaborate?

Customer: Well, I've been receiving positive feedback from my clients about the electrical work done by ElectricVolt. I was thinking we could work together on future projects. I'd like to recommend your services to my clients and perhaps even subcontract some work to you.

Agent 2: That sounds like a fantastic idea, Alex! We appreciate your trust in our services. We have a dedicated team of professionals who can handle both residential and commercial projects. We would be more than happy to be your go-to electrical service provider.

Customer: That's great to hear! I trust your team's expertise and professionalism. I'll definitely recommend ElectricVolt to my clients. How can we proceed with this partnership?

Agent 2: To begin with, I'll note down your interest in partnering with us. We will then create a contractor agreement that outlines the terms and conditions for our collaboration. This agreement will cover aspects such as rates, timelines, and project details. Once we have that in place, we can start working together seamlessly.

Customer: Perfect! I'm glad we're on the same page. I have a few upcoming projects that might require your services. Can I provide you with the details now, or should I wait until the agreement is finalized?

Agent 2: It's great to hear that you already have potential projects in mind, Alex. It would be better if we wait until the agreement is finalized, as that will ensure everything is properly documented and agreed upon. Once we have everything in place, you can provide us with the project details, and we'll take it from there.

Customer: That makes sense, Agent 2. I appreciate your professionalism. I'll wait for the agreement then. Is there an estimated timeline for its completion?

Agent 2: We aim to finalize the agreement within a week. However, it may vary depending on the complexity of the terms and any negotiations that may be required. Rest assured, we'll keep you updated throughout the process.

Customer: That sounds reasonable. I'll patiently await the agreement. In the meantime, I'll start informing my clients about ElectricVolt's services and recommend you as their trusted electrical contractor.

Agent 2: That's fantastic, Alex! Word-of-mouth recommendations are invaluable to us, and we truly appreciate your support. Is there anything else I can assist you with today?

Customer: No, Agent 2, that covers everything for now. I'm excited to partner with ElectricVolt and look forward to a successful collaboration. Thank you for your time and assistance.

Agent 2: You're very welcome, Alex! We're equally excited about this partnership. Thank you for choosing ElectricVolt. Have a wonderful day!

Customer: You too, Agent 2. Goodbye!

Agent 2: Goodbye, Alex, take care!",happy,2,Contractor and Partner Communications,unresolved
"Agent 1: Thank you for calling ElectricVolt. My name is Agent 1. How can I assist you today?

Customer: Hi Agent 1, my name is Emily Smith. I'm experiencing a power outage in my house. Can you help me?

Agent 1: Of course, Emily. I'm sorry to hear about your power outage. Let me check if there are any reported outages in your area. Could you please provide me with your address?

Customer: Sure, I live at 123 Main Street, Anytown.

Agent 1: Thank you, Emily. I see that there is currently a power outage reported in your area. Our technicians are already working on resolving the issue. They estimate that power will be restored within the next hour. I apologize for the inconvenience caused.

Customer: Oh, that's great to hear! Thank you for the quick response. Is there anything else I need to do?

Agent 1: Not at the moment, Emily. Our technicians are on it. However, if the power is not restored within the estimated time, please give us a call back, and we will investigate further.

Customer: Okay, I understand. Thank you for your help, Agent 1. I appreciate your assistance.

Agent 1: You're welcome, Emily. Is there anything else I can assist you with today?

Customer: Actually, while I have you on the line, I wanted to inquire about your emergency services. What should I do if I have an electrical emergency outside of regular business hours?

Agent 1: That's a great question, Emily. We provide 24/7 emergency services for situations like that. If you have an electrical emergency, you can call our emergency hotline at any time, and one of our technicians will be dispatched to your location as soon as possible.

Customer: That's reassuring to know. I feel much more confident knowing that I can rely on ElectricVolt even during an emergency. Thank you for explaining that to me.

Agent 1: It's our pleasure, Emily. We understand how crucial it is to have reliable electrical services, especially during emergencies. Is there anything else I can assist you with today?

Customer: No, Agent 1. You've been very helpful. Thank you again for your excellent service.

Agent 1: You're welcome, Emily. It was my pleasure to assist you. If you have any further questions or concerns, don't hesitate to give us a call. Have a great day!

Customer: You too, Agent 1. Goodbye!

Agent 1: Goodbye, Emily. Take care!",happy,1,Outages and Emergencies,unresolved
"Agent 2: Thank you for calling ElectricVolt, my name is Agent 2. How may I assist you today?

Customer: Hi Agent 2, my name is Emily Johnson. I'm calling regarding my ElectricVolt account.

Agent 2: Hello Emily, I'm here to help. What specifically would you like assistance with?

Customer: I recently moved to a new house, and I need to update my account information and transfer my services to the new address.

Agent 2: I can certainly help you with that. May I have your account number, please?

Customer: Sure, let me grab that for you. It's 567890.

Agent 2: Thank you, Emily. I see your account here. Congratulations on your new home! Can you please provide me with your new address?

Customer: Yes, my new address is 123 Main Street, Anytown, USA.

Agent 2: Great! I have updated your account with the new address. Now, let's talk about your services. Are you looking to transfer your existing services to the new address?

Customer: Yes, that's correct. I would like to transfer my electricity and internet services to the new house.

Agent 2: Noted. Let me check if ElectricVolt provides services in your new area. Please bear with me for a moment.

(Customer and Agent 2 wait for a few moments)

Agent 2: Emily, I have good news. ElectricVolt does provide services in your new area. I can schedule the transfer for you. Is there a specific date you would like the services to be transferred?

Customer: Thank you, that's great to hear. I would like to have the services transferred next week, on Wednesday, if possible.

Agent 2: Wednesday it is. I have scheduled the transfer for you. Is there anything else I can assist you with today, Emily?

Customer: Actually, yes. I received my recent bill, and I noticed a discrepancy in the charges. Can you help me understand why there is an increase in the amount?

Agent 2: I apologize for any confusion, Emily. Let me take a look at your billing statement. Could you please provide me with the invoice number or the amount in question?

Customer: Yes, the invoice number is 1234567890, and I noticed an increase of $20 compared to my previous bills.

Agent 2: I appreciate your patience, Emily. I have reviewed your billing statement, and it appears that the increase is due to a change in the pricing plan for your electricity usage. Would you like me to explain the details of the new plan?

Customer: Yes, please. I would like to understand the changes and how they affect my bill.

Agent 2: Understood. The new pricing plan is designed to offer more competitive rates during peak hours, which helps optimize the usage and reduce costs for our customers. This change was implemented to ensure fair pricing and better energy conservation. Would you like me to go over the specific details of the plan?

Customer: Yes, please. I want to make sure I understand how the new plan works.

Agent 2: Of course, Emily. With the new plan, you will receive lower rates during off-peak hours, such as late evenings and early mornings. This encourages customers to shift their electricity usage to those times, which helps balance the load on the grid and reduces the overall cost of electricity. The rates during peak hours may be slightly higher, but the overall aim is to provide more affordable and sustainable energy usage.

Customer: I see, that makes sense. Thank you for explaining it to me. I appreciate your help, Agent 2.

Agent 2: You're welcome, Emily. I'm glad I could assist you. Is there anything else I can assist you with today?

Customer: No, that's all for now. Thank you for your time and resolving my concerns.

Agent 2: It was my pleasure, Emily. Thank you for choosing ElectricVolt. If you have any further questions or need assistance in the future, please don't hesitate to reach out. Have a great day!

Customer: You too, Agent 2. Goodbye.

Agent 2: Goodbye, Emily. Take care.",neutral,2,Account Management,resolved
"Agent 1: Thank you for calling ElectricVolt, my name is Agent 1. How can I assist you today?

Customer: Hi Agent 1, I'm Mr. Johnson. I've been a customer of ElectricVolt for the past few years and I must say, I am extremely happy with your services. However, I have a small complaint that I would like to discuss.

Agent 1: Thank you for your kind words, Mr. Johnson. I'm glad to hear that you've been satisfied with our services. I'm here to address any concerns you may have. Please go ahead and let me know what the issue is.

Customer: Well, recently I had an electrical issue at my residence. I called ElectricVolt for assistance, and while the technician who came to fix the problem was very skilled and professional, I was a bit disappointed with the response time. It took nearly 48 hours for someone to arrive at my house.

Agent 1: I apologize for the delay, Mr. Johnson. We understand the importance of timely service and we strive to address all issues as quickly as possible. Could you please provide me with the date and time when you contacted us?

Customer: Yes, I called on Monday, July 5th at around 9:00 AM.

Agent 1: Thank you for the information, Mr. Johnson. I will look into this matter and make sure to investigate the delay. We value your feedback and will take the necessary steps to ensure such delays are avoided in the future. Is there anything else you would like to share regarding this issue?

Customer: No, that's about it. As I mentioned earlier, I am generally very satisfied with ElectricVolt's services. It was just this one incident that left me a little disappointed.

Agent 1: I completely understand, Mr. Johnson. I appreciate your understanding and patience. Rest assured, we will do our best to improve our response time and ensure that you receive prompt service in the future. Is there anything else I can assist you with today?

Customer: No, that's all for now. Thank you for addressing my concern, Agent 1. I appreciate your professionalism and willingness to resolve the issue.

Agent 1: You're most welcome, Mr. Johnson. It was my pleasure to assist you. Should you have any further questions or concerns in the future, please don't hesitate to reach out to us. Have a wonderful day!

Customer: Thank you, Agent 1. You too. Goodbye!

Agent 1: Goodbye, Mr. Johnson. Take care!",happy,1,Complaints and Grievances,resolved
