call_transcript,mood,agent_number,intention,resolution
"Agent 3: Thank you for calling ElectricVolt, my name is Agent 3. How may I assist you today?

Customer: Finally! I've been trying to reach someone from ElectricVolt for days. Your customer service is terrible!

Agent 3: I apologize for the inconvenience and any frustration caused, sir. How can I help you today?

Customer: I need to speak to someone about my account. I've been receiving incorrect bills for the past three months. This is unacceptable!

Agent 3: I understand your frustration, sir. I will do my best to assist you with this issue. May I have your name and account number, please?

Customer: My name is John Smith and my account number is 123456.

Agent 3: Thank you, Mr. Smith. Let me pull up your account and review the billing history. I see the discrepancy in your bills. It appears to be a meter reading mistake. I apologize for the inconvenience caused.

Customer: This is ridiculous! How could such a mistake happen? I want this resolved immediately.

Agent 3: I completely understand your frustration, Mr. Smith. I assure you, we will resolve this issue promptly. I will correct the meter reading error and ensure your next bill reflects the accurate usage.

Customer: I better not receive any more incorrect bills from ElectricVolt. This is causing me unnecessary stress and wasting my time.

Agent 3: I apologize for the inconvenience this has caused you, Mr. Smith. Rest assured, we will take the necessary steps to prevent this from happening again in the future. Is there anything else I can assist you with today?

Customer: No, that will be all for now. Just make sure this issue is resolved and I receive the correct bill next month.

Agent 3: I understand, Mr. Smith. I will personally monitor your account to ensure the issue is resolved. Thank you for bringing this to our attention. Is there anything else I can assist you with?

Customer: No, that will be all. Just make sure this doesn't happen again.

Agent 3: I apologize once again for the inconvenience caused, Mr. Smith. We value your feedback and appreciate your patience. If you have any further concerns, please don't hesitate to reach out to us. Thank you for choosing ElectricVolt.

Customer: Alright, thank you. Goodbye.

Agent 3: You're welcome, Mr. Smith. Have a great day. Goodbye.",angry,3,Account Management,resolved
"Agent 1: Good morning, thank you for calling ElectricVolt. My name is Agent 1. How can I assist you today?

Customer: Hi Agent 1, I'm John Smith. I recently had some electrical work done at my house, and I have a few complaints and grievances that I would like to address.

Agent 1: I'm sorry to hear that, Mr. Smith. I'll do my best to assist you. Could you please provide me with some details about the issues you are facing?

Customer: Sure! Firstly, the electrician who came to my house was extremely late. He was scheduled to arrive at 9 am, but he didn't show up until 11 am. This caused a lot of inconvenience for me as I had to rearrange my entire day.

Agent 1: I apologize for the inconvenience caused, Mr. Smith. Punctuality is important to us, and we understand how frustrating it can be when appointments are not honored. Rest assured, I will address this issue with our team. Is there anything else you would like to bring to our attention?

Customer: Yes, during the work, the electrician accidentally damaged a few of my walls. I understand that accidents can happen, but I would appreciate it if the company could take responsibility for the repairs.

Agent 1: I'm sorry to hear about the damage caused, Mr. Smith. We will definitely take responsibility for repairing the walls. I will create a service request for you, and our team will reach out to schedule the repairs at your earliest convenience.

Customer: Thank you, Agent 1. I appreciate your prompt response. Lastly, I have noticed that my electricity bills have been higher than usual since the work was done. I'm concerned that something might not have been installed correctly, causing an increase in energy consumption.

Agent 1: I understand your concern, Mr. Smith. We take energy efficiency seriously, and I will ensure that we investigate this matter thoroughly. I will arrange for an experienced electrician to visit your premises and assess the situation. We will rectify any issues found, and if necessary, make adjustments to ensure your electricity bills are back to normal.

Customer: That would be great, Agent 1. I'm glad to see that you are taking these complaints seriously and are willing to find resolutions. I appreciate your help in this matter.

Agent 1: It's our pleasure, Mr. Smith. We value your satisfaction and want to make things right. Is there anything else I can assist you with today?

Customer: No, that covers all my concerns for now. I just hope that these issues can be resolved quickly.

Agent 1: I understand, Mr. Smith. We will prioritize your service request and keep you updated on the progress. If you have any further questions or need assistance in the future, please don't hesitate to reach out to us. Thank you for bringing these matters to our attention, and have a wonderful day!

Customer: Thank you, Agent 1. I appreciate your help and understanding. Have a great day too! Goodbye.

Agent 1: Goodbye, Mr. Smith. Take care!",happy,1,Complaints and Grievances,resolved
"Agent 3: Thank you for calling ElectricVolt. This is Agent 3. How can I assist you today?

Customer: Hi, Agent 3. My name is Emily Johnson. I'm looking for some general information about your electrical services.

Agent 3: Hello, Emily. I'll be happy to help you. What specific information would you like to know?

Customer: Well, I recently moved into a new home, and I'm experiencing some electrical issues. I wanted to know if ElectricVolt provides services for residential customers like me.

Agent 3: Absolutely, Emily. We provide electrical services for both residential and commercial customers. We have a team of skilled electricians who can assist you with any electrical problems you're facing.

Customer: That's great to hear. Can you tell me a bit more about the services you offer for residential customers?

Agent 3: Of course. We offer a wide range of services, including electrical installations, repairs, upgrades, and maintenance. Whether you need help with lighting, wiring, outlets, or any other electrical component in your home, our team can handle it.

Customer: That sounds comprehensive. What about emergency services? Do you offer those as well?

Agent 3: Yes, we do. We understand that electrical emergencies can occur at any time, so we provide 24/7 emergency services. If you're facing an urgent electrical issue, just give us a call, and we'll send a technician to your location as soon as possible.

Customer: That's reassuring. How do you ensure the quality of your services?

Agent 3: At ElectricVolt, we prioritize quality and customer satisfaction. All our electricians are licensed and experienced professionals who undergo regular training to stay updated with the latest industry standards and practices. Additionally, we use high-quality materials and equipment to ensure long-lasting results.

Customer: That's good to know. What about pricing? Do you have transparent pricing for your services?

Agent 3: Yes, we believe in transparent pricing. During our initial consultation, our electrician will assess the scope of work and provide you with a detailed estimate. We strive to offer competitive prices without compromising on the quality of our services. You can be assured that there won't be any hidden charges or surprises.

Customer: That's important to me. I appreciate the transparency. Is there anything else I should know before scheduling a service?

Agent 3: Before scheduling a service, we recommend discussing your specific requirements with our team. This will help us understand your needs better and assign the most suitable electrician for the job. Additionally, if you have any special requests or concerns, feel free to let us know, and we'll do our best to accommodate them.

Customer: Okay, I will keep that in mind. Thank you for all the information, Agent 3. You've been very helpful.

Agent 3: You're welcome, Emily. I'm glad I could assist you. If you have any more questions or if there's anything else we can do for you, please don't hesitate to reach out. We're here to help.

Customer: I will definitely keep that in mind. Thanks again, Agent 3. Have a great day!

Agent 3: You're welcome, Emily. You have a great day too! Goodbye!",neutral,3,Inquiries and General Information,resolved
"Agent 3: Thank you for calling ElectricVolt! This is Agent 3 speaking. How may I assist you today?

Customer: Hi Agent 3! I'm Jessica Anderson. I'm a happy customer of ElectricVolt, and I wanted to inquire about any special programs or promotions you currently have.

Agent 3: Hello, Jessica! I'm glad to hear that you're happy with our services. We do have some special programs and promotions available. Could you please provide me with your account number or address to pull up your details?

Customer: Sure, my address is 123 Main Street, Anytown.

Agent 3: Thank you, Jessica. Let me check our system for any ongoing promotions or programs in your area. While I'm doing that, may I ask if you have any specific needs or preferences in mind?

Customer: Well, I'm particularly interested in any discounts on home electrical inspections or any offers for upgrading my electrical panel.

Agent 3: I understand. Home electrical inspections and panel upgrades are important for maintaining the safety and efficiency of your electrical system. Let me see what we have available for you. Ah, here we go! We currently have a promotion running for a 20% discount on home electrical inspections. Additionally, we have a package deal for a panel upgrade with a free surge protector installation.

Customer: That sounds fantastic! I've been meaning to get my home inspected, and a panel upgrade would definitely be beneficial. How long will these promotions be available?

Agent 3: These promotions are valid for the next three months, so you have plenty of time to take advantage of them. We can schedule the inspection and panel upgrade at your convenience. Is there a specific date or time that works best for you?

Customer: I'm pretty flexible with my schedule, so any weekday afternoon would be perfect for me.

Agent 3: Great! I'll go ahead and schedule the home electrical inspection for next Thursday at 2 PM. As for the panel upgrade, we can arrange it for the following week, if that works for you.

Customer: That sounds perfect! Please go ahead and schedule both appointments for me.

Agent 3: Absolutely, Jessica. I've scheduled both the home electrical inspection and the panel upgrade for you. You will receive a confirmation email shortly with all the details. Is there anything else I can assist you with today?

Customer: No, that's all for now. Thank you so much, Agent 3! I appreciate your help and the great promotions you've provided.

Agent 3: You're very welcome, Jessica! It's been a pleasure assisting you. If you have any further questions or need assistance in the future, don't hesitate to reach out. Have a wonderful day!

Customer: You too, Agent 3! Goodbye!

Agent 3: Goodbye, Jessica! Take care!",happy,3,Special Programs and Promotions,unresolved
"Agent 1: Good morning, thank you for calling ElectricVolt. This is Agent 1 speaking. How can I assist you today?

Customer: Good morning! I'm John Smith, and I'm interested in your electrical services for my new commercial building. I've heard great things about ElectricVolt, and I'm excited to work with you.

Agent 1: Hello, John! Thank you for choosing ElectricVolt. We're thrilled to have you as our customer. How can we help you with your electrical needs?

Customer: Well, I need a complete electrical setup for my building. It's a two-story structure with multiple offices and conference rooms. Can you provide all the necessary wiring, fixtures, and equipment?

Agent 1: Absolutely, John! We specialize in handling both residential and commercial electrical projects. Our team of experts will ensure that all your electrical needs are met, from wiring to fixtures and equipment installation.

Customer: That's fantastic to hear! I also need assistance with the design and layout of the electrical system. Can your team help with that?

Agent 1: Certainly, John! Our experienced electricians are skilled in designing efficient and effective electrical systems for commercial buildings. We'll work closely with you to understand your requirements and create a customized plan that suits your needs.

Customer: Great! I'm glad to know that ElectricVolt provides such comprehensive services. How soon can we start the project?

Agent 1: Once we have all the necessary information and approvals, we can schedule our team to begin work within two weeks. However, please keep in mind that the timeline may vary depending on the complexity of the project.

Customer: That works for me. I have another question. What kind of warranty do you offer on your services and products?

Agent 1: We provide a one-year warranty on our services and products, John. If you encounter any issues within that period, our team will promptly address them at no additional cost to you.

Customer: That's reassuring to hear. I appreciate the guarantee of quality and support. Is there anything else I should know about working with ElectricVolt?

Agent 1: One important thing to note, John, is that we prioritize safety and adhere to all electrical codes and regulations. Your project will be handled by licensed and experienced electricians, ensuring a high standard of workmanship.

Customer: Safety is definitely a top priority for me. I'm glad to hear that ElectricVolt takes it seriously. I think I'm ready to proceed with ElectricVolt for my electrical needs. How do we move forward?

Agent 1: That's wonderful news, John! To proceed, we'll need to schedule a site visit to assess your building's requirements and provide you with a detailed quote. I'll arrange a suitable time for our team to visit your location. Is there any particular day or time that works best for you?

Customer: I'm available any weekday between 9 am and 5 pm. Feel free to choose a day that works best for your team, and I'll make sure to be present.

Agent 1: Perfect, John! I'll schedule the site visit for next Tuesday at 10 am. Our team will meet you at the location to discuss further details and provide a comprehensive quote. Is there anything else I can assist you with?

Customer: No, that's all for now. Thank you for your excellent service, Agent 1. I'm excited to work with ElectricVolt, and I look forward to meeting your team next week.

Agent 1: Thank you for your kind words, John! We're equally excited to work with you. Should you have any questions or concerns before the site visit, feel free to reach out to us. Have a wonderful day!

Customer: You too, Agent 1. Goodbye!

Agent 1: Goodbye, John! Have a great day ahead!",happy,1,Contractor and Partner Communications,resolved
"Agent 1: Good morning, thank you for calling ElectricVolt. My name is Agent 1. How can I assist you today?

Customer: Hi Agent 1, my name is Emily Smith. I'm having some issues with my electrical system at home. Can you help me troubleshoot?

Agent 1: Of course, Emily! I'd be happy to assist you. Can you please describe the issue you're experiencing?

Customer: Well, yesterday I noticed that some of the outlets in my living room stopped working. I tried resetting the circuit breaker, but it didn't fix the problem.

Agent 1: I see. It seems like there might be an issue with the specific outlets. Have you tried plugging something into those outlets to see if there's any power flow?

Customer: Yes, I did. I plugged in a lamp and it didn't turn on. So, I'm guessing there's no power flowing through those outlets.

Agent 1: Alright, Emily. It's possible that the outlets may have tripped or there could be a wiring issue. Let's try a few troubleshooting steps. Firstly, could you check if any of your GFCI outlets have tripped?

Customer: GFCI outlets? Sorry, I'm not familiar with that term. Could you please explain?

Agent 1: No problem, Emily. GFCI stands for Ground Fault Circuit Interrupter. It's a type of outlet commonly found in areas like kitchens, bathrooms, and outdoor spaces. It has a built-in circuit breaker that can trip and cut off power in case of a ground fault. It's important to check these outlets as they can sometimes affect nearby outlets.

Customer: Ah, got it! Let me go check. Oh, I found one in my kitchen and it seems to be tripped. I'll reset it now.

Agent 1: Great job, Emily! Resetting the GFCI outlet might restore power to the outlets in your living room. Could you check if they're working now?

Customer: Wow, it worked! The outlets in my living room are working again. Thank you so much, Agent 1!

Agent 1: You're welcome, Emily! I'm glad we were able to resolve the issue. Is there anything else I can assist you with today?

Customer: Actually, yes. I have one more question. I've been thinking about installing some outdoor lighting in my backyard. Can you recommend any specific products or provide some guidance?

Agent 1: Absolutely, Emily! We have a range of outdoor lighting options available. To better understand your requirements, could you please let me know the size of your backyard and the specific areas you'd like to illuminate?

Customer: Sure! My backyard is approximately 500 square feet, and I'd like to focus on lighting up the patio area and the walkway leading to it.

Agent 1: Based on your requirements, I'd recommend considering a combination of LED path lights for the walkway and some decorative string lights for your patio. LED lights are energy-efficient and provide long-lasting illumination. We have various designs and styles to choose from. Would you like me to provide you with more information on these options?

Customer: That sounds perfect, Agent 1! I'd appreciate any additional information you can provide.

Agent 1: Certainly, Emily! I will send you an email with detailed information, including product descriptions, pricing, and installation tips. You can expect to receive it within the next hour.

Customer: Thank you so much for your assistance, Agent 1. You've been incredibly helpful today!

Agent 1: It was my pleasure, Emily! I'm glad I could assist you with both the troubleshooting and lighting recommendations. If you have any further questions in the future or need any other assistance, don't hesitate to reach out. Have a fantastic day!

Customer: You too, Agent 1! Thanks again for everything. Goodbye!

Agent 1: Goodbye, Emily! Take care!",happy,1,Technical Support and Troubleshooting,resolved
"[Transcript begins]

Agent 2: Thank you for calling ElectricVolt. My name is Agent 2. How can I assist you today?

Customer: Finally, someone picked up! I've been trying to get through to you guys for hours! Your service is absolutely terrible!

Agent 2: I apologize for the inconvenience, sir. I understand that you're frustrated. How can I help you today?

Customer: Frustrated doesn't even begin to cover it! Your technician was supposed to come and fix our electrical issue this morning, and it's already past noon, and no one has shown up!

Agent 2: I'm really sorry to hear that, sir. Let me check the status of your appointment. May I have your name and address, please?

Customer: It's John Smith, and my address is 123 Main Street.

Agent 2: Thank you, Mr. Smith. I'm checking our system right now. I see that there was a delay with our technician's schedule. I apologize for not notifying you about this earlier.

Customer: Delay? Delay is an understatement! I took the day off from work to wait for the technician, and now I'm just wasting my time!

Agent 2: I completely understand your frustration, Mr. Smith. Let me see if I can expedite the process for you. I'll contact the technician directly and ask him to prioritize your appointment.

Customer: It's about time someone did something! I expect some compensation for this inconvenience.

Agent 2: I understand your request, Mr. Smith. I will make a note of it and escalate your concern to our customer service team. They will be able to address any compensation issues. Is there anything else I can assist you with?

Customer: No, that's all. Just make sure someone shows up soon!

Agent 2: I assure you, Mr. Smith, we will do our best to resolve this matter as quickly as possible. Thank you for bringing it to our attention. Have a good day.

[Transcript ends]",angry,2,Contractor and Partner Communications,resolved
"[Phone ringing]

Agent 2: Thank you for calling ElectricVolt, this is Agent 2 speaking. How may I assist you today?

Customer: Hi Agent 2, my name is Sarah Johnson. I'm calling because I recently had some electrical work done at my home and I'm having a few issues with it.

Agent 2: Hi Sarah, I'm sorry to hear that you're experiencing some problems. I'll do my best to help you out. Can you please provide me with some details about the issues you're facing?

Customer: Sure, Agent 2. So, I had some new outlets installed in my living room last week, and they were working fine initially. But now, they're not providing any power. I tried resetting the circuit breaker, but it didn't solve the problem.

Agent 2: I understand your concern, Sarah. Let me check our records to see which technician worked on your project. Please bear with me for a moment.

[Agent 2 puts the call on hold and checks the system]

Agent 2: Thank you for waiting, Sarah. I see that John Davis was the technician who handled your installation. I'll reach out to him and get back to you with a resolution. Is it okay if I contact you within the next 24 hours?

Customer: That would be great, Agent 2. Thank you for your assistance. I appreciate your prompt response.

Agent 2: You're welcome, Sarah. We value your satisfaction as our customer, and we'll do everything we can to resolve this issue for you. Is there anything else I can help you with today?

Customer: Actually, yes. While I have you on the line, I also wanted to inquire about your company's services for commercial clients. I run a small business, and we're looking for an electrical contractor for some upcoming projects.

Agent 2: Absolutely, Sarah! We provide a wide range of electrical services for both residential and commercial customers. Our team of experienced technicians can handle various projects, from wiring and lighting installations to electrical maintenance. If you could provide me with some more details about your requirements, I can ensure that we assign the right technician for your needs.

Customer: That's great to hear, Agent 2. We're planning to expand our office space, so we'll need additional electrical outlets, lighting fixtures, and some rewiring. Can you give me an estimate of the costs and the timeline for completion?

Agent 2: Certainly, Sarah. To provide you with an accurate estimate, we would need to schedule a site visit to assess the scope of work. Our technician will evaluate your requirements and provide you with a detailed quote and timeline for completion based on the complexity of the project. Would you like me to schedule a visit for you?

Customer: Yes, please! That would be fantastic. I'm impressed with the level of professionalism and efficiency I've experienced with ElectricVolt so far. I'm confident that you'll be the right partner for our electrical needs.

Agent 2: Thank you for your kind words, Sarah. We strive to deliver exceptional service to all our customers. I'm sure our team will exceed your expectations. I'll coordinate with our scheduling department to find a suitable time for the site visit and get back to you with the details as soon as possible.

Customer: That sounds perfect, Agent 2. I look forward to hearing from you soon. Thank you again for your help.

Agent 2: You're most welcome, Sarah. It was a pleasure assisting you today. If you have any further questions or concerns, please don't hesitate to reach out. Have a great day!

Customer: You too, Agent 2. Goodbye!

Agent 2: Goodbye, Sarah. Take care!",happy,2,Contractor and Partner Communications,unresolved
