call_transcript,mood,agent_number,intention,resolution
"[Phone ringing]

Agent 2: Thank you for calling ElectricVolt, my name is Agent 2. How can I assist you today?

Customer: Finally! I've been trying to get in touch with someone from your company for days now. Your customer service is absolutely terrible!

Agent 2: I apologize for the inconvenience, sir. How can I help you today?

Customer: Well, I recently moved into a new apartment and I've been having some electrical issues. I need someone to come and fix them immediately.

Agent 2: I'm sorry to hear about the issues you're facing. We'll do our best to assist you. Can you please provide me with your name and address?

Customer: My name is John Smith and I live at 123 Main Street.

Agent 2: Thank you, Mr. Smith. I see that you mentioned accessibility and special needs. Can you please elaborate on the specific issues you're facing?

Customer: Yes, I have a wheelchair ramp installed outside my apartment, and the lights on the ramp have stopped working. It's incredibly dangerous for me to navigate in the dark, especially during the evenings.

Agent 2: I understand the urgency, Mr. Smith. We prioritize accessibility and special needs issues. Let me schedule an appointment for one of our electricians to come and fix the lights for you. Is there a specific time that works best for you?

Customer: I work during the day, so anytime in the evening would be ideal.

Agent 2: Noted. I will schedule the appointment for tomorrow evening between 6 PM and 8 PM. Our electrician will give you a call before heading to your location. Is there anything else I can assist you with?

Customer: Well, it's not just the lights on the ramp. I've noticed that some of the outlets in my apartment are not working as well. This is really frustrating!

Agent 2: I apologize for the inconvenience, Mr. Smith. We'll make sure to have our electrician check all the outlets during the appointment tomorrow. They will thoroughly assess and fix any electrical issues you have.

Customer: Alright, I hope they can actually fix everything. I can't believe I'm paying for a place that has so many problems.

Agent 2: I completely understand your frustration, Mr. Smith. Our electrician will be fully equipped to handle any electrical issues and ensure your safety. Is there anything else I can assist you with today?

Customer: No, I suppose that's all for now. I just hope everything gets resolved quickly.

Agent 2: I assure you, Mr. Smith, we'll do our best to resolve all the issues during the appointment tomorrow. If you have any further concerns or questions, please don't hesitate to reach out to us. Thank you for choosing ElectricVolt.

Customer: Thank you. I hope things go smoothly tomorrow.

Agent 2: You're welcome, Mr. Smith. Have a great day!

[Call ends]",angry,2,Accessibility and Special Needs,resolved
"Agent 2: Thank you for calling ElectricVolt! My name is Agent 2. How may I assist you today?

Customer: Hi Agent 2! I'm John Smith, and I'm looking to schedule an electrical service appointment for my residence.

Agent 2: Hello, John! I'm glad you called. We'd be more than happy to assist you with that. Could you please provide me with your address and contact details?

Customer: Sure! My address is 123 Main Street, and you can reach me at 555-123-4567.

Agent 2: Thank you, John. Now, could you please describe the issue you're facing or the service you require?

Customer: Well, I recently moved into this house, and I've noticed some flickering lights in a few rooms. It's not a major issue, but I'd like to get it checked out to ensure everything is safe and functioning properly.

Agent 2: I understand, John. Safety is our top priority. Let me check our availability for an appointment. How does next Tuesday at 10:00 AM sound to you?

Customer: That works perfectly for me, Agent 2! Thank you for accommodating my schedule.

Agent 2: You're welcome, John! I've scheduled a technician to visit your residence on Tuesday, September 14th, at 10:00 AM. Is there anything else I can assist you with?

Customer: Actually, I have a few additional questions. How long does a typical electrical service appointment take, and will I need to be present during the visit?

Agent 2: Great questions, John! The duration of the appointment depends on the complexity of the issue, but it usually takes around 1 to 2 hours. Regarding your presence, it would be ideal if you or someone over the age of 18 can be present during the appointment. This will help our technician access any necessary areas and communicate any findings or recommendations directly to you.

Customer: That makes sense, Agent 2. I'll make sure to be there during the appointment. Is there any preparation I need to do before the technician arrives?

Agent 2: Not much, John. It would be helpful if you could clear any obstructions around the electrical panels and provide our technician with easy access to the areas where you're experiencing the issue. Other than that, our technician will take care of the rest.

Customer: Perfect, I'll make sure to do that. One more thing, Agent 2. How will I be notified if there are any changes or updates to my appointment?

Agent 2: We'll keep you informed every step of the way, John. You'll receive both a confirmation call and a reminder call the day before your appointment. Additionally, our technician will give you a courtesy call when they're on their way to your residence.

Customer: That's excellent customer service, Agent 2! I appreciate the proactive communication. Thank you for answering all my questions and scheduling the appointment for me.

Agent 2: You're very welcome, John! It's our pleasure to assist you. Is there anything else I can help you with today?

Customer: No, that's all for now, Agent 2. I'm really impressed with your service, and I'm looking forward to the appointment. Thank you again!

Agent 2: You're most welcome, John! We're glad to have you as a customer. If you have any further questions or concerns, don't hesitate to give us a call. Have a wonderful day!

Customer: Thank you, Agent 2. You too! Goodbye.

Agent 2: Goodbye, John. Take care!",happy,2,Service Requests and Appointments,resolved
"Agent 1: Thank you for calling ElectricVolt! My name is Agent 1. How may I assist you today?

Customer: Hi, Agent 1. My name is John Smith. I'm a contractor and I've been using ElectricVolt's services for my projects. I've been having some issues lately and wanted to discuss them with you.

Agent 1: Hello, Mr. Smith. I appreciate you reaching out to us. I'm here to help. Could you please provide me with some details about the issues you've been facing?

Customer: Sure. Firstly, I've noticed a delay in the response time from your technicians. It's become quite frustrating as my projects are getting delayed due to this.

Agent 1: I apologize for the inconvenience, Mr. Smith. We strive to provide prompt service to all our customers. Could you please tell me when you experienced this delay?

Customer: It started about a month ago. I used to get a technician on-site within 24 hours of reporting an issue, but now it takes around 3-4 days.

Agent 1: I understand your concern, Mr. Smith. We value your time and I'll make a note of this issue. We'll look into it and make sure our response time is improved. Is there anything else you'd like to discuss?

Customer: Yes, there's one more thing. I recently had a technician come to my site for a repair, and he left without completing the job. I had to call again and reschedule another appointment.

Agent 1: I apologize for the inconvenience, Mr. Smith. That's certainly not the level of service we aim to provide. I'll make sure to address this issue with the technician and take necessary actions to prevent such incidents from happening again. Thank you for bringing this to our attention.

Customer: You're welcome, Agent 1. I appreciate your understanding. Apart from these issues, I must say that the quality of work your technicians provide is excellent. It's just these small hiccups that need attention.

Agent 1: Thank you for your kind words, Mr. Smith. We take pride in delivering high-quality services to our customers. Your feedback is valuable to us, and we will work on improving our overall service experience. Is there anything else I can assist you with today?

Customer: No, that would be all for now, Agent 1. I appreciate your help and understanding. I hope these issues get resolved soon.

Agent 1: I assure you, Mr. Smith, we will prioritize resolving these issues for you. Thank you for choosing ElectricVolt as your electrical services provider. If you have any further concerns or questions, please don't hesitate to reach out to us. Have a great day!

Customer: Thank you, Agent 1. Have a great day too. Goodbye!

Agent 1: Goodbye, Mr. Smith. Take care!",neutral,1,Contractor and Partner Communications,resolved
"[Phone ringing]

Agent 3: Good morning, thank you for calling ElectricVolt. My name is Agent 3. How can I assist you today?

Customer: Finally, someone answers! I've been trying to reach your company for days now. I am absolutely furious with the service I've been receiving!

Agent 3: I apologize for the inconvenience, sir. I understand you're angry, and I'm here to help. Can you please provide me with your name and account number so I can access your information?

Customer: My name is John Smith, and my account number is 12345678.

Agent 3: Thank you, Mr. Smith. I see that you've been trying to inquire about our Renewable Energy and Sustainability Programs. How can I assist you with that?

Customer: Well, I've been researching different renewable energy options, and I was interested in installing solar panels on my property. But every time I try to get information from your company, I'm met with unhelpful responses or long wait times. What kind of customer service is that?

Agent 3: I apologize for the frustration you've experienced, Mr. Smith. Our customer service should have been more efficient in addressing your concerns. I'm here to assist you now, and I'll do my best to provide the information you need. Solar panel installations are indeed part of our Renewable Energy and Sustainability Programs. What specific information are you looking for?

Customer: I want to know about the cost, the process, and the potential savings I can expect. Can you give me an estimate of how much it would cost to install solar panels on my property?

Agent 3: Certainly, Mr. Smith. The cost of installing solar panels can vary depending on various factors such as the size of your property, your electricity consumption, and the specific type of solar panels you choose. To provide you with an accurate estimate, I would need some more information. Would it be possible for our technician to visit your property and assess the requirements?

Customer: Well, I guess that would be necessary. But I'm not happy about the additional delay and inconvenience. How long will it take for someone to come and assess my property?

Agent 3: I apologize for any inconvenience caused, Mr. Smith. Our technicians are usually able to visit properties within 7 to 10 business days. However, due to high demand, there might be a slight delay. I assure you that we will prioritize your request and schedule the assessment as soon as possible. Is there any specific timeframe you would prefer?

Customer: I don't have much flexibility in my schedule, but I suppose I can make myself available next Monday afternoon. Can you guarantee that someone will come on that day?

Agent 3: I will do my best to accommodate your preferred timeframe, Mr. Smith. Let me check the availability of our technicians for next Monday afternoon. Please bear with me for a moment.

[Agent 3 puts the customer on hold to check the technicians' schedule]

Agent 3: Thank you for your patience, Mr. Smith. I have scheduled a technician to visit your property on Monday afternoon between 2 PM and 4 PM. They will assess the requirements and provide you with a detailed estimate. Is there anything else I can assist you with?

Customer: No, that's all for now. I just hope this process goes smoothly from here on. I'm tired of the poor customer service I've received so far.

Agent 3: I completely understand your frustration, Mr. Smith, and I apologize for any inconvenience caused. I assure you that we will do our best to ensure a smooth and efficient process moving forward. If you have any further concerns or questions, please don't hesitate to reach out to us. Thank you for choosing ElectricVolt, and I hope you have a pleasant day.

Customer: Thank you, I hope so too. Goodbye.

Agent 3: Goodbye, Mr. Smith.",angry,3,Renewable Energy and Sustainability Programs,unresolved
"Agent 2: Thank you for calling ElectricVolt. My name is Agent 2. How can I assist you today?

Customer: Hi Agent 2, my name is John Smith. I have some questions regarding my recent bill and payment options.

Agent 2: Hi John, I'll be happy to help you with that. Can you please provide me with your account number or address so I can pull up your information?

Customer: Sure, my account number is 123456789.

Agent 2: Thank you, John. I see your account here. How can I assist you with your billing and payment concerns?

Customer: Well, I received my bill for this month, and I noticed that the amount seems higher than usual. I would like to understand what caused the increase.

Agent 2: I apologize for any confusion, John. Let me take a look at your billing details. It seems that your usage for the previous month was higher than usual. Did you notice any changes in your electrical consumption?

Customer: Not really, Agent 2. We haven't made any significant changes in our daily routine. Is there any way to verify the accuracy of the meter reading?

Agent 2: Absolutely, John. We can schedule a meter reading to ensure the accuracy of your consumption. I will note that down for you. Additionally, please check if there are any appliances or devices that might be consuming more electricity than before. Sometimes, outdated or faulty appliances can lead to higher consumption.

Customer: Alright, I will double-check our appliances and see if there are any issues. What payment options do you offer? Can I pay online?

Agent 2: Yes, John. We do offer online payment options for your convenience. You can visit our website and create an account to access your billing information and make payments securely. We also provide automatic payment options, where your bill can be deducted directly from your bank account on the due date.

Customer: That sounds convenient. I will definitely check out the online payment options. One more thing, Agent 2. Is there any way to set up a payment plan if I'm unable to pay the full amount by the due date?

Agent 2: Absolutely, John. We understand that unexpected situations can arise. We do offer payment arrangements to ensure you can manage your bill effectively. I can assist you with setting up a payment plan that suits your needs. Please keep in mind that there might be certain criteria to qualify for a payment plan, such as maintaining a good payment history.

Customer: That's good to know. I appreciate your assistance, Agent 2. Is there anything else I should be aware of regarding my billing and payments?

Agent 2: Just a reminder, John, to review your bill carefully each month and contact us promptly if you notice any discrepancies or have any concerns. It's always better to address any issues as soon as possible to avoid any further complications. Is there anything else I can assist you with today?

Customer: No, Agent 2, that's all for now. Thank you for your help and clarification. I will take the necessary steps to address the billing concerns and explore the online payment options.

Agent 2: You're welcome, John. I'm glad I could assist you today. If you have any further questions or need any additional support, don't hesitate to reach out to us. Have a great day!

Customer: Thank you, Agent 2. You too. Goodbye.

Agent 2: Goodbye, John. Take care.",neutral,2,Billing and Payments,unresolved
"Agent 1: Thank you for calling ElectricVolt, this is Agent 1 speaking. How can I assist you today?

Customer: Hi, my name is Emily Johnson. I'm calling regarding my recent bill from ElectricVolt.

Agent 1: Hello, Emily. I'm here to help you with any billing and payment inquiries you may have. Could you please provide me with your account number or address?

Customer: Sure, my account number is 123456789.

Agent 1: Thank you, Emily. I have pulled up your account. How can I assist you with your bill?

Customer: I recently received my bill, and I noticed that the amount seems higher than usual. I was wondering if you could help me understand the charges.

Agent 1: I can definitely look into that for you, Emily. Let me review your bill and check the charges. It may take a moment, so please bear with me.

Customer: No problem, take your time.

Agent 1: Thank you for your patience, Emily. After reviewing your bill, I see that the increase in charges is due to a higher electricity consumption during the billing period. Have you noticed any changes in your energy usage recently?

Customer: Well, I haven't made any major changes, but I did have some guests staying over for a few weeks. Could that have contributed to the higher consumption?

Agent 1: Absolutely, Emily. Additional guests and increased usage of appliances can indeed lead to higher electricity consumption. It's always a good idea to keep an eye on your usage during such times. Is there anything specific you would like me to explain further on your bill?

Customer: Thank you for clarifying that, Agent 1. I noticed a late payment fee on my bill as well. I thought I had paid on time, so I'm a bit confused about that charge.

Agent 1: I apologize for any confusion, Emily. Let me check the payment history on your account to determine the reason for the late fee. Please give me a moment.

Customer: Sure, take your time.

Agent 1: Thank you for waiting, Emily. I have checked your payment history, and it appears that your payment was received two days after the due date, resulting in the late fee. Can you confirm the method and date of your payment?

Customer: I made the payment online through my bank's website, and I believe I made it on the due date itself.

Agent 1: I apologize for any inconvenience caused, Emily. Sometimes delays in processing payments can occur due to various factors. To avoid such issues in the future, I recommend making your payment a few days in advance of the due date to ensure it is processed on time.

Customer: I understand. Thank you for explaining that. Is there any way to waive the late fee this time?

Agent 1: I understand your concern, Emily. Let me check if there's any possibility of waiving the late fee in this situation. Please hold on for a moment.

Customer: Sure, thank you.

Agent 1: Thank you for your patience, Emily. I have spoken with my supervisor, and considering your previous payment history, we will make a one-time exception and waive the late fee for you. Is there anything else I can assist you with?

Customer: That's great to hear, Agent 1. I appreciate your help with this matter. No, that's all for now. Thank you for your assistance.

Agent 1: You're welcome, Emily. I'm glad I could assist you. If you have any further questions or concerns in the future, don't hesitate to reach out to us. Have a great day!

Customer: Thank you, Agent 1. You too. Goodbye!

Agent 1: Goodbye, Emily. Take care!",neutral,1,Billing and Payments,resolved
"[Phone ringing]

Agent 2: Good morning, thank you for calling ElectricVolt. This is Agent 2 speaking. How may I assist you today?

Customer: Hi Agent 2, my name is Sarah Johnson. I recently moved into a new house and I need some electrical services. I'm happy to find a company that specializes in both residential and commercial services.

Agent 2: Hello, Sarah! It's great to hear that you're happy with our services. We pride ourselves in providing top-notch electrical services. How can we assist you today?

Customer: Well, I have some accessibility and special needs requirements in my new home. I need to make sure that the electrical installations are suitable for my needs. Can you help me with that?

Agent 2: Absolutely, Sarah. We understand the importance of accessibility and special needs accommodations. We have experienced electricians who can assess your requirements and provide customized solutions. Would you like to schedule an appointment for an assessment?

Customer: Yes, that would be perfect. I would like to schedule an appointment as soon as possible. I want to make sure everything is in order before I start settling in.

Agent 2: Not a problem, Sarah. Let me check our availability. How about this Friday at 3:00 PM? Does that work for you?

Customer: That works perfectly for me. Please go ahead and schedule it.

Agent 2: Alright, Sarah. I have scheduled an appointment for this Friday at 3:00 PM. Our electrician will visit your home and assess your accessibility and special needs requirements. Is there anything else I can assist you with?

Customer: Actually, I have a few more questions. Will the electrician be able to provide recommendations for any necessary modifications or upgrades?

Agent 2: Yes, our electrician will be able to provide recommendations based on their assessment. They will evaluate your current electrical system and make suggestions for any modifications or upgrades that may be needed to meet your accessibility and special needs requirements.

Customer: That's great to hear. I also wanted to inquire about the cost of these modifications. Will it be an additional expense?

Agent 2: The cost will depend on the specific modifications and upgrades required. Our electrician will provide you with a detailed quote after the assessment. They will discuss the options with you and ensure that you have a clear understanding of the costs involved. We strive to provide transparent pricing and ensure our customers are well-informed about any expenses.

Customer: That's reassuring. I appreciate your transparency. One more thing, will the modifications be done by ElectricVolt or will I need to hire a separate contractor?

Agent 2: In most cases, ElectricVolt will be able to handle the modifications and upgrades required. Our electricians are skilled and experienced in various electrical installations. However, if any specialized work is needed beyond our expertise, we will work with you to find a trusted contractor who can assist with those specific needs.

Customer: That's good to know. I'm glad to hear that ElectricVolt can handle most of the modifications. I feel more confident in choosing your company for this task.

Agent 2: We're delighted to hear that, Sarah. Our goal is to provide comprehensive electrical services that meet our customers' needs and exceed their expectations. Is there anything else I can assist you with?

Customer: No, Agent 2. You've been extremely helpful. Thank you for answering all my questions and scheduling the appointment. I'm looking forward to meeting the electrician on Friday.

Agent 2: You're most welcome, Sarah. It's been a pleasure assisting you. If you have any further questions or concerns, please don't hesitate to reach out to us. Have a wonderful day!

Customer: Thank you, Agent 2. You have a wonderful day too. Goodbye!

Agent 2: Goodbye, Sarah. Take care!",happy,2,Accessibility and Special Needs,resolved
"[Phone ringing]

Agent 1: Good morning, thank you for calling ElectricVolt. This is Agent 1 speaking. How may I assist you today?

Customer: Hi, Agent 1. My name is Sarah Johnson. I'm calling regarding my account with ElectricVolt. I recently moved to a new house and I need to update my billing address.

Agent 1: Good morning, Sarah. Thank you for reaching out. I'll be happy to help you with that. Could you please provide me with your account number or address so I can locate your account?

Customer: Sure, my account number is 123456789.

Agent 1: Thank you, Sarah. I've located your account. Congratulations on your new home! Could you please provide me with your new billing address?

Customer: Thank you! My new address is 123 Main Street, Anytown, USA.

Agent 1: Thank you for providing the new address, Sarah. I have updated it in our system. Is there anything else I can assist you with?

Customer: Actually, I have one more question. I've noticed that my last bill seems higher than usual. Could you please explain the charges?

Agent 1: Of course, Sarah. I'll be happy to assist you. Let me take a look at your billing history. It seems like there was a slight increase in your usage for the last billing cycle. Did you use any additional electrical devices or appliances during that time?

Customer: Not that I'm aware of. Everything was pretty much the same as before. Is there any way to verify this?

Agent 1: Absolutely, Sarah. We can send a technician to your new address to perform an energy audit. They will check for any possible issues that might be causing the increased usage. Would you like to schedule an appointment?

Customer: Yes, please. That would be great. I want to make sure everything is in order. 

Agent 1: Alright, Sarah. I've scheduled a technician to visit your address on Friday between 9 am and 12 pm. Is there anything else I can assist you with?

Customer: No, that would be all for now. Thank you for your help, Agent 1.

Agent 1: You're welcome, Sarah. It was my pleasure assisting you today. If you have any further questions or concerns, don't hesitate to reach out. Have a great day!

Customer: Thank you, Agent 1. You too. Goodbye.

Agent 1: Goodbye, Sarah. Take care.",neutral,1,Account Management,resolved
