call_transcript,mood,agent_number,intention,resolution
"[Phone rings]

Agent 1: Thank you for calling ElectricVolt, this is Agent 1 speaking. How may I assist you today?

Customer: Finally, someone answers! I've been trying to get a hold of your company for days. I am beyond angry with the service I've been receiving!

Agent 1: I apologize for the delay in getting back to you, sir. I understand you're frustrated, and I'm here to help. Can you please provide me with your name and account number so I can better assist you?

Customer: My name is John Smith, and my account number is 123456789.

Agent 1: Thank you, Mr. Smith. I see here that you're calling regarding account management. How may I assist you with that?

Customer: Well, first of all, I've been receiving incorrect invoices for the past three months. I've called multiple times to get this sorted out, but nothing has been done about it. This is unacceptable!

Agent 1: I apologize for the inconvenience, Mr. Smith. Let me take a look at your account and investigate this issue further. While I do that, could you please provide me with some details about the incorrect invoices you've been receiving?

Customer: Each month, the amount on the invoice is significantly higher than what I actually owe. I've checked my usage, and it doesn't add up. I'm being overcharged, and it needs to be fixed immediately!

Agent 1: I understand your frustration, Mr. Smith. I will definitely look into this matter for you. In the meantime, can you please verify the meter reading on your latest invoice?

Customer: I don't have the invoice in front of me right now, but I remember the reading being 500 kilowatt-hours. I hope that helps.

Agent 1: Thank you for providing that information, Mr. Smith. I will investigate the meter reading and compare it to our records. While I do that, is there anything else you would like to discuss regarding your account?

Customer: Well, besides the incorrect invoices, I've also been experiencing frequent power outages in my area. This is causing a lot of inconvenience for me and my family. I want to know what ElectricVolt is doing to resolve this issue.

Agent 1: I apologize for the inconvenience caused by the power outages, Mr. Smith. Our company is committed to providing reliable electrical services, and I understand your frustration. Let me check our system for any reported outages in your area and see if there's any ongoing maintenance work that might be causing this issue.

Customer: It's not just about the outages; it's the lack of communication from your company. I've tried reaching out to your customer service department, but no one has been able to give me any updates or answers. This is completely unacceptable!

Agent 1: I apologize for the lack of communication, Mr. Smith. Our customer service department should have provided you with regular updates regarding the power outages. I assure you that I will personally look into this matter and ensure that you receive the necessary information moving forward.

Customer: I appreciate your understanding, but honestly, I'm tired of all the issues I've been facing with ElectricVolt. I'm seriously considering switching to a different electrical service provider if these problems aren't resolved soon.

Agent 1: I completely understand your frustration, Mr. Smith, and I don't want you to feel that way. Please allow me some more time to investigate the incorrect invoices and power outages in your area. I will personally follow up with you once I have more information and a resolution to these issues.

Customer: Fine, but I expect a prompt resolution. I've been patient for far too long.

Agent 1: I understand your urgency, Mr. Smith, and I assure you that I will do everything in my power to resolve these issues as quickly as possible. Thank you for bringing them to my attention. Is there anything else I can assist you with today?

Customer: No, that's all for now. Just make sure you keep your word and get these issues resolved soon.

Agent 1: I give you my word, Mr. Smith, that I will personally see to it that these issues are resolved promptly. Thank you for your patience and understanding. Have a great day!

Customer: Goodbye.

[Call ends]",angry,1,Account Management,unresolved
"Agent 1: Thank you for calling ElectricVolt, this is Agent 1 speaking. How can I assist you today?

Customer: Hi Agent 1, I'm John Smith and I'm a happy customer of ElectricVolt. I have a few questions regarding regulatory compliance and legal inquiries.

Agent 1: Hello John Smith, I'm glad to hear that you're a satisfied customer of ElectricVolt. I'll be more than happy to help you with your concerns. What specific questions do you have regarding regulatory compliance and legal inquiries?

Customer: Well, I recently heard about some changes in electrical regulations in our area and I wanted to make sure that ElectricVolt is fully compliant with them.

Agent 1: That's a great question, John. At ElectricVolt, we prioritize regulatory compliance to ensure the safety and satisfaction of our customers. We work closely with local authorities and regularly update our procedures to meet all electrical regulations in your area. Is there a specific regulation you're concerned about?

Customer: I'm not aware of any specific regulation, but I want to ensure that your company follows all the necessary guidelines and safety measures.

Agent 1: Absolutely, John. We have a dedicated team that closely monitors and stays up-to-date with all electrical regulations. Our technicians undergo regular training to ensure they are aware of any changes and are equipped to provide services in compliance with these regulations. We take safety seriously and strive to exceed the requirements set by the authorities.

Customer: That's reassuring to hear. I also wanted to know if ElectricVolt has any insurance coverage in case of accidents or damages during electrical work.

Agent 1: Yes, John. ElectricVolt carries comprehensive insurance coverage to protect both our customers and our technicians. Our insurance policy covers any accidents or damages that may occur during electrical work. We understand the importance of providing a worry-free experience for our customers, and our insurance coverage is part of that commitment.

Customer: That's great to know. It gives me peace of mind to know that your company takes responsibility for any unforeseen circumstances. 

Agent 1: We're glad to provide you with that peace of mind, John. Is there anything else you would like to know about regulatory compliance or legal inquiries?

Customer: Actually, I have one more question. If I were to encounter any issues related to electrical work done by ElectricVolt, what is the process for resolving such issues?

Agent 1: If you encounter any issues with our services, we encourage you to reach out to our customer support team as soon as possible. They will collect all relevant information and initiate an investigation into the matter. Our aim is to resolve any issues promptly and to your satisfaction. We value your feedback and will do everything we can to address any concerns you may have.

Customer: That sounds fair. I appreciate your commitment to resolving any issues that may arise. I'm really happy with the services provided by ElectricVolt and these answers have only strengthened my trust in your company.

Agent 1: Thank you, John. We're delighted to hear that you're satisfied with our services and that we could address your concerns. It's our pleasure to serve you as a valued customer of ElectricVolt. Is there anything else I can assist you with today?

Customer: No, that's all I needed to know. Thank you for your time and for providing me with the information I needed. Keep up the great work!

Agent 1: You're welcome, John! Thank you for choosing ElectricVolt and for your kind words. We appreciate your support and trust in our company. If you have any further questions or need assistance in the future, don't hesitate to reach out. Have a wonderful day!

Customer: You too, Agent 1. Goodbye!",happy,1,Regulatory Compliance and Legal Inquiries,resolved
"Agent 3: Thank you for calling ElectricVolt. My name is Agent 3. How can I assist you today?

Customer: Hi, Agent 3. I have a few questions regarding regulatory compliance and legal inquiries related to your electrical services.

Agent 3: Of course, I'd be happy to help. Could you please provide me with your name and contact information?

Customer: My name is Jane Smith, and my phone number is 555-1234.

Agent 3: Thank you, Jane. How may I assist you with your regulatory compliance and legal inquiries?

Customer: I recently installed solar panels on my roof, and I want to ensure that all the electrical work is compliant with local regulations and standards. Can you provide me with some information on this?

Agent 3: Absolutely, Jane. We take regulatory compliance very seriously. Our team of electricians is well-versed in local regulations and standards. We ensure that all electrical work is done in compliance with the necessary guidelines.

Customer: That's good to hear. Are there any specific permits or licenses required for installing solar panels in my area?

Agent 3: The requirements for permits and licenses vary based on your location. I can certainly assist you with that. Can you please provide me with your address?

Customer: Sure, my address is 123 Main Street.

Agent 3: Thank you, Jane. Let me check the requirements for your area. Please bear with me for a moment.

(Customer and Agent 3 wait for a moment.)

Agent 3: Jane, based on your address, you will need to obtain a building permit and an electrical permit from your local municipality before installing solar panels. I can assist you with the application process if you'd like.

Customer: That would be great. Can you provide me with the necessary paperwork and guidance to complete the application?

Agent 3: Certainly, Jane. I will email you the required paperwork along with a detailed guide on how to complete the application. It's important to note that each municipality may have slightly different requirements, so it's always a good idea to consult with your local authorities as well.

Customer: Thank you, Agent 3. That's very helpful. I appreciate your assistance.

Agent 3: You're welcome, Jane. Do you have any other questions or concerns regarding regulatory compliance or legal inquiries?

Customer: Yes, I have one more question. Are your electricians insured and licensed?

Agent 3: Absolutely, Jane. All our electricians are fully insured and licensed. We prioritize the safety and satisfaction of our customers, and that includes ensuring our team is qualified and properly certified.

Customer: That's reassuring to hear. Thank you once again, Agent 3, for addressing my concerns. I feel more confident moving forward with the solar panel installation.

Agent 3: You're very welcome, Jane. I'm glad I could assist you. If you have any other questions in the future, don't hesitate to reach out to us. We're always here to help. Have a great day!

Customer: You too, Agent 3. Goodbye!

Agent 3: Goodbye, Jane. Take care!",neutral,3,Regulatory Compliance and Legal Inquiries,resolved
"Agent 1: Thank you for calling ElectricVolt. My name is Agent 1. How may I assist you today?

Customer: Hi Agent 1, my name is Jessica Turner. I recently used your electrical services and I just wanted to call and provide some feedback and suggestions.

Agent 1: Hello Jessica, thank you for reaching out. We appreciate your feedback. We always strive to improve our services. Could you please tell me about your experience with ElectricVolt?

Customer: Sure! I just want to say that I am extremely happy with the service I received. The electrician who came to my house was professional, knowledgeable, and completed the job efficiently. I was also impressed with how quickly ElectricVolt responded to my request for service. Overall, it was a great experience.

Agent 1: That's wonderful to hear, Jessica! We're glad to know that you had a positive experience with our electrician and that we were able to address your needs promptly. Is there anything specific you would like to suggest or any areas where you think we can improve?

Customer: Actually, yes. While the service itself was excellent, I think it would be helpful if you could provide more detailed estimates upfront. I understand that electrical work can be unpredictable, but having a better idea of the potential costs would help customers plan their budget accordingly.

Agent 1: Thank you for your suggestion, Jessica. We understand the importance of transparency when it comes to pricing. We will definitely take that into consideration and work towards providing more detailed estimates to our customers. Is there anything else you would like to share?

Customer: Yes, one more thing. It would be great if ElectricVolt could offer some sort of loyalty program or discounts for repeat customers. I plan on using your services again in the future, and it would be nice to be rewarded for my loyalty.

Agent 1: We appreciate your loyalty, Jessica, and we value your suggestion. We'll definitely explore the possibility of implementing a loyalty program or offering discounts for our repeat customers. Your feedback helps us improve our services and cater to our customers' needs better.

Customer: That's great to hear, Agent 1. I'm glad my feedback is being taken seriously. Is there anything else you need from me?

Agent 1: Not at the moment, Jessica. We've noted down your feedback and suggestions, and we'll make sure they reach the relevant teams for consideration. Is there anything else I can assist you with today?

Customer: No, that's all for now. I just wanted to make sure my voice was heard. Thank you for your time and for addressing my feedback, Agent 1.

Agent 1: You're welcome, Jessica. We appreciate your call and your valuable feedback. If you have any other suggestions or need any further assistance in the future, please don't hesitate to reach out to us. Have a wonderful day!

Customer: Thank you, Agent 1. You too! Goodbye!",happy,1,Feedback and Suggestions,resolved
"Agent 3: Thank you for calling ElectricVolt. My name is Agent 3. How may I assist you today?

Customer: Finally, someone answered! I've been trying to reach your company for days. Your service is terrible!

Agent 3: I apologize for the inconvenience, sir. I understand your frustration. How can I help you today?

Customer: I need to know why my electricity bill has suddenly skyrocketed. I haven't changed anything in my usage, and it's way higher than usual!

Agent 3: I'm sorry to hear that, sir. Let me check that for you. Could you please provide me with your account number?

Customer: It's 12345678.

Agent 3: Thank you. I see your account here. It appears that there was a mistake in the meter reading last month, which resulted in an underestimation of your bill. As a result, this month's bill reflects the corrected usage from the previous month.

Customer: Are you kidding me? So, I have to pay for your mistake? This is ridiculous!

Agent 3: I completely understand your frustration, sir. I apologize for any inconvenience caused by this error. I'll make a note of this issue and escalate it to our billing department. They will review your case and adjust your bill accordingly.

Customer: It better be adjusted! This is unacceptable. How long will it take for this to be resolved?

Agent 3: I can't provide an exact timeframe, but our billing department usually resolves such issues within 7-10 business days. Rest assured, we will do our best to expedite the process for you.

Customer: Fine, but I expect a call back as soon as it's resolved. This is really causing me stress.

Agent 3: I understand, sir. I will make a note to have someone from our billing department contact you once the issue is resolved. Is there anything else I can assist you with today?

Customer: No, that's all for now. But I hope this gets resolved soon. Thank you for your help.

Agent 3: You're welcome, sir. I apologize again for the inconvenience. We will do our best to resolve this matter promptly. If you have any further questions or concerns, don't hesitate to reach out to us. Have a great day.

Customer: Goodbye.",angry,3,Inquiries and General Information,unresolved
"Agent 2: Thank you for calling ElectricVolt, my name is Agent 2. How may I assist you today?

Customer: Hi Agent 2, my name is Emily Smith. I'm experiencing an electrical outage at my residence and I was hoping you could help me out.

Agent 2: Of course, Emily! I'm sorry to hear about the outage. Don't worry, we'll get it sorted out for you. Can you please provide me with your address so I can locate your account?

Customer: Sure, my address is 123 Main Street, Anytown.

Agent 2: Thank you, Emily. I've located your account. It seems that there is a reported outage in your area. Our technicians are already working on it. We apologize for the inconvenience caused. Do you have any other electrical devices that are affected by the outage?

Customer: Yes, Agent 2. My refrigerator and air conditioning are not working either. I hope this gets fixed soon, especially with the summer heat.

Agent 2: I understand your concerns, Emily. Our technicians are doing their best to resolve the outage as quickly as possible. In the meantime, I can provide you with some tips to help keep your food safe during the outage. Would that be helpful?

Customer: Yes, please. I appreciate any advice you can give me.

Agent 2: Alright, Emily. Firstly, try to keep the refrigerator and freezer doors closed as much as possible to maintain the temperature inside. You can also use ice packs or bags of ice to keep the food cold. If the outage lasts longer than 4 hours, it's recommended to discard any perishable items. Once the power is restored, it's important to check the food for spoilage before consuming.

Customer: Thank you for the tips, Agent 2. I'll make sure to follow them. Is there any estimate on when the power will be restored?

Agent 2: I'm sorry, Emily, but I don't have an exact timeframe. However, rest assured that our technicians are working diligently to resolve the issue as quickly as possible. Is there anything else I can assist you with?

Customer: No, that's all, Agent 2. I appreciate your help and the information provided. I hope the power comes back soon.

Agent 2: You're most welcome, Emily. We understand how inconvenient power outages can be, especially during emergencies. If you have any further questions or concerns, please don't hesitate to reach out to us. Thank you for choosing ElectricVolt, and have a great day!

Customer: Thank you, Agent 2. I will definitely contact you if I have any more concerns. Have a great day too!",happy,2,Outages and Emergencies,resolved
"[Phone ringing]

Agent 1: Thank you for calling ElectricVolt, this is Agent 1 speaking. How may I assist you today?

Customer: Hi Agent 1, my name is Sarah Johnson. I've recently moved into a new house and I need to schedule an appointment for some electrical work.

Agent 1: Of course, Sarah! Congratulations on your new home. What kind of electrical work do you need assistance with?

Customer: Thank you! Well, I need to install some additional outlets in my living room and bedroom. I also need a ceiling fan installed in the master bedroom.

Agent 1: Noted, Sarah. We can definitely help you with that. Let me check our schedule to see when we can send a technician over to your place. Can you please provide me with your address?

Customer: Sure, it's 123 Main Street, Cityville.

Agent 1: Thank you, Sarah. I have your address here. Our earliest available appointment is this Friday at 10 AM. Does that work for you?

Customer: That works perfectly for me, Agent 1. Please go ahead and schedule the appointment.

Agent 1: Alright, I have scheduled the appointment for this Friday at 10 AM. Our technician will be there to assist you with the installation of additional outlets and the ceiling fan. Is there anything else you would like to add?

Customer: Actually, yes. I have been experiencing some flickering lights in my kitchen. Could the technician also take a look at that while they're here?

Agent 1: Absolutely, Sarah. I'll add a note to the appointment for our technician to inspect the flickering lights in your kitchen as well. We'll make sure to address that for you.

Customer: Great, thank you so much, Agent 1. I really appreciate your help.

Agent 1: You're welcome, Sarah. It's our pleasure to assist you. Is there anything else I can assist you with today?

Customer: That's all for now, Agent 1. Thank you again for your excellent service.

Agent 1: You're very welcome, Sarah. If you have any further questions or concerns, don't hesitate to give us a call. Have a wonderful day!

Customer: You too! Goodbye, Agent 1.

Agent 1: Goodbye, Sarah. Take care!

[Call ends]",happy,1,Service Requests and Appointments,unresolved
"Agent 2: Thank you for calling ElectricVolt. This is Agent 2. How may I assist you today?

Customer: Hi Agent 2, my name is Sarah Johnson. I'm a happy customer of ElectricVolt. I have a question regarding my billing and payments.

Agent 2: Hi Sarah, it's great to have a happy customer like you. I'll be happy to help you with your billing and payment question. What seems to be the issue?

Customer: Well, I recently received my bill and noticed that the amount due is higher than usual. I want to understand why there is an increase in my bill.

Agent 2: I apologize for the confusion, Sarah. Let me pull up your account and check the details for you. Can you please provide me with your account number?

Customer: Sure, my account number is 123456789.

Agent 2: Thank you for providing that information, Sarah. I see that there is a change in your bill this month due to an increase in your electricity consumption. Have there been any changes in your energy usage recently?

Customer: No, I haven't made any significant changes in my energy usage. It's been the same as usual.

Agent 2: I understand your concern, Sarah. In that case, I will investigate further to ensure there are no errors in your billing. Could you please give me a moment while I review your meter readings and usage history?

Customer: Of course, take your time. I appreciate your help.

Agent 2: Thank you for your patience, Sarah. After reviewing your usage history, I have identified the issue. It seems that there was a misread in your meter last month, which resulted in a lower bill. The current bill reflects the corrected readings, leading to a higher amount.

Customer: Oh, I see. So, it was just a mistake in the meter reading. I'm glad you were able to identify the issue. What do I need to do now?

Agent 2: I apologize for the inconvenience caused, Sarah. To rectify this, I will make the necessary adjustments to your account. You will receive a revised bill reflecting the correct amount due. Please disregard the previous bill.

Customer: That sounds good, Agent 2. I appreciate your quick response and resolution. Is there anything else I need to do?

Agent 2: No, Sarah. You don't need to take any further action. The revised bill will be sent to you within the next few days. Is there anything else I can assist you with today?

Customer: No, that's all I needed help with. Thank you so much for your assistance, Agent 2. I'm happy with the prompt resolution.

Agent 2: You're most welcome, Sarah. I'm glad I could help. If you have any more questions or concerns in the future, don't hesitate to reach out to us. Have a wonderful day!

Customer: Thank you, Agent 2. You too! Goodbye.

Agent 2: Goodbye, Sarah. Take care!",happy,2,Billing and Payments,resolved
