call_transcript,mood,agent_number,intention,resolution
"Agent 2: Thank you for calling ElectricVolt, my name is Agent 2. How may I assist you today?

Customer: Hi, Agent 2. I'm experiencing some electrical issues at my residence and I'm hoping you can help me troubleshoot.

Agent 2: Of course, I'll do my best to assist you. Can you please provide me with your name and address?

Customer: Sure, my name is John Smith and my address is 123 Main Street.

Agent 2: Thank you, John. Could you please explain the specific issues you're facing?

Customer: Well, I've been noticing flickering lights in multiple rooms of my house. It's been happening for a few days now and I'm not sure what's causing it.

Agent 2: I see. Flickering lights can be caused by a variety of factors. Let's start by checking your circuit breaker. Can you go to your electrical panel and let me know if any of the breakers are tripped?

Customer: Okay, let me go check. Give me a moment.

(Customer puts the call on hold and checks the circuit breaker)

Customer: I'm back. It looks like all the breakers are in the ON position. None of them are tripped.

Agent 2: Thank you for checking, John. In that case, it's possible that the issue lies with a loose connection or a faulty light fixture. Have you noticed any specific patterns when the lights flicker?

Customer: Not really. It happens randomly throughout the day, in different rooms. Sometimes it's just a quick flicker, and other times the lights dim for a few seconds.

Agent 2: Alright, it seems like we may need to send one of our technicians to your location to further investigate the issue. Would you be available for a technician to visit your home tomorrow?

Customer: Yes, that works for me. What's the timeframe for the visit?

Agent 2: Our technician will be available between 10 am and 2 pm. Is there a preferred time within that window?

Customer: Anytime between 10 am and 12 pm would be great.

Agent 2: Perfect. I have scheduled a technician visit for you tomorrow between 10 am and 12 pm. They will diagnose the problem and provide a solution to resolve the flickering lights. Is there anything else you would like to discuss or any other concerns?

Customer: No, that's all for now. I appreciate your help, Agent 2.

Agent 2: You're welcome, John. We're here to assist you. If you have any questions or need further support, don't hesitate to call us back. Have a great day!

Customer: Thank you, Agent 2. You too. Goodbye.

Agent 2: Goodbye, John. Take care.",neutral,2,Technical Support and Troubleshooting,resolved
"Agent 3: Thank you for calling ElectricVolt. This is Agent 3 speaking. How may I assist you today?

Customer: Hi, Agent 3. My name is Sarah Thompson, and I'm calling because I have some complaints and grievances regarding the electrical services your company provided at my residence.

Agent 3: I'm sorry to hear that, Sarah. I'll do my best to address your concerns. Could you please provide me with some more details about the issues you've been facing?

Customer: Well, I recently had some electrical work done by ElectricVolt at my home. The technicians were supposed to fix some faulty wiring and install a new lighting fixture. However, after they completed the job, I noticed that some of the lights in my house were flickering and the new fixture was not working properly.

Agent 3: I apologize for the inconvenience, Sarah. I understand how frustrating that can be. Let me check our records to see which technician worked on your project and what might have gone wrong. Can you please provide me with your address so I can look up the details?

Customer: Sure, my address is 123 Main Street.

Agent 3: Thank you. Let me pull up your file. I see here that Technician 5 was assigned to your project. We'll make sure to address this issue and have a supervisor reach out to you to schedule a revisit and resolve the problem. Is there anything else you would like to discuss or any other concerns you have?

Customer: Actually, yes. During the installation, the technicians accidentally damaged a wall in my living room. They assured me that they would take care of the repairs, but it has been over two weeks, and no one from ElectricVolt has come to fix it.

Agent 3: I apologize for the delay in resolving that issue, Sarah. I understand your frustration. Let me make a note of it and prioritize the repair work. I'll personally follow up with our team to ensure that your wall is fixed as soon as possible. Is there anything else you would like to add?

Customer: No, that covers everything. I just hope these issues can be resolved quickly and efficiently.

Agent 3: I completely understand, Sarah. Resolving these issues is our top priority, and I assure you that we will work diligently to address them. Once again, I apologize for any inconvenience caused. Thank you for bringing these concerns to our attention. Is there anything else I can assist you with today?

Customer: No, that's all for now. I appreciate your attention to these matters, Agent 3.

Agent 3: You're welcome, Sarah. We value your feedback, and I assure you that we will do everything we can to provide a satisfactory resolution. If you have any further questions or concerns, please don't hesitate to reach out to us. Have a great day!

Customer: Thank you, Agent 3. Goodbye.",neutral,3,Complaints and Grievances,unresolved
"Agent 2: Thank you for calling ElectricVolt. My name is Agent 2. How can I assist you today?

Customer: Hi Agent 2, my name is John Smith. I recently moved into a new house and I need some electrical services done. I have a few questions regarding accessibility and special needs.

Agent 2: Hi John, it's great to have you as a customer. I'll be happy to help you with your questions. What specific concerns do you have regarding accessibility and special needs?

Customer: Well, I have a family member who uses a wheelchair, so I want to ensure that our home is accessible for them. I was wondering if ElectricVolt provides any services related to that.

Agent 2: Absolutely, John. We understand the importance of accessibility and can certainly assist you with that. We offer a range of services to make your home wheelchair-friendly, such as installing ramps, widening doorways, and optimizing lighting and switches for easy access. Our team of experienced electricians will be able to assess your specific needs and provide tailored solutions.

Customer: That's great to hear! How long does the process usually take, and what are the associated costs?

Agent 2: The duration and cost of the project can vary depending on the extent of modifications required. To provide you with an accurate estimate, we would need to schedule an on-site visit by one of our technicians. They will assess your home and discuss your requirements in detail. Once we have all the necessary information, we can provide you with a timeframe and cost estimate.

Customer: That sounds reasonable. I appreciate the personalized approach. Are there any additional services or features you offer for customers with special needs?

Agent 2: Absolutely, John. In addition to the modifications I mentioned earlier, we also offer services like installing accessible outlets and switches at convenient heights, installing grab bars in bathrooms, and even setting up home automation systems that can be controlled remotely or through voice commands. Our goal is to provide a safe and comfortable living environment for all our customers.

Customer: That's fantastic! It's reassuring to know that ElectricVolt has a comprehensive range of services to cater to different needs. Are there any warranties or guarantees for the work done?

Agent 2: Yes, John. We take pride in our workmanship and stand behind the quality of our services. We offer warranties on both our labor and the materials used in the projects. The exact warranty details will be discussed and provided to you once we finalize the scope of work. Rest assured, we will ensure that you are satisfied with the end result.

Customer: That's great to hear. It's important for us to have peace of mind when making such modifications to our home. I'm glad ElectricVolt offers these warranties. Is there anything else I should know or consider before moving forward with the project?

Agent 2: It's always a good idea to check with your local building codes and regulations to ensure that any modifications we make comply with the requirements. Additionally, please let us know if there are any specific concerns or requirements you have for your family member's accessibility. Our team will do their best to accommodate them. If you have any other questions or need further assistance, feel free to reach out to us anytime.

Customer: Thank you, Agent 2. You've been very helpful and informative. I will definitely check the local building codes and discuss any specific concerns with my family member. I appreciate your time and assistance.

Agent 2: You're welcome, John. It was a pleasure assisting you. We look forward to helping you create a more accessible and comfortable home. If you need any further assistance, don't hesitate to reach out. Have a great day!

Customer: Thank you, Agent 2. Have a great day too! Goodbye.

Agent 2: Goodbye, John. Take care!",neutral,2,Accessibility and Special Needs,resolved
"Agent 3: Good afternoon, thank you for calling ElectricVolt. My name is Agent 3. How may I assist you today?

Customer: Hi Agent 3, my name is Sarah Johnson. I have a question regarding accessibility and special needs services provided by ElectricVolt.

Agent 3: Hi Sarah, thank you for reaching out. I'll be happy to help you with any questions you have about our accessibility and special needs services. What specific information are you looking for?

Customer: Well, I recently moved into a new house and I have some mobility challenges. I would like to know if ElectricVolt offers any services or accommodations for individuals with special needs.

Agent 3: Absolutely, Sarah. We understand the importance of accessibility for all our customers. ElectricVolt provides a range of services specifically designed to meet the needs of individuals with special requirements. These services include installing ramps, handrails, and other accessibility features. We also offer adaptive technology installation and wiring for customers with specific requirements.

Customer: That's great to hear! Can you tell me more about the adaptive technology installation you mentioned?

Agent 3: Of course! Adaptive technology installation involves incorporating devices and systems that enhance accessibility and convenience for individuals with special needs. This can include things like voice-activated lighting and appliances, smart home systems, and even customized electrical setups to accommodate specific equipment or medical devices. We have a team of experts who can assess your needs and provide tailored solutions for your home or business.

Customer: That sounds really helpful. How do I go about requesting these services?

Agent 3: It's quite simple, Sarah. All you need to do is provide us with some basic information about your requirements and schedule a consultation with one of our specialists. They will visit your property, assess your needs, and provide you with a detailed plan and cost estimate. Once you approve the plan, we'll schedule the installation at a time that works best for you.

Customer: That's great to know. Are there any additional charges for these specialized services?

Agent 3: While there may be additional charges for certain specialized equipment or materials, we strive to keep our services as affordable as possible. Our team will provide you with a transparent breakdown of all costs during the consultation, so you can make an informed decision. We also offer flexible payment options and work with various financing partners to ensure accessibility to our services.

Customer: That's reassuring. I appreciate the transparency. One more thing, do you have any available discounts for individuals with special needs?

Agent 3: Yes, Sarah, we do have certain discounts and promotions available for individuals with special needs. These discounts vary based on the specific services required, so I recommend discussing this with our specialist during the consultation. They will be able to provide you with more information and guide you through the available options.

Customer: Thank you for the information, Agent 3. I appreciate your help. I will definitely schedule a consultation to discuss my specific needs further.

Agent 3: You're welcome, Sarah. I'm glad I could assist you. If you have any more questions or need any further assistance, please don't hesitate to reach out. We're here to help you with all your electrical needs.

Customer: Thank you again, Agent 3. I will be in touch soon.

Agent 3: You're welcome, Sarah. Have a great day!

(Customer hangs up)",neutral,3,Accessibility and Special Needs,unresolved
"Agent 1: Thank you for calling ElectricVolt, my name is Agent 1. How may I assist you today?

Customer: Hi Agent 1, I'm Mrs. Johnson. I recently had some electrical work done at my house by ElectricVolt, and I have a few questions regarding regulatory compliance and legal inquiries.

Agent 1: Hello Mrs. Johnson, I'm glad to assist you with your concerns. Could you please provide me with some details about the electrical work that was done at your house?

Customer: Sure, we had some rewiring done in our basement and also had some new outlets installed in the kitchen. Everything seems to be working fine, but I just want to make sure that the work was done in compliance with all the necessary regulations and standards.

Agent 1: I completely understand your concerns, Mrs. Johnson. At ElectricVolt, we prioritize regulatory compliance and ensuring that all our work meets the required standards. I can assure you that our electricians are highly trained and experienced in adhering to all electrical codes and regulations.

Customer: That's great to hear. I also wanted to inquire about any legal implications or liabilities that may arise due to the electrical work. Is there any documentation or warranty provided by ElectricVolt to protect customers like me?

Agent 1: Absolutely, Mrs. Johnson. As part of our service, we provide a warranty for all the electrical work we undertake. This warranty covers any defects or issues that may arise due to our workmanship. Additionally, we have liability insurance to protect both our customers and our employees in case of any unforeseen accidents or damages.

Customer: That's reassuring to know. Can you please explain the warranty coverage in more detail?

Agent 1: Certainly, Mrs. Johnson. Our warranty covers any defects or issues that may arise due to faulty materials or workmanship for a period of one year from the date of service. If you encounter any problems during this time, our team will be happy to assess and address the issue at no additional cost to you.

Customer: That sounds fair. Is there any specific procedure I need to follow if I encounter any issues covered by the warranty?

Agent 1: Yes, Mrs. Johnson. If you experience any issues covered by the warranty, simply give us a call at our customer service number, and we will schedule a visit from one of our electricians to assess and resolve the problem. Our goal is to ensure your complete satisfaction with our services.

Customer: That's great to hear. I'm really happy with the work done by ElectricVolt so far, and I appreciate your assistance in addressing my concerns. Is there anything else I need to know regarding regulatory compliance or legal inquiries?

Agent 1: Not at the moment, Mrs. Johnson. However, if you have any further questions or concerns in the future, please don't hesitate to reach out to us. We are always here to assist you and provide any necessary information.

Customer: Thank you, Agent 1. I appreciate your help and the professionalism of ElectricVolt. Keep up the good work!

Agent 1: Thank you for your kind words, Mrs. Johnson. It was a pleasure assisting you today. Have a wonderful day!

Customer: You too, Agent 1. Goodbye!",happy,1,Regulatory Compliance and Legal Inquiries,resolved
"Agent 3: Thank you for calling ElectricVolt, my name is Agent 3. How may I assist you today?

Customer: Hi Agent 3, I'm John Smith, and I just wanted to say how impressed I am with the electrical services provided by ElectricVolt. I recently had some electrical work done at my home, and I couldn't be happier with the results!

Agent 3: Thank you so much for your kind words, John! We always strive to provide top-notch service to our customers. I'm glad to hear that you're satisfied with the work done. Is there anything specific you would like to share with us or any suggestions you might have?

Customer: Actually, Agent 3, I do have a few suggestions. While the overall service was exceptional, I think it would be helpful if the technicians could provide a more accurate time estimate for their arrival. On the day of the appointment, I was told they would arrive between 9 am and 12 pm, but they ended up coming closer to 1 pm.

Agent 3: I apologize for any inconvenience caused, John. We understand the importance of punctuality and will certainly address this issue with our technicians. Your feedback is valuable to us, and we'll make sure to improve our scheduling process to provide more accurate arrival times.

Customer: That's great to hear, Agent 3. Thank you for taking my suggestion into consideration. Another thing I noticed was that the technicians left some minor debris behind after completing the work. It wasn't a major issue, but it would be nice if they could tidy up after themselves.

Agent 3: I'm sorry for the oversight, John. Our technicians are trained to clean up after their work is done, and we'll reinforce this practice with them. We appreciate you bringing it to our attention, as it helps us maintain our high standards of service.

Customer: No problem, Agent 3. Overall, I'm extremely satisfied with ElectricVolt's services. The technicians were professional, knowledgeable, and completed the job efficiently. I've had experiences with other electrical companies in the past, but ElectricVolt stands out as the best. Keep up the great work!

Agent 3: Thank you for your kind words, John. We're thrilled to hear that you had a positive experience with our technicians. We take pride in delivering exceptional service to all our customers. Is there anything else you would like to share or any other suggestions you may have?

Customer: Actually, Agent 3, I have one more suggestion. It would be helpful if ElectricVolt could provide a more detailed breakdown of the costs involved in the electrical work. I understand that each job is unique, but having a clearer understanding of the expenses upfront would be beneficial.

Agent 3: That's a great suggestion, John. We appreciate your feedback, and we'll work on providing more transparent and detailed cost breakdowns to our customers. It's important for us to ensure that our customers have a clear understanding of the expenses involved in their electrical projects.

Customer: Thank you, Agent 3. I'm glad I could contribute to improving your services. ElectricVolt has been my go-to electrical company, and I will continue to recommend your services to friends and family.

Agent 3: We truly appreciate your loyalty and your recommendations, John. Your satisfaction is our top priority, and we'll continue to strive for excellence in all aspects of our service. Is there anything else I can assist you with today?

Customer: No, Agent 3, that's all for now. Thank you for your time, and once again, thank you to ElectricVolt for providing outstanding electrical services.

Agent 3: You're very welcome, John. It was a pleasure speaking with you, and we're grateful for your feedback. If you have any further questions or concerns in the future, please don't hesitate to reach out. Have a wonderful day!",happy,3,Feedback and Suggestions,resolved
"Agent 2: Thank you for calling ElectricVolt. My name is Agent 2. How can I assist you today?

Customer: Hi Agent 2! I'm Jane Smith, and I'm a happy customer of ElectricVolt. I have a few inquiries and would like some general information about your services.

Agent 2: Hello, Jane! I'm glad to hear that you're happy with our services. I'll be more than happy to help you with your inquiries. What specifically would you like to know?

Customer: Well, first of all, I'm considering installing some additional lighting fixtures in my living room. Can ElectricVolt provide assistance with that?

Agent 2: Absolutely, Jane! We offer a wide range of services, including installations. Our team of experienced electricians can definitely assist you with adding new lighting fixtures to your living room. You can schedule an appointment with us, and we'll send a technician to assess your needs and provide you with a quote.

Customer: That's great to hear! How soon can I schedule an appointment?

Agent 2: We value your time, Jane, and we strive to accommodate our customers as quickly as possible. Our scheduling is flexible, and we can usually arrange an appointment within the next few days. Is there a specific time that works best for you?

Customer: I have a busy schedule, but I can make myself available next Monday afternoon. Would that work?

Agent 2: Monday afternoon works perfectly fine, Jane. I'll note that down, and we'll have a technician visit you on Monday to discuss the details and provide you with a quote. Is there anything else you'd like to know about our services?

Customer: Actually, yes. I'm also considering upgrading my electrical panel. It's an old one, and I want to ensure it can handle the increasing load of modern appliances. Can ElectricVolt assist with that?

Agent 2: Absolutely, Jane. Upgrading your electrical panel is a wise decision, especially if you're experiencing frequent power fluctuations. Our team of experts can assess your current panel and recommend the most suitable upgrade for your needs. Would you like to schedule an appointment for that as well?

Customer: Yes, please. I think it's best to have it checked and upgraded if necessary. Can we schedule it for the same day as the lighting fixture appointment?

Agent 2: Of course, Jane. We can certainly schedule both appointments on the same day to save you time and ensure the technician can assess both aspects of your electrical system. We'll have the technician visit you on Monday afternoon to discuss both the lighting fixtures and the electrical panel upgrade. Is there anything else I can assist you with?

Customer: That's all for now, Agent 2. Thank you for your help and excellent customer service!

Agent 2: You're very welcome, Jane. It's been a pleasure assisting you today. If you have any further questions or need any additional information, don't hesitate to give us a call. Have a great day!

Customer: Thank you, Agent 2. Have a great day too! Goodbye!

Agent 2: Goodbye, Jane! Take care!",happy,2,Inquiries and General Information,resolved
